pubID,topicQuery,typeQuery,tweet,tokens,hashtags,mentions,likeCount,replyCount,retweetCount,authorID,authorName,authorUsername,authorCreatedAt,authorVerified,followersCount,followingCount,pubDate,pubYear,pubMonth,pubDay,pubHour,pubMinute,geoID,geoName,longitude,latitude
1182938655243018242,tránsito,palabras clave,"@SSP_CDMX 
Subsecretaría de control de tránsito

Es intencional ya por más de 6 meses que cierran 1 carril del Viaducto Miguel Alemán a la altura de Viaducto Tlalpan.

Provocando contaminación y caos vial hasta Periférico y Autopista Urbana Norte.

No es posible que no detecten.","['subsecretacer', 'control', 'tránsito', 'intencional', 'mes', 'cerrar', 'carril', 'viaducto', 'miguel', 'alemán', 'altura', 'viaducto', 'tlalpan', 'provocar', 'contaminación', 'cao', 'vial', 'periférico', 'autopistar', 'urbano', 'norte', 'posible', 'detectir']",[],['SSP_CDMX'],0,0,0,128365267,𝒥𝑜𝓇𝑔𝑒 𝒪𝓈𝓌𝒶𝓁𝒹𝑜,valdo97,2010-03-31 16:42:23,0,73,904,2019-10-12 03:38:48,2019,10,12,03,38,12,Tlalpan,19.1983396763,-99.2062207957
1182938954556989440,tránsito,palabras clave,"@SSP_CDMX @PGJDF_CDMX Subsecretaría de control de tránsito

Es intencional ya por más de 6 meses que cierran 1 carril del Viaducto Miguel Alemán a la altura de Viaducto Tlalpan.

Provocando contaminación y caos vial hasta Periférico y Autopista Urbana Norte.

No es posible que no detecten.","['subsecretacer', 'control', 'tránsito', 'intencional', 'mes', 'cerrar', 'carril', 'viaducto', 'miguel', 'alemán', 'altura', 'viaducto', 'tlalpan', 'provocar', 'contaminación', 'cao', 'vial', 'periférico', 'autopistar', 'urbano', 'norte', 'posible', 'detectir']",[],"['SSP_CDMX', 'PGJDF_CDMX']",0,0,0,128365267,𝒥𝑜𝓇𝑔𝑒 𝒪𝓈𝓌𝒶𝓁𝒹𝑜,valdo97,2010-03-31 16:42:23,0,73,904,2019-10-12 03:39:59,2019,10,12,03,39,12,Tlalpan,19.1983396763,-99.2062207957
1183050261184634880,tránsito,palabras clave,"Nos encontramos realizando obras de mantenimiento preventivo al Sistema Acuaferico, frente a la Universidad Cuauhtémoc, por lo que solicitamos a la ciudadanía utilizar vías alternas de tránsito y precaución al circular por el lugar de la obra.

#CEAteInforma https://t.co/Brxq1Arh2M","['encontrar', 'realizar', 'obra', 'mantenimiento', 'preventivo', 'sistema', 'acuaferico', 'frente', 'universidad', 'cuauhtemoc', 'solicitar', 'ciudadanir', 'utilizar', 'vía', 'alterno', 'tránsito', 'precaución', 'circular', 'lugar', 'obra']",['CEAteInforma'],[],8,0,6,1324845259,CEA Institucional,cea_qro,2013-04-03 09:28:30,0,18560,742,2019-10-12 11:02:16,2019,10,12,11,02,15,Cuauhtémoc,19.4313734294,-99.1490557562
1183053093811961857,tránsito,palabras clave,"Vehículos de #emergencia y la #CruzRojaMexicana acuden a Carretera Mexico Toluca, Cooperativa Palo Alto, Cuajimalpa de Morelos a auxiliar por un #accidente de #tránsito https://t.co/uLdhwLG6oM","['vehículo', 'acudir', 'carretera', 'mexico', 'toluca', 'cooperativo', 'palo', 'alto', 'cuajimalpa', 'more él', 'auxiliar']","['emergencia', 'CruzRojaMexicana', 'accidente', 'tránsito']",[],0,0,0,476050170,Cruz Roja CDMX,CruzRoja_CDMX,2012-01-27 12:27:33,0,43719,370,2019-10-12 11:13:32,2019,10,12,11,13,4,Cuajimalpa de Morelos,19.3246343001,-99.3107285253
1183233694691147776,tránsito,palabras clave,"Continuamos con los trabajos de manteniendo preventivo al Sistema Acuaferico, en Av Constituyentes frente a la Univ. Cuauhtémoc. Por favor circule con precaución en la zona de la obra, atendiendo las restricciones de tránsito. Agradecemos su comprensión.

#CEAteInforma https://t.co/hZZaWg05NZ","['continuamos', 'trabajo', 'mantener', 'preventivo', 'sistema', 'acuaferico', 'av', 'constituyente', 'frente', 'univ', 'cuauhtemoc', 'favor', 'circule', 'precaución', 'zón', 'obra', 'atender', 'restricción', 'tránsito', 'agradecer', 'comprensión']",['CEAteInforma'],[],7,1,7,1324845259,CEA Institucional,cea_qro,2013-04-03 09:28:30,0,18560,742,2019-10-12 23:11:10,2019,10,12,23,11,15,Cuauhtémoc,19.4313734294,-99.1490557562
1183445032650412032,tránsito,coordenadas,"@jimenadegortari @MoliereGranadas @vromog @MHAlcaldia En la zona de Ampliación Granada y @CarsoPlaza el ruido es una constante por tráfico, obras, borrachos, fiestas o la plaza, y @vromo y @XochitlGalvez fueron omisos pues le temen a Carso y constructores, con quienes hablan directo por celular pero no se atreven a tocarlos","['zonar', 'ampliación', 'granado', 'ruido', 'constante', 'tráfico', 'obra', 'borracho', 'fiesta', 'plaza', 'omiso', 'pues', 'temer', 'caso', 'constructor', 'hablar', 'directo', 'celular', 'atrevir', 'tocarlo']",[],"['jimenadegortari', 'MoliereGranadas', 'vromog', 'MHAlcaldia', 'CarsoPlaza', 'vromo', 'XochitlGalvez']",2,0,1,129826837,Lago Zurich🌳,TORRERENOIR,2010-04-05 08:49:38,0,1547,704,2019-10-13 13:10:57,2019,10,13,13,10,5,Gustavo A. Madero,-99.214274,19.4324414
1183559361936805888,incendio,palabras clave,"PRECAUCIÓN: Colonia Escuadrón 201 de Iztapalapa, dos personas (una niña de 7 años) resultaron lesionadas por arma de fuego. 🚑🚨 https://t.co/t9TUMZxYki","['precaución', 'colonia', 'escuadrón', '201', 'iztapalapar', 'dos', 'persona', 'niñar', 'año', 'resultar', 'lesionado', 'arma', 'fuego']",[],[],8,1,5,87350793,SUUMA Voluntarios 🚑,SUUMA_CDMX,2009-11-03 21:07:26,0,43179,86,2019-10-13 20:45:16,2019,10,13,20,45,7,Iztapalapa,19.3491663204,-99.0567989642
1183748968305627136,incendio,palabras clave,"#Precaución |

Se registra incendio de negocio en la colonia Villa Azcapotzalco, @AzcapotzalcoMx. 

 https://t.co/JwJTBlqZn0","['registrar', 'incendio', 'negocio', 'colonia', 'villa', 'azcapotzalco']",['Precaución'],['AzcapotzalcoMx'],8,0,7,293063533,JORGE BECERRIL JB/8,MrElDiablo8,2011-05-04 12:00:15,1,172288,888,2019-10-14 09:18:41,2019,10,14,09,18,2,Azcapotzalco,19.4853286147,-99.1821069423
1183774467887161346,tránsito,coordenadas,"De nuevo la gente perro o posiblemente la gente gato ataca de nuevo obstruyendo el tráfico vial en la CDMX.
Pésimo servicio con su integración que fomenta y genera contaminación visual social ambiental...
#BitacoraDiaria","['nuevo', 'gente', 'perro', 'posiblemente', 'gente', 'gato', 'atacar', 'nuevo', 'obstruir', 'tráfico', 'vial', 'cdmx', 'pésimo', 'servicio', 'integración', 'fomento', 'generar', 'contaminación', 'visual', 'social', 'ambiental']",['BitacoraDiaria'],[],0,0,0,3171435475,Juan Daniel Alejandre Peláez - Y'HAX.,Nitewing9410,2015-04-24 17:23:05,0,123,490,2019-10-14 11:00:01,2019,10,14,11,00,6,Iztacalco,-99.1919955,19.357102
1183796522242080768,tránsito,palabras clave,"Hemos concluido los trabajos de cambio de válvulas del Sistema Acuaferico, frente a la U. Cuauhtémoc. Nos encontramos preparando la loza para sellar el punto de intervención. Por favor continúe circulando con precaución y calcule sus tiempos de tránsito por la zona

#CEAteInforma https://t.co/D6cqSG4yLN","['concluido', 'trabajo', 'cambio', 'valvu él', 'sistema', 'acuaferico', 'frente', 'cuauhtemoc', 'encontrar', 'preparar', 'loza', 'sellar', 'punto', 'intervención', 'favor', 'continúe', 'circular', 'precaución', 'calcular', 'tiempo', 'tránsito', 'zona']",['CEAteInforma'],[],13,3,5,1324845259,CEA Institucional,cea_qro,2013-04-03 09:28:30,0,18560,742,2019-10-14 12:27:39,2019,10,14,12,27,15,Cuauhtémoc,19.4313734294,-99.1490557562
1183854839874363393,tránsito,palabras clave,"@Xochimilco_MX @MetrobusCDMX Y se supone que el distribuidor muyuguarda ""aliviaba"" el tráfico, pues ahora con el @MetrobusCDMX habrá más y obvio más contaminación. No hay oposición al metrobus, lo que está mal es que no esté bien planeado.","['suponer', 'distribuidor', 'muyuguarda', 'aliviado', 'tráfico', 'pues', 'ahora', 'obvio', 'contaminación', 'oposición', 'metrobus', 'mal', 'bien', 'planeado']",[],"['Xochimilco_MX', 'MetrobusCDMX', 'MetrobusCDMX']",1,0,1,97659161,JUDITH PONCE VAZQUEZ,JUDITHE14,2009-12-18 06:51:11,0,207,1642,2019-10-14 16:19:23,2019,10,14,16,19,13,Xochimilco,19.2451450458,-99.0903636045
1184170667681419264,incendio,coordenadas,@AlcIZTeAtiende dónde puedo reportar contaminación de forma continua de un vehículo automotor que está contaminando todos los días frente a casa de mi madre y el humo se mete a la casa,"['dónde', 'poder', 'reportar', 'contaminación', 'forma', 'continuo', 'vehículo', 'automotor', 'contaminar', 'día', 'frente', 'casa', 'madre', 'humo', 'mete', 'casa']",[],['AlcIZTeAtiende'],0,0,0,135617552,Juanito Wick,MrPMOuEsEich,2010-04-21 14:31:59,0,177,2195,2019-10-15 13:14:22,2019,10,15,13,14,3,Coyoacán,-99.140238,19.2846922
1184192977251393537,tránsito,coordenadas,"@Claudiashein de nuevo. Como cada día #CDMX ahorcada por #Manifestantes #manifestación y usted #tranquila 
Ya estamos hartos la ciudadanía que sí trabajamos. Tenemos derecho a una ciudad de libre tránsito, sin contaminación. #RenunciaClaudiaSheinbaum","['nuevo', 'cada', 'día', 'ahorcado', 'usted', 'harto', 'ciudadanir', 'trabajar', 'derecho', 'ciudad', 'libre', 'tránsito', 'contaminación']","['CDMX', 'Manifestantes', 'manifestación', 'tranquila', 'RenunciaClaudiaSheinbaum']",['Claudiashein'],1,0,1,86871389,@Javito Decembrino,javitodf,2009-11-01 22:21:34,0,13557,6105,2019-10-15 14:43:01,2019,10,15,14,43,5,Gustavo A. Madero,-99.1843501,19.3998346
1184246476991582209,tránsito,palabras clave,"@UCS_GCDMX, Favor de enviar unidad de tránsito a infraccionar trailer bco pcas 69AF6F, violando el RT, aparcado en lugar prohibido con disco de tránsito 🚫 ""N/E Vehículos Pesado"", sobre Av. Los Ángeles N.68 entre Av. Sn Pablo y FFCC, Col. Nva. España, Azcapotzalco. https://t.co/0g9XAO6Leb","['favor', 'enviar', 'unidad', 'tránsito', 'infracción', 'trailer', 'bco', 'poco', '69af6f', 'violar', 'rt', 'aparcar', 'lugar', 'prohibido', 'disco', 'tránsito', 'vehículos', 'pesado', 'av', 'ángel', '68', 'av', 'sn', 'pablo', 'ffcc', 'col', 'nva', 'españa', 'azcapotzalco']",[],['UCS_GCDMX'],0,0,1,903097695899934725,lxm2608,LXM2608,2017-08-30 21:30:44,0,22,129,2019-10-15 18:15:37,2019,10,15,18,15,2,Azcapotzalco,19.4853286147,-99.1821069423
1184274722537791488,tránsito,coordenadas,"@ContciudaDBJ @JacBahnsen Es correcto, esas baterías ya no dan para más, aquí nos contaminan a toda hora, día, noche, madrugadas... Además de la doble fila, nulificación de #Ciclovía y deshuesadero público, tráfico, claxonazos, ruido de las grúas y ""polis"" a altas hora de la madrugada. #CasiComoSuiza","['correcto', 'batería', 'dar', 'aquí', 'contaminar', 'todo', 'hora', 'día', 'noche', 'madrugada', 'además', 'doble', 'filar', 'calificación', 'deshuesadero', 'público', 'tráfico', 'cañonazos', 'ruido', 'grúas', 'poli', 'alto', 'hora', 'madrugado']","['Ciclovía', 'CasiComoSuiza']","['ContciudaDBJ', 'JacBahnsen']",0,1,1,2747995418,@YvanesaZamorano,YvanesaZamorano,2014-08-19 21:45:58,0,2188,2012,2019-10-15 20:07:51,2019,10,15,20,07,6,Iztacalco,-99.1919955,19.357102
1184566044985380870,tránsito,coordenadas,"@JoseCarlosXoch  @Claudiashein Por qué tienen que cambiar banquetas innecesariamente? Sobre Prolongación Aldama en Xochimilco, sólo generas más contaminación y el tráfico que esto genera, además de las obras ya existentes, esto es un caos! https://t.co/Ohs2UcNOfq","['cambiar', 'banqueta', 'innecesariamente', 'prolongación', 'aljama', 'xochimilco', 'sólo', 'general', 'contaminación', 'tráfico', 'generar', 'además', 'obra', 'existente', 'cao']",[],"['JoseCarlosXoch', 'Claudiashein']",2,0,2,447420624,Marcela Sanchez,Marce_Snchez,2011-12-26 15:42:58,0,90,354,2019-10-16 15:25:27,2019,10,16,15,25,9,Milpa Alta,-99.1600234,19.152878
1184674204010057728,tránsito,palabras clave,"@webcamsdemexico @Cuauhtemoc_1521 Órale!!
Que padre!! .... no me tocó verlos, pero no había ni tráfico ni contaminación .... Bonitas imágenes de nuestra ciudad 🌃👍🏻✅👏🏻👏🏻👏🏻","['dralir', 'padre', 'tocar', 'verlo', 'tráfico', 'contaminación', 'bonito', 'imagen', 'ciudad']",[],"['webcamsdemexico', 'Cuauhtemoc_1521']",3,0,0,903364334801342464,Servia C Mtz,MtzServia,2017-08-31 15:10:15,0,6,57,2019-10-16 22:35:15,2019,10,16,22,35,15,Cuauhtémoc,19.4313734294,-99.1490557562
1184697479561973760,tránsito,palabras clave,"Un #accidente de #tránsito en Bosque de Alisos, Cooperativa Palo Alto, Cuajimalpa de Morelos fue reportado a la #CruzRojaMexicana, te recomendamos tener cuidado al transitar en esa zona https://t.co/BxvcTSnnRw","['bosque', 'aliso', 'cooperativo', 'palo', 'alto', 'cuajimalpa', 'more él', 'reportado', 'recomendar', 'tener', 'cuidado', 'transitar', 'zona']","['accidente', 'tránsito', 'CruzRojaMexicana']",[],1,0,0,476050170,Cruz Roja CDMX,CruzRoja_CDMX,2012-01-27 12:27:33,0,43719,370,2019-10-17 00:07:44,2019,10,17,00,07,4,Cuajimalpa de Morelos,19.3246343001,-99.3107285253
1184704628950106112,tránsito,coordenadas,No al tráfico ilegal de especies #BTCUNAM https://t.co/yY6bVEXuAV,"['tráfico', 'ilegal', 'especie']",['BTCUNAM'],[],0,0,0,1168738127428669441,Lilí Martínez Domínguez,LiliMtzD,2019-09-02 22:11:26,0,186,205,2019-10-17 00:36:08,2019,10,17,00,36,9,Milpa Alta,-99.315748,19.087511
1184817181739098112,tránsito,coordenadas,"Precaución al manejar por la zona. Tráfico muy lento, casi detenido en dirección a Xochimilco https://t.co/tCNflOgQkx","['precaución', 'manejar', 'zona', 'tráfico', 'lento', 'casi', 'detenido', 'dirección', 'xochimilco']",[],[],0,0,0,1344550633,Alina Katia Juárez M,katiajuarezBios,2013-04-11 08:41:35,0,41,273,2019-10-17 08:03:23,2019,10,17,08,03,9,Milpa Alta,-99.163354,19.049016
1184824404993200128,tránsito,coordenadas,"Ya he reportado más de 3 veces que la banqueta se está levantando y se inunda con las lluvias y es una zona de alto tránsito por adultos mayores y estudiantes y se tienen que bajar al arrollo para pasar, @AlcaldiaAO ,espero está vez si me escuchen . https://t.co/sc7gAXhbWO","['reportado', 'veces', 'banquetar', 'levantar', 'inundo', 'lluvia', 'zona', 'alto', 'tránsito', 'adulto', 'mayor', 'estudiante', 'bajar', 'arrolla', 'pasar', 'esperar', 'vez', 'si', 'escuchar']",[],['AlcaldiaAO'],0,0,0,744541176,ivan contreras,ivan_elpchan,2012-08-07 23:52:11,0,71,642,2019-10-17 08:32:05,2019,10,17,08,32,3,Coyoacán,-99.200158,19.372746
1184834217147957251,tránsito,coordenadas,"Oye @Claudiashein Nunca se te había ocurrido combatir la Contaminación arreglando las Porquerías de calles y Avenidas que son Un caos infestadas de Baches, hoyos, sanjas, etc. Que eso Genera más Tráfico, más Contaminación etc. Y dejas de Robar con el Programa de la VERIFICACIÓN?","['oir', 'nunca', 'ocurrido', 'combatir', 'contaminación', 'arreglar', 'porqueer', 'calle', 'avenida', 'caos', 'infestada', 'bache', 'hoyos', 'santo', 'etc', 'generar', 'tráfico', 'contaminación', 'etc', 'deja', 'robar', 'programa', 'verificación']",[],['Claudiashein'],0,0,0,392267545,ChARlY-C.U.c.h.O,charly_GLS,2011-10-16 13:43:49,0,106,165,2019-10-17 09:11:05,2019,10,17,09,11,6,Iztacalco,-99.1919955,19.357102
1184837755823706113,tránsito,palabras clave,"Denuncia en redes 🤳🏻, así el #Tráfico 🚙  en Paseo Constituyentes, desde la Universidad Cuauhtémoc hasta el Mirador. #Querétaro https://t.co/0O9TtIwXD8","['denunciar', 'redser', 'así', 'pasear', 'constituyente', 'universidad', 'cuauhtemoc', 'mirador']","['Tráfico', 'Querétaro']",[],8,3,7,17161677,Miguel Angel Alvarez 🇲🇽 Reportero Mexicano,malvarezvargas,2008-11-04 11:17:36,0,73415,1754,2019-10-17 09:25:08,2019,10,17,09,25,15,Cuauhtémoc,19.4313734294,-99.1490557562
1185089003994828800,tránsito,coordenadas,"La cantidad de armas de alto calibre que tienen los narcos es ABSURDA. Bastaron para, literalmente, sitiar una ciudad. De dónde vienen? Como las consiguen? Quién las trae a México? También es momento de hablar del tráfico de armas de EEUU a México. https://t.co/rSZVgPye3S","['cantidad', 'arma', 'alto', 'calibre', 'narco', 'absurdo', 'bastar', 'literalmente', 'sitiar', 'ciudad', 'dónde', 'venir', 'conseguir', 'quién', 'traer', 'méxico', 'momento', 'hablar', 'tráfico', 'arma', 'eeuu', 'méxico']",[],[],8,1,1,199958662,Jair Eridan,Eridan92,2010-10-07 21:24:56,0,739,2176,2019-10-18 02:03:31,2019,10,18,02,03,15,Cuauhtémoc,-99.259495,19.3863707
1185190684543705088,tránsito,palabras clave,"@OVIALCDMX, @SSP_CDMX, Favor de enviar unidad de tránsito a infraccionar trailer azul pcas 427DE4, violando el RT, aparcado en lugar prohibido con disco de tránsito 🚫 ""N/E Vehículos Pesado"", sobre Av. Los Ángeles N.68 entre Av. Sn Pablo y FFCC, Col. Nva. España, Azcapotzalco. https://t.co/cXz7viSnUX","['favor', 'enviar', 'unidad', 'tránsito', 'infracción', 'trailer', 'azul', 'poco', '427de4', 'violar', 'rt', 'aparcar', 'lugar', 'prohibido', 'disco', 'tránsito', 'vehículos', 'pesado', 'av', 'ángel', '68', 'av', 'sn', 'pablo', 'ffcc', 'col', 'nva', 'españa', 'azcapotzalco']",[],"['OVIALCDMX', 'SSP_CDMX']",0,1,0,903097695899934725,lxm2608,LXM2608,2017-08-30 21:30:44,0,22,129,2019-10-18 08:47:33,2019,10,18,08,47,2,Azcapotzalco,19.4853286147,-99.1821069423
1185191017873436677,tránsito,palabras clave,"@UCS_GCDMX, Favor de enviar unidad de tránsito a infraccionar trailer azul pcas 427DE4, violando el RT, aparcado en lugar prohibido con disco de tránsito 🚫 ""N/E Vehículos Pesado"", sobre Av. Los Ángeles N.68 entre Av. Sn Pablo y FFCC, Col. Nva. España, Azcapotzalco. https://t.co/mPaPoEyDqV","['favor', 'enviar', 'unidad', 'tránsito', 'infracción', 'trailer', 'azul', 'poco', '427de4', 'violar', 'rt', 'aparcar', 'lugar', 'prohibido', 'disco', 'tránsito', 'vehículos', 'pesado', 'av', 'ángel', '68', 'av', 'sn', 'pablo', 'ffcc', 'col', 'nva', 'españa', 'azcapotzalco']",[],['UCS_GCDMX'],0,0,0,903097695899934725,lxm2608,LXM2608,2017-08-30 21:30:44,0,22,129,2019-10-18 08:48:53,2019,10,18,08,48,2,Azcapotzalco,19.4853286147,-99.1821069423
1185270684639006720,tránsito,coordenadas,"Bendita CDMX!
Tráfico, mucho calor y estrés...","['benditar', 'cdmx', 'tráfico', 'calor', 'estrés']",[],[],0,0,0,1541629230,El Sr. Gerente de Logistica y Transporte,DeJgarcia,2013-06-23 13:09:19,0,142,491,2019-10-18 14:05:27,2019,10,18,14,05,6,Iztacalco,-99.1843501,19.3998346
1185354648313647104,tránsito,palabras clave,@SOBSECDMX @C5_CDMX @locatel_mx @OVIALCDMX Pues ojalá y reencarpeten y hagan el balizamiento en toda avenida Aquiles Serdan ya q el @vidallerenas @AzcapoAtiende no han echo nada mas q hacer tráfico y contaminación en la av.azcapotzalco q es una tripa de calle para hay bicicletas,"['pues', 'ojalá', 'reencarpetir', 'hacer', 'balizamiento', 'todo', 'avenida', 'aquil', 'ser', 'acer', 'mas', 'hacer', 'tráfico', 'contaminación', 'av', 'azcapotzalco', 'tripa', 'calle', 'bicicleta']",[],"['SOBSECDMX', 'C5_CDMX', 'locatel_mx', 'OVIALCDMX', 'vidallerenas', 'AzcapoAtiende']",0,1,0,327660621,YOLET CERVANTES,AvaraYolet,2011-07-01 16:59:09,0,261,1444,2019-10-18 19:39:05,2019,10,18,19,39,2,Azcapotzalco,19.4853286147,-99.1821069423
1185651586669797376,tránsito,coordenadas,¿Le exigió a Estados Unidos contener el tráfico ilegal de armas? No creo #MexicoNoTienePresidente tiene un político y no un hombre de estado https://t.co/txHIcKBbIR,"['exigir', 'unidos', 'contener', 'tráfico', 'ilegal', 'arma', 'creer', 'político', 'hombre']",['MexicoNoTienePresidente'],[],2,0,0,35648282,Meza,Mezowski,2009-04-26 20:51:56,0,2117,1690,2019-10-19 15:19:01,2019,10,19,15,19,4,Cuajimalpa de Morelos,-99.1919955,19.357102
1185658581875605512,tránsito,coordenadas,"@USAmbMex Sr Embajador lo que necesitamos los mexicanos en este momento es que detengan el tráfico ilegal de armas hacia territorio mexicano, se lo pedimos de la manera más atenta.","['sr', 'embajador', 'necesitar', 'mexicano', 'momento', 'detener', 'tráfico', 'ilegal', 'arma', 'hacia', 'territorio', 'mexicano', 'pedir', 'manera', 'atento']",[],['USAmbMex'],0,0,0,142416231,VictorM_Tovar,VictorM_Tovar,2010-05-10 14:51:04,0,223,1008,2019-10-19 15:46:49,2019,10,19,15,46,2,Azcapotzalco,-99.180678,19.444937
1185703361221447680,incendio,palabras clave,"@AlcIZTeAtiende @Alc_Iztapalapa Sobre Prolongación Plutarco Elias Calles hay un negocio de pollos al carbón que vende alcohol, deja tomar en vía pública y contamina con el humo y el ruido. Dudo mucho que tenga algún permiso, ¿Qué procede? Además el dueño es policía de la CDMX. 🤦","['prolongación', 'plutarco', 'elia', 'call', 'negocio', 'pollos', 'carbón', 'vender', 'alcohol', 'dejar', 'tomar', 'vía', 'público', 'contamín', 'humar', 'ruido', 'dudo', 'alguno', 'permiso', 'proceder', 'además', 'dueño', 'policía', 'cdmx']",[],"['AlcIZTeAtiende', 'Alc_Iztapalapa']",0,0,0,877667882762739713,Anndy González,anndy_gs,2017-06-21 17:21:44,0,311,4286,2019-10-19 18:44:45,2019,10,19,18,44,7,Iztapalapa,19.3491663204,-99.0567989642
1185950717330235393,pirotecnia,palabras clave,"@Barrio_SanLucas Con gente disparando fuegos artificiales todo el día y toda la noche, no sé si vivo en Coyoacán o Siria.  Tengo un trastorno del sueño y mi perro tiene ansiedad.  Esta situación es perjudicial para nuestra salud.  Es intolerable en una sociedad civilizada.","['gente', 'disparar', 'fuego', 'artificial', 'día', 'todo', 'noche', 'saber', 'si', 'vivir', 'coyoacán', 'sirio', 'trastorno', 'sueño', 'perro', 'ansiedad', 'situación', 'perjudicial', 'salud', 'intolerable', 'sociedad', 'civilizado']",[],['Barrio_SanLucas'],0,0,0,44488189,Doug Hall,jdoughall,2009-06-03 17:29:02,0,141,214,2019-10-20 11:07:39,2019,10,20,11,07,3,Coyoacán,19.3266672536,-99.1503763525
1185950920955301888,pirotecnia,palabras clave,"@DelCarmen_Coyo Con gente disparando fuegos artificiales todo el día y toda la noche, no sé si vivo en Coyoacán o Siria.  Tengo un trastorno del sueño y mi perro tiene ansiedad.  Esta situación es perjudicial para nuestra salud.  Es intolerable en una sociedad civilizada.","['gente', 'disparar', 'fuego', 'artificial', 'día', 'todo', 'noche', 'saber', 'si', 'vivir', 'coyoacán', 'sirio', 'trastorno', 'sueño', 'perro', 'ansiedad', 'situación', 'perjudicial', 'salud', 'intolerable', 'sociedad', 'civilizado']",[],['DelCarmen_Coyo'],0,0,0,44488189,Doug Hall,jdoughall,2009-06-03 17:29:02,0,141,214,2019-10-20 11:08:28,2019,10,20,11,08,3,Coyoacán,19.3266672536,-99.1503763525
1186057357933056001,incendio,palabras clave,"#Precaución | 

Se registra incendio de negocio sobre Av. Tláhuac y Zacatlán, Colonia Pueblo de San Lorenzo, @Alc_Iztapalapa, servicios de emergencia ya se encuentran en el punto. 

@C5_CDMX https://t.co/md506XSJtQ","['registrar', 'incendio', 'negocio', 'av', 'tláhuac', 'zacatlán', 'colonia', 'pueblo', 'san', 'lorenzo', 'servicio', 'emergencio', 'encontrar', 'punto']",['Precaución'],"['Alc_Iztapalapa', 'C5_CDMX']",30,2,8,293063533,JORGE BECERRIL JB/8,MrElDiablo8,2011-05-04 12:00:15,1,172286,888,2019-10-20 18:11:24,2019,10,20,18,11,7,Iztapalapa,19.3491663204,-99.0567989642
1186062407518564353,incendio,palabras clave,"#Precaución Acuden los servicios de emergencia 🚒🚑🚓 a incendio de casa habitación en Col.Santa Martha Acatitla, @Alc_Iztapalapa. #MovilidadCDMX #911CDMX","['acudir', 'servicio', 'emergencio', 'incendio', 'casa', 'habitación', 'col', 'santa', 'martha', 'acatitla']","['Precaución', 'MovilidadCDMX', '911CDMX']",['Alc_Iztapalapa'],20,0,2,195951901,C5 CDMX,C5_CDMX,2010-09-27 17:51:04,1,925879,763,2019-10-20 18:31:28,2019,10,20,18,31,7,Iztapalapa,19.3491663204,-99.0567989642
1186071845839101952,incendio,palabras clave,"#Precaución
Servicios de emergencia laborando por fuerte #incendio en Avenida Tláhuac a la altura de Avenida la Turba.
Eviten la zona. https://t.co/IGOQLrFuyu","['servicio', 'emergencio', 'laborar', 'fuerte', 'avenida', 'tláhuac', 'altura', 'avenido', 'turbir', 'evitar', 'zona']","['Precaución', 'incendio']",[],6,0,7,89134960,Marisol Tea 💜,Marisol_Tea,2009-11-11 01:55:03,0,1440,945,2019-10-20 19:08:58,2019,10,20,19,08,11,Tláhuac,19.2769983772,-99.0028216137
1186076843373408256,incendio,palabras clave,"#Precaución  Servicios de emergencia se encuentran laborando en Av. Tláhuac a la altura de Av. la Turba, por incendio. 

#AlternativaVial : Canal de Chalco https://t.co/wKJJhACJDM","['servicio', 'emergencio', 'encontrar', 'laborar', 'av', 'tláhuac', 'alturar', 'av', 'turba', 'incendio', 'canal', 'chaleco']","['Precaución', 'AlternativaVial']",[],0,0,4,122114793,Efekto TV,EfektoTv,2010-03-11 10:53:28,0,40612,638,2019-10-20 19:28:50,2019,10,20,19,28,11,Tláhuac,19.2769983772,-99.0028216137
1186286204658049029,tránsito,palabras clave,"@BJAlcaldia Que aberrante su confinacion de carril en av coyoacan, más tránsito y más contaminacion","['aberrante', 'continuacion', 'carril', 'av', 'colocar', 'tránsito', 'contaminacion']",[],['BJAlcaldia'],0,0,0,591388977,Angel Briones,gerardobriones8,2012-05-26 16:34:19,0,22,215,2019-10-21 09:20:45,2019,10,21,09,20,3,Coyoacán,19.3266672536,-99.1503763525
1186286371494907904,tránsito,coordenadas,"@LaSEMOVI @TlalpanAl por favor detengan la mala práctica de permitir que los policías manualmente controlen los semáforos en la ciudad. 
Lejos de solucionar un problema generan tráfico y caos.
Lo hacen sin técnica mientras chatean/ hablan x teléfono en total irresponsabilidad. https://t.co/3Xhez91UF0","['favor', 'detener', 'mala', 'práctico', 'permitir', 'policía', 'manualmente', 'controlir', 'semáforo', 'ciudad', 'lejos', 'solucionar', 'problema', 'generar', 'tráfico', 'caos', 'hacer', 'técnica', 'mientras', 'chateau', 'hablar', 'teléfono', 'total', 'irresponsabilidad']",[],"['LaSEMOVI', 'TlalpanAl']",0,0,0,1092142835636363264,Andrés Pastor,APastorAA,2019-02-03 13:28:37,0,46,356,2019-10-21 09:21:25,2019,10,21,09,21,3,Coyoacán,-99.18480350686816,19.295496106959007
