pubID,topicQuery,typeQuery,tweet,tokens,hashtags,mentions,likeCount,replyCount,retweetCount,authorID,authorName,authorUsername,authorCreatedAt,authorVerified,followersCount,followingCount,pubDate,pubYear,pubMonth,pubDay,pubHour,pubMinute,geoID,geoName,longitude,latitude
1188965935152910336,tránsito,coordenadas,"@zzbadillo @InMixcoac @Claudiashein @OVIALCDMX @BJAlcaldia @PGJDF_CDMX Muchísimo peor es el tráfico y la contaminación que provoca la UP desde las 6:30 am hasta después de las 22:00 hrs de lunes a domingo, una persona por coche y cero conciencia cívica, y reventones escandalosos, chicas y chicos borrachos en las madrugadas 😖","['muchísimo', 'peor', 'tráfico', 'contaminación', 'provocar', 'up', '30', 'am', 'después', '22', '00', 'hrs', 'lunes', 'domingo', 'personar', 'coche', 'cero', 'conciencia', 'cívico', 'reventón', 'escandaloso', 'chica', 'chico', 'borracho', 'madrugada']",[],"['zzbadillo', 'InMixcoac', 'Claudiashein', 'OVIALCDMX', 'BJAlcaldia', 'PGJDF_CDMX']",2,0,1,265749245,Enrique Serrano C,Eserranoc,2011-03-13 20:48:34,0,173,539,2019-10-28 18:49:03,2019,10,28,18,49,4,Cuajimalpa de Morelos,-99.1919955,19.357102
1189231232913199104,pirotecnia,coordenadas,"Los esperamos este puente para disfrutar de un fin de semana Mágico!

Además de tener la sensualidad del fin de semana, aprovecha el Festival de las Almas!
- Paseo para ver los fuegos artificiales desde el lago
- Concierto de Ana Torroja 

#ExperienciaAmantina https://t.co/JPraxdkSzT","['esperar', 'puente', 'disfrutar', 'fin', 'semana', 'mágico', 'además', 'tener', 'sensualidad', 'fin', 'semana', 'aprovechar', 'festival', 'alma', 'pasear', 'ver', 'fuego', 'artificial', 'laguir', 'concierto', 'ana', 'torreta']",['ExperienciaAmantina'],[],3,0,0,967068711634067456,AmantinaMX,AmantinaMX,2018-02-23 10:08:42,0,15249,176,2019-10-29 12:23:15,2019,10,29,12,23,3,Coyoacán,-99.324375,19.232228
1189258562087903232,incendio,palabras clave,"#InformaPGJ Derivado de la denuncia ciudadana, se actúa a nivel de barrio y colonia, lo que permitió poner a disposición del MP a dos hombres quienes amagaron con un arma de fuego y robaron objetos de valor a dos víctimas en la colonia Central de Abastos, #Iztapalapa","['derivado', 'denuncia', 'ciudadano', 'actúar', 'nivel', 'barrio', 'colonia', 'permitir', 'poner', 'disposición', 'mp', 'dos', 'hombre', 'apagar', 'arma', 'fuego', 'robar', 'objeto', 'valor', 'dos', 'víctima', 'colonia', 'central', 'abasto']","['InformaPGJ', 'Iztapalapa']",[],10,0,2,561471584,Fiscalía CDMX,FiscaliaCDMX,2012-04-23 15:12:02,1,441981,184,2019-10-29 14:11:51,2019,10,29,14,11,7,Iztapalapa,19.3491663204,-99.0567989642
1189299021120266240,tránsito,coordenadas,"🇲🇽 🇺🇸 En la Interparlamentaria México-Estados Unidos tratamos los temas de migración, desarrollo de Centroamérica, seguridad y el tráfico ilegal de armas. Percibimos una muy buena disposición para que se apruebe el TMEC antes de diciembre.
#DiputadaFederal #Distrito02Chihuahua https://t.co/guPKnysG2E","['interparlamentario', 'méxico-estado', 'unido', 'tratar', 'tema', 'migración', 'desarrollo', 'centroamerico', 'seguridad', 'tráfico', 'ilegal', 'arma', 'percibimos', 'buen', 'disposición', 'aprobar', 'tec', 'diciembre']","['DiputadaFederal', 'Distrito02Chihuahua']",[],8,0,3,1137568325414936577,Maite Vargas Meraz,Maite_VargasM,2019-06-08 21:53:18,1,12152,833,2019-10-29 16:52:37,2019,10,29,16,52,5,Gustavo A. Madero,-99.128294,19.4043522
1189338978207633411,tránsito,palabras clave,"@C5_CDMX qué tal buenas tardes para reportar semáforos descompuestos en el cruce de avenida Acoxpa y avenida federación mexicana de fútbol en el crucero de plaza Acoxpa delegación Coyoacán, un verdadero caos vial, se solicita la intervención de tránsito y de personal de semáforos","['tal', 'buena', 'tarde', 'reportar', 'semáforo', 'descompuesto', 'cruce', 'avenida', 'copa', 'avenido', 'federación', 'mexicano', 'fútbol', 'crucero', 'plaza', 'copa', 'delegación', 'coyoacán', 'verdadero', 'cao', 'vial', 'solicitar', 'intervención', 'tránsito', 'personal', 'semáforo']",[],['C5_CDMX'],0,2,0,750151691341737984,Tavo Gonzalez,taviglz73,2016-07-04 20:17:55,0,16,102,2019-10-29 19:31:23,2019,10,29,19,31,3,Coyoacán,-99.315748,19.087511
1189362507674112000,tránsito,coordenadas,"20:02 Personal de #Tránsito de la Secretaría de Seguridad Ciudadana atendió denuncia ciudadana en Eje 1 Norte Fuerza Aérea Mexicana y Comisión Nacional Agraria, col. Peñón de los Baños, Alcaldía Venustiano Carranza. Policías agilizan la vialidad. https://t.co/Uc0Yk84I8g","['20', '02', 'personal', 'secretacer', 'seguridad', 'ciudadano', 'atender', 'denuncia', 'ciudadano', 'eje', 'norte', 'fuerza', 'aéreo', 'mexicano', 'comisión', 'nacional', 'agrario', 'col', 'peñón', 'baño', 'alcaldir', 'venustiano', 'carranzar', 'policía', 'agilizar', 'vialidad']",['Tránsito'],[],1,0,0,166594238,OVIAL_SSCCDMX,OVIALCDMX,2010-07-14 09:00:43,1,1935726,133,2019-10-29 21:04:53,2019,10,29,21,04,5,Gustavo A. Madero,-99.1843501,19.3998346
1189408444492795904,tránsito,palabras clave,"@Claudiashein Soy la Señora Carmen Lugo de Tlalpan, nos encontramos en la agencia N.23 del MP con motivo de una denuncia por extorsión y no se a procedido por lo que solicitamos de su intervención puesto que hay tráfico de influencias.","['señora', 'carmen', 'lugo', 'tlalpar', 'encontrar', 'agencia', '23', 'mp', 'motivo', 'denunciar', 'extorsión', 'procedido', 'solicitar', 'intervención', 'puesto', 'tráfico', 'influencia']",[],['Claudiashein'],0,0,0,1142273018871369728,Carmen Lugo,CarmenL23784591,2019-06-21 21:28:04,0,0,21,2019-10-30 00:07:25,2019,10,30,00,07,12,Tlalpan,19.1983396763,-99.2062207957
1189581185867026432,tránsito,palabras clave,"🚧 Se registró otro choque sobre la Av. Andrés Quintana Roo con Av. Tepich. Las autoridades de Tránsito de Benito Juárez, recomienda a la población conducir con precaución sobre la zona. 🚧 https://t.co/rJwsrItMmj","['registrar', 'choque', 'av', 'andrés', 'quintán', 'roo', 'av', 'típico', 'autoridad', 'tránsito', 'benito', 'juarez', 'recomendar', 'población', 'conducir', 'precaución', 'zón']",[],[],0,0,0,195447972,Minuto a Minuto Cancún,minutocancun,2010-09-26 12:45:30,0,479,12,2019-10-30 11:33:50,2019,10,30,11,33,14,Benito Juárez,19.3806424162,-99.1611346584
1189615197700313088,incendio,palabras clave,PRECAUCIÓN: Cuauhtémoc y Torres Adalid @Narvarte_ reporte de incendio. 🔥🚒  🚨,"['precaución', 'cuauhtemoc', 'torrser', 'adalid', 'reportar', 'incendio']",[],['Narvarte_'],2,0,0,87350793,SUUMA Voluntarios 🚑,SUUMA_CDMX,2009-11-03 21:07:26,0,43179,86,2019-10-30 13:48:59,2019,10,30,13,48,15,Cuauhtémoc,19.4313734294,-99.1490557562
1189625724514328578,tránsito,palabras clave,"Bloqueado vaqueritos, dirección #xochimilco #perifericosur #precaucion #cdmx #Trafico https://t.co/wEOhkT2od8","['bloquear', 'vaquero', 'dirección']","['xochimilco', 'perifericosur', 'precaucion', 'cdmx', 'Trafico']",[],0,1,0,70214648,patri,patrixiaortega,2009-08-30 15:08:17,0,985,2731,2019-10-30 14:30:49,2019,10,30,14,30,13,Xochimilco,19.2451450458,-99.0903636045
1189640811773857792,tránsito,palabras clave,"@UCS_GCDMX urge liberar vialidad, de 3 carriles sólo 1 está disponible. calle 4 entre av. Xochimilco y av. Norte col. Pantitlan @Dele_Iztacalco. Además autos estacionados del lado de primaria y secundaria, donde según reglamento de tránsito está prohibido https://t.co/lAK9rv9F9Y","['urge', 'liberar', 'vialidad', 'carril', 'sólo', 'disponible', 'callir', 'av', 'xochimilco', 'av', 'norte', 'col', 'pantitlar', 'además', 'auto', 'estacionado', 'lado', 'primario', 'secundario', 'según', 'reglamento', 'tránsito', 'prohibido']",[],"['UCS_GCDMX', 'Dele_Iztacalco']",0,0,0,85364079,Davdevir,DeivRey,2009-10-26 11:16:45,0,97,419,2019-10-30 15:30:46,2019,10,30,15,30,6,Iztacalco,19.396911897,-99.094329797
1189751473741033472,tránsito,coordenadas,Que poca madre que los microbuseros se pongan a cargar gasolina y detengan el tráfico como si el resto no importaramos,"['poco', 'madre', 'microbús', 'poner', 'cargar', 'gasolina', 'detener', 'tráfico', 'si', 'resto', 'importarar']",[],[],2,1,0,360202743,random cocodriz,CaroNaturaLove,2011-08-22 15:13:10,0,483,1821,2019-10-30 22:50:30,2019,10,30,22,50,4,Cuajimalpa de Morelos,-99.1919955,19.357102
1189955744453550081,tránsito,coordenadas,"@colanahuac_cdmx @MaggieHegyi @SSP_CDMX @vromog @inveacdmx Son totalmente proponentes no hacen caso a las señales de tránsito, se pasan el alto, dan vuelta como locos, la única decente es la señora de la base","['totalmente', 'proponent', 'hacer', 'caso', 'señal', 'tránsito', 'pasar', 'alto', 'dar', 'vuelta', 'loco', 'único', 'decente', 'señora', 'base']",[],"['colanahuac_cdmx', 'MaggieHegyi', 'SSP_CDMX', 'vromog', 'inveacdmx']",2,0,1,950991379,Fer,FernandoTol,2012-11-15 22:28:50,0,54,256,2019-10-31 12:22:12,2019,10,31,12,22,15,Cuauhtémoc,-99.259495,19.3863707
1190131843623993345,pirotecnia,palabras clave,"#AlMinuto #CdMexico // Explota ( al parecer -transformador u/o cilindro- )  por fuegos artificiales de torito durante fiesta popular de Tlaxialtemalco #Xochimilco. Ambulancias acuden al rescate, -hay más de 8 heridos-. https://t.co/gaAYZRBC35","['explotar', 'parecer', 'transformador', 'cilindrir', 'fuego', 'artificial', 'toritir', 'fiesta', 'popular', 'tlaxialtemalco', 'ambulancias', 'acudir', 'rescate', 'herido']","['AlMinuto', 'CdMexico', 'Xochimilco']",[],3,1,2,156081748,Buro Internacional de Prensa,BipPress,2010-06-15 17:58:05,0,675,2323,2019-11-01 00:01:57,2019,11,01,00,01,13,Xochimilco,19.2451450458,-99.0903636045
1190137830900678656,pirotecnia,palabras clave,"@AlvaroAlvaradoC @ProtegeryServir @MinSegPma Resulta que ahora las palmeras y fuegos artificiales se prenden solos.  Benito Juárez dijo cuando se restauró la República en México en el año 1867 que: “Entre los individuos, como entre las naciones, el respeto al derecho ajeno es la paz.” He Allí lo que dice el artículo citado.","['resultar', 'ahora', 'palmera', 'fuego', 'artificial', 'prender', 'solo', 'benito', 'juarez', 'decir', 'restaurar', 'república', 'méxico', 'año', '1867', 'individuo', 'nación', 'respetar', 'derecho', 'ajeno', 'paz', 'allí', 'decir', 'artículo', 'citado']",[],"['AlvaroAlvaradoC', 'ProtegeryServir', 'MinSegPma']",2,0,1,1117652999504125952,Ángel A. Calderón V,ngelACaldernV1,2019-04-14 22:56:54,0,1273,244,2019-11-01 00:25:45,2019,11,01,00,25,14,Benito Juárez,19.3806424162,-99.1611346584
