pubID,topicQuery,typeQuery,tweet,tokens,hashtags,mentions,likeCount,replyCount,retweetCount,authorID,authorName,authorUsername,authorCreatedAt,authorVerified,followersCount,followingCount,pubDate,pubYear,pubMonth,pubDay,pubHour,pubMinute,geoID,geoName,longitude,latitude
1217618602620116992,incendio,palabras clave,"@SUUMA_CDMX Buena tarde. No hubo incendio SUUMA.  El reporte corresponde a lesionado en Vulcanizadora, de acuerdo al reporte de Protección Civil @PC_Cuajimalpa  Saludos a todos.","['buen', 'tarde', 'incendio', 'sumar', 'reporte', 'corresponder', 'lesionado', 'vulcanizadora', 'acuerdo', 'reporte', 'protección', 'civil', 'saludos']",[],"['SUUMA_CDMX', 'PC_Cuajimalpa']",0,0,0,1053071075314085888,Alcaldía Cuajimalpa de Morelos,AlcCuajimalpa,2018-10-18 17:51:24,0,17627,77,2020-01-15 19:24:31,2020,01,15,19,24,4,Cuajimalpa de Morelos,-99.3107285253,19.3246343001
1217618872603303939,incendio,palabras clave,"@OVIALCDMX Buena tarde. Negativo de incendio amigos de OVIAL.  El reporte corresponde a lesionado en Vulcanizadora, de acuerdo al reporte de Protección Civil @PC_Cuajimalpa  Saludos a todos.","['buen', 'tarde', 'negativo', 'incendio', 'amigo', 'vial', 'reporte', 'corresponder', 'lesionado', 'vulcanizadora', 'acuerdo', 'reporte', 'protección', 'civil', 'saludos']",[],"['OVIALCDMX', 'PC_Cuajimalpa']",1,1,0,1053071075314085888,Alcaldía Cuajimalpa de Morelos,AlcCuajimalpa,2018-10-18 17:51:24,0,17627,77,2020-01-15 19:25:36,2020,01,15,19,25,4,Cuajimalpa de Morelos,-99.3107285253,19.3246343001
1217636393226244097,tránsito,palabras clave,"Los cochistas de Benito Juarez tienen razón, ¡miren cuanto tráfico causa tener un @MetrobusCDMX o una ciclovía! https://t.co/b5WVRF9N9o","['ciclista', 'benito', 'juarez', 'razón', 'mirar', 'cuanto', 'tráfico', 'causar', 'tener', 'ciclovía']",[],['MetrobusCDMX'],18,0,9,16522031,Fabián Heredia 🌹☭,Cyb3rPsycho,2008-09-29 19:45:16,0,3251,2532,2020-01-15 20:35:13,2020,01,15,20,35,14,Benito Juárez,-99.1611346584,19.3806424162
1217638871162208257,tránsito,palabras clave,"@LaSEMOVI Haber si alguien puede apoyar sobre Calzada Santa Ana Culhuacán, Coyoacán camioneta en doble fila interrumpiendo el tránsito bajando Puente de eje 3 dirección tlahuac","['haber', 'si', 'alguien', 'poder', 'apoyar', 'calzada', 'santo', 'ana', 'culhuacán', 'coyoacán', 'camioneta', 'doble', 'fila', 'interrumpir', 'tránsito', 'bajar', 'puente', 'eje', 'dirección', 'tlahuac']",[],['LaSEMOVI'],0,1,0,933862615704571904,J C,JC82345115,2017-11-23 18:59:32,0,1,47,2020-01-15 20:45:04,2020,01,15,20,45,3,Coyoacán,-99.1503763525,19.3266672536
1217661031998050304,incendio,coordenadas,"22:13 #PrecauciónVial servicios de emergencia se dirigen sobre Eduardo Molina y Herreros, col. Morelos, alcaldía V. Carranza, por incendio","['22', '13', 'servicio', 'emergencio', 'dirigir', 'eduardo', 'molina', 'herreros', 'col', 'morelos', 'alcaldía', 'carranza', 'incendio']",['PrecauciónVial'],[],4,0,1,166594238,OVIAL_SSCCDMX,OVIALCDMX,2010-07-14 09:00:43,1,1942061,135,2020-01-15 22:13:07,2020,01,15,22,13,16,Miguel Hidalgo,-99.1843501,19.3998346
1217664565909053440,incendio,palabras clave,"😱🔥#ÚltimaHora Servicios de emergencia se aproximan por incendio de mercado  de Morelos sobre Eduardo Molina y Herreros, colonia Morelos, alcaldía Venustiano Carranza en la #CDMX https://t.co/CGMQJ3f9An","['servicio', 'emergencia', 'aproximar', 'incendio', 'mercado', 'morelos', 'eduardo', 'molina', 'herreros', 'colonia', 'morelos', 'alcaldía', 'venustiano', 'carranza']","['ÚltimaHora', 'CDMX']",[],2,0,3,771779820,Central Municipal,Central_CM,2012-08-21 10:10:16,0,34891,24826,2020-01-15 22:27:10,2020,01,15,22,27,17,Venustiano Carranza,-99.0931057959,19.4304954545
1217665017627267075,incendio,palabras clave,"Toma tus precauciones. Servicios de emergencia se aproximan por incendio en el mercado de la Morelos, sobre Eduardo Molina y Herreros, colonia Morelos, alcaldía Venustiano Carranza. #incendio #EsoSiCalienta #Morelos https://t.co/IJoCuYLrBo","['tomar', 'precaución', 'servicio', 'emergencia', 'aproximar', 'incendio', 'mercado', 'morelos', 'eduardo', 'molina', 'herreros', 'colonia', 'morelos', 'alcaldía', 'venustiano', 'carranza']","['incendio', 'EsoSiCalienta', 'Morelos']",[],2,1,2,1179579671828152320,@Business&Travel México,MXBTM1,2019-10-02 20:11:34,0,695,112,2020-01-15 22:28:57,2020,01,15,22,28,17,Venustiano Carranza,-99.0931057959,19.4304954545
1217666911103746048,incendio,palabras clave,"#Alerta: En desarrollo un nuevo incendio en un mercado de la #CdMx. 

Esta vez en el Mercado Morelos, en la colonia del mismo nombre, de la alcaldía Venustiano Carranza. 

Bomberos en el lugar. https://t.co/Z7qbU3Bfhb","['desarrollo', 'nuevo', 'incendio', 'mercado', 'vez', 'mercado', 'morelos', 'colonia', 'mismo', 'nombre', 'alcaldía', 'venustiano', 'carranza', 'bombero', 'lugar']","['Alerta', 'CdMx']",[],6,2,5,26455222,Carlos Zúñiga Pérez,Carloszup,2009-03-25 02:08:07,1,57375,1421,2020-01-15 22:36:29,2020,01,15,22,36,17,Venustiano Carranza,-99.0931057959,19.4304954545
1217669651603259392,incendio,palabras clave,"#Incendio
(...) Luego de que se reportó un incendio en el Mercado Morelos, ubicado en Eduardo Molina y Herreros, en la colonia Morelos, alcaldía de Venustiano Carranza, bomberos lograron extinguirlo tras varios minutos. https://t.co/XsaNT9nZHN","['luego', 'reportar', 'incendio', 'mercado', 'morelos', 'ubicado', 'eduardo', 'molina', 'herreros', 'colonia', 'morelos', 'alcaldía', 'venustiano', 'carranza', 'bomberos', 'lograr', 'extinguido', 'tras', 'varios', 'minuto']",['Incendio'],[],0,0,0,114757490,Xz,emet1992,2010-02-16 08:22:56,0,126,302,2020-01-15 22:47:22,2020,01,15,22,47,17,Venustiano Carranza,-99.0931057959,19.4304954545
1217669847808708608,incendio,palabras clave,"Luego de que se reportó un incendio en el Mercado Morelos, ubicado en Eduardo Molina y Herreros, en la colonia Morelos, alcaldía de Venustiano Carranza, bomberos lograron extinguirlo tras varios minutos.  No se reportan heridos hasta el momento #incendio #bomberos https://t.co/Jp4bS2VWrs","['luego', 'reportar', 'incendio', 'mercado', 'morelos', 'ubicado', 'eduardo', 'molina', 'herreros', 'colonia', 'morelos', 'alcaldía', 'venustiano', 'carranza', 'bomberos', 'lograr', 'extinguido', 'tras', 'varios', 'minuto', 'reportar', 'herido', 'momento']","['incendio', 'bomberos']",[],2,1,3,919643548227584000,19S México,19SJuntosPor,2017-10-15 13:18:02,0,455,262,2020-01-15 22:48:09,2020,01,15,22,48,17,Venustiano Carranza,-99.0931057959,19.4304954545
1217670419404091392,incendio,palabras clave,"🔥 #ÚltimaHora SE INCENDIA MERCADO MORELOS EN LA CDMX 👨‍🚒 

Luego de que se reportó un incendio en el Mercado Morelos, ubicado en Eduardo Molina y Herreros, en la colonia Morelos, alcaldía de Venustiano Carranza, bomberos acudieron para extinguirlo.

#CDMX #México #Edomex #Puebla https://t.co/m3pTSCS7Pa","['incendiar', 'mercado', 'morelos', 'cdmx', 'luego', 'reportar', 'incendio', 'mercado', 'morelos', 'ubicado', 'eduardo', 'molina', 'herreros', 'colonia', 'morelos', 'alcaldía', 'venustiano', 'carranza', 'bombero', 'acudir', 'extinguido']","['ÚltimaHora', 'CDMX', 'México', 'Edomex', 'Puebla']",[],3,0,3,392469861,PERIÓDICO SUPREMO,Diario_Supremo,2011-10-16 20:54:46,0,59590,69932,2020-01-15 22:50:25,2020,01,15,22,50,17,Venustiano Carranza,-99.0931057959,19.4304954545
1217670634240499712,incendio,palabras clave,"¡Cuidado! Movilización de cuerpos de emergencia  en la Alcaldía Venustiano Carranza, en inmediaciones del Mercado #Morelos, debido a un #incendio.","['cuidado', 'movilización', 'cuerpos', 'emergencio', 'alcaldío', 'venustiano', 'carranza', 'inmediaciones', 'mercado', 'debido']","['Morelos', 'incendio']",[],11,0,1,40098528,Radio Tráfico Total,trafico889,2009-05-14 16:06:13,1,899098,70,2020-01-15 22:51:17,2020,01,15,22,51,17,Venustiano Carranza,-99.0931057959,19.4304954545
1217672063663726593,incendio,palabras clave,"#ÚLTIMAHORA Se registró un incendio en el Mercado Morelos, alcaldía Venustiano Carranza. Bomberos ya controlaron el fuego. Se registraron afectaciones en 15 locales. #CDMX  https://t.co/ZuxhgpNndi","['registrar', 'incendio', 'mercado', 'morelos', 'alcaldía', 'venustiano', 'carranza', 'bomberos', 'controlar', 'fuego', 'registrar', 'afectación', '15', 'local']","['ÚLTIMAHORA', 'CDMX']",[],0,0,0,84979196,Ricardo Sánchez,RicsaPeriodista,2009-10-24 19:16:53,0,1851,3151,2020-01-15 22:56:57,2020,01,15,22,56,17,Venustiano Carranza,-99.0931057959,19.4304954545
1217678005042139136,incendio,palabras clave,"Bomberos y personal de Protección Civil acudieron al establecimiento que se ubica sobre Eduardo Molina y la calle Herreros, en la Alcaldía de Venustiano Carranza para controlar el fuego https://t.co/4hXrj3Fbc2","['bombero', 'personal', 'protección', 'civil', 'acudir', 'establecimiento', 'ubicar', 'eduardo', 'molina', 'calle', 'herreros', 'alcaldía', 'venustiano', 'carranza', 'controlar', 'fuego']",[],[],11,0,4,773634511791947776,JUSTICIA,ReformaJusticia,2016-09-07 15:30:15,0,8928,283,2020-01-15 23:20:34,2020,01,15,23,20,17,Venustiano Carranza,-99.0931057959,19.4304954545
1217678955211300864,incendio,palabras clave,"🔥🔥🔥 Imágenes del incendio en el Mercado Morelos localizado en el perímetro de la alcaldía Venustiano Carranza, en CDMX. Autoridades informan que el siniestro inicio en un local de venta de veladoras y artículos esotéricos y que no se reportan personas heridas o fallecidas. https://t.co/6e73hDFh3m","['imagen', 'incendio', 'mercado', 'morelo', 'localizado', 'perímetro', 'alcaldía', 'venustiano', 'carranza', 'cdmx', 'autoridades', 'informar', 'siniestro', 'inicio', 'local', 'venta', 'voladora', 'artículo', 'esotérico', 'reportar', 'persona', 'herido', 'fallecido']",[],[],9,0,3,38293203,El Gráfico,elgmx,2009-05-06 16:24:58,0,108051,1,2020-01-15 23:24:20,2020,01,15,23,24,17,Venustiano Carranza,-99.0931057959,19.4304954545
1217679418962927616,incendio,palabras clave,"#XHEQMORELOS #CDMX 

🚨
-Y por si fuera poco un terrible incendio azota el mercado de la colonia Morelos, delegación Venustiano Carranza, los bomberos ya controlarán el incendio. https://t.co/5TNBVNHhJC","['si', 'terrible', 'incendio', 'azotar', 'mercado', 'colonia', 'morelos', 'delegación', 'venustiano', 'carranza', 'bomberos', 'controlar', 'incendio']","['XHEQMORELOS', 'CDMX']",[],0,0,0,147232198,JUAN MANUEL,RONDEROS7,2010-05-23 09:22:11,0,726,4804,2020-01-15 23:26:11,2020,01,15,23,26,17,Venustiano Carranza,-99.0931057959,19.4304954545
1217679721548390401,incendio,palabras clave,"🔥🔥🔥 Imágenes del incendio en el Mercado Morelos localizado en el perímetro de la alcaldía Venustiano Carranza, en CDMX. Autoridades informan que el siniestro inicio en un local de venta de veladoras y artículos esotéricos y que no se reportan personas heridas o fallecidas. https://t.co/9Kvjf58AXg","['imagen', 'incendio', 'mercado', 'morelo', 'localizado', 'perímetro', 'alcaldía', 'venustiano', 'carranza', 'cdmx', 'autoridades', 'informar', 'siniestro', 'inicio', 'local', 'venta', 'voladora', 'artículo', 'esotérico', 'reportar', 'persona', 'herido', 'fallecido']",[],[],6,0,7,38293203,El Gráfico,elgmx,2009-05-06 16:24:58,0,108051,1,2020-01-15 23:27:23,2020,01,15,23,27,17,Venustiano Carranza,-99.0931057959,19.4304954545
1217680042890801152,incendio,palabras clave,"🔥🔥🔥 Imágenes del incendio en el Mercado Morelos localizado en el perímetro de la alcaldía Venustiano Carranza, en CDMX. Autoridades informan que el siniestro inicio en un local de venta de veladoras y artículos esotéricos y que no se reportan personas heridas o fallecidas. https://t.co/fWacZ9ap9F","['imagen', 'incendio', 'mercado', 'morelo', 'localizado', 'perímetro', 'alcaldía', 'venustiano', 'carranza', 'cdmx', 'autoridades', 'informar', 'siniestro', 'inicio', 'local', 'venta', 'voladora', 'artículo', 'esotérico', 'reportar', 'persona', 'herido', 'fallecido']",[],[],10,0,5,38293203,El Gráfico,elgmx,2009-05-06 16:24:58,0,108051,1,2020-01-15 23:28:40,2020,01,15,23,28,17,Venustiano Carranza,-99.0931057959,19.4304954545
1217680194275811328,incendio,palabras clave,Reportan Incendio en Mercado Morelos en la Venustiano Carranza https://t.co/iDCZnEOTqY vía @politicomx,"['reportar', 'incendio', 'mercado', 'morelos', 'venustiano', 'carranza', 'vía']",[],['politicomx'],0,0,0,3226669238,Pedro Francisco #Insurrecto y #patriota,MDOPedro,2015-05-25 19:06:57,0,3592,4999,2020-01-15 23:29:16,2020,01,15,23,29,17,Venustiano Carranza,-99.0931057959,19.4304954545
1217688389656301569,incendio,coordenadas,"00:01 #AlertaVial por incendio de pastizal, en Av. Río de los Remedios y Av. León de los Aldama, col. San Felipe de Jesús, alcaldía GAM, servicios de emergencia al lugar.","['00', '01', 'incendio', 'pastizal', 'av', 'río', 'remedios', 'av', 'león', 'aljama', 'col', 'san', 'felipe', 'jesus', 'alcaldía', 'gam', 'servicio', 'emergencio', 'lugar']",['AlertaVial'],[],6,0,0,166594238,OVIAL_SSCCDMX,OVIALCDMX,2010-07-14 09:00:43,1,1942061,135,2020-01-16 00:01:50,2020,01,16,00,01,16,Miguel Hidalgo,-99.1843501,19.3998346
1217696913845145600,incendio,coordenadas,"00:35 #PrecauciónVial por incendio, en Felipe Carrillo Puerto y Lago Managua, col. Torre Blanca, alcaldía Miguel Hidalgo, servicios de emergencia al lugar.","['00', '35', 'incendio', 'felipe', 'carrillo', 'puerto', 'lago', 'managua', 'col', 'torre', 'blanco', 'alcaldía', 'miguel', 'hidalgo', 'servicio', 'emergencio', 'lugar']",['PrecauciónVial'],[],15,1,5,166594238,OVIAL_SSCCDMX,OVIALCDMX,2010-07-14 09:00:43,1,1942061,135,2020-01-16 00:35:42,2020,01,16,00,35,16,Miguel Hidalgo,-99.1843501,19.3998346
1217770185534234624,incendio,coordenadas,"05:26 #PrecauciónVial por incendio en EJe 6 Sur a la altura de Av. Rojo Gómez, col. San Pedro, alcaldía Iztapalapa, servicios de emergencia acuden al lugar.","['05', '26', 'incendio', 'eje', 'sur', 'altura', 'av', 'rojo', 'gomez', 'col', 'san', 'pedro', 'alcaldía', 'iztapalapa', 'servicios', 'emergencia', 'acudir', 'lugar']",['PrecauciónVial'],[],6,0,0,166594238,OVIAL_SSCCDMX,OVIALCDMX,2010-07-14 09:00:43,1,1942061,135,2020-01-16 05:26:51,2020,01,16,05,26,16,Miguel Hidalgo,-99.1843501,19.3998346
1217772506217451520,incendio,coordenadas,"05:36 #AlertaVial por incendio en Calle Madrid a la altura de Francisco Javier Mina, col. Del Carmen, alcaldía Coyoacán, servicios de emergencia se dirigen al lugar.","['05', '36', 'incendio', 'calle', 'madrid', 'altura', 'francisco', 'javier', 'mina', 'col', 'carmen', 'alcaldía', 'coyoacán', 'servicio', 'emergencio', 'dirigir', 'lugar']",['AlertaVial'],[],5,0,1,166594238,OVIAL_SSCCDMX,OVIALCDMX,2010-07-14 09:00:43,1,1942061,135,2020-01-16 05:36:05,2020,01,16,05,36,16,Miguel Hidalgo,-99.1843501,19.3998346
1217782048162664449,incendio,palabras clave,"#Entérate Ocurrió un incendio en el mercado Morelos de la alcaldía Venustiano Carranza. De acuerdo con las autoridades, no se reportaron lesionados, solo atenciones por crisis nerviosas.","['ocurrir', 'incendio', 'mercado', 'morelos', 'alcaldía', 'venustiano', 'carranza', 'acuerdo', 'autoridad', 'reportar', 'lesionado', 'solo', 'atención', 'crisis', 'nervioso']",['Entérate'],[],12,0,1,83897461,Juan Manuel Jiménez,juanmapregunta,2009-10-20 12:24:24,1,72979,996,2020-01-16 06:14:00,2020,01,16,06,14,17,Venustiano Carranza,-99.0931057959,19.4304954545
1217798616674455552,tránsito,palabras clave,El tránsito es lento sobre Av. Río Churubusco desde Av. Andrés Molina Enríquez hasta Av. México Coyoacán. #MovilidadCDMX #C5 https://t.co/m1p2VsnwBP,"['tránsito', 'lento', 'av', 'río', 'churubusco', 'av', 'andrés', 'molina', 'enriquez', 'av', 'méxico', 'coyoacán']","['MovilidadCDMX', 'C5']",[],60,1,8,195951901,C5 CDMX,C5_CDMX,2010-09-27 17:51:04,1,947198,760,2020-01-16 07:19:50,2020,01,16,07,19,3,Coyoacán,-99.1503763525,19.3266672536
1217804151016443905,tránsito,palabras clave,"07:40 Policías de #Tránsito implementan dispositivo para inhibir el acceso de vehículos sobre carril exclusivo de @MetrobusCDMX y apoyo a la movilidad sobre Rep. de Argentina y Venezuela, col. Centro Histórico, alcaldía Cuauhtémoc. #MovilidadCDMX https://t.co/EEJ6hmbZYe","['07', '40', 'policía', 'implementar', 'dispositivo', 'inhibir', 'acceso', 'vehículo', 'carril', 'exclusivo', 'apoyo', 'movilidad', 'rep', 'argentina', 'venezuela', 'col', 'centro', 'histórico', 'alcaldía', 'cuauhtemoc']","['Tránsito', 'MovilidadCDMX']",['MetrobusCDMX'],4,1,0,166594238,OVIAL_SSCCDMX,OVIALCDMX,2010-07-14 09:00:43,1,1942068,135,2020-01-16 07:41:49,2020,01,16,07,41,15,Cuauhtémoc,-99.1490557562,19.4313734294
1217813803229822976,incendio,palabras clave,"Jueves 16 enero 2020
Incendio en mercado Morelos
En las primeras horas de este día se registró un incendio en el mercado Morelos, el incidente dejó 19 locales afectados. Por su parte, el alcalde de Venustiano Carranza, Julio César Moreno, informó que no se reportan lesionados. https://t.co/wTQ5d22cZ1","['jueves', '16', 'enero', '2020incendio', 'mercado', 'morelo', 'primero', 'hora', 'día', 'registrar', 'incendio', 'mercado', 'morelos', 'incidente', 'dejar', '19', 'local', 'afectado', 'parte', 'alcalde', 'venustiano', 'carranza', 'julio', 'césar', 'moreno', 'informar', 'reportar', 'lesionado']",[],[],0,0,0,1012415037036589056,informante_urbano,InformanteU,2018-06-28 13:18:49,0,56,911,2020-01-16 08:20:11,2020,01,16,08,20,17,Venustiano Carranza,-99.0931057959,19.4304954545
1217817407508664320,incendio,palabras clave,"#MuchoOjO Continúan labores de servicios de emergencia por incendio de domicilio, en colonia U. H. Emiliano Zapata, Coyoacán https://t.co/DyKpHfRsvX","['continúar', 'labor', 'servicio', 'emergencio', 'incendio', 'domicilio', 'colonia', 'emiliano', 'zapata', 'coyoacán']",['MuchoOjO'],[],0,0,0,1033941244257476610,OMAC CDMX,omacmx,2018-08-26 22:56:17,0,2895,1114,2020-01-16 08:34:30,2020,01,16,08,34,3,Coyoacán,-99.1503763525,19.3266672536
1217838864322252802,tránsito,palabras clave,"@Claudiashein Camiones en doble fila Descargando en la vía pública, cuando existen andenes para lo mismo, Av. México entre Parroquia y Zapata, Col. Santa Cruz Atoyac, apliquen reglamento tránsito no aplicarlo es CORRUPCION, cambien policías del cuadrante","['camión', 'doble', 'fila', 'descargar', 'vía', 'público', 'existir', 'andén', 'mismo', 'av', 'méxico', 'parroquia', 'zapata', 'col', 'santa', 'cruz', 'apoyar', 'aplicar', 'reglamento', 'tránsito', 'aplicar él', 'corrupcion', 'cambiar', 'policía', 'cuadrante']",[],['Claudiashein'],0,0,0,2597272124,PzaUniv,bj_pza,2014-06-30 20:41:02,0,3,25,2020-01-16 09:59:46,2020,01,16,09,59,14,Benito Juárez,-99.1611346584,19.3806424162
1217838919162716160,tránsito,palabras clave,"@UCS_GCDMX Camiones en doble fila Descargando en la vía pública, cuando existen andenes para lo mismo, Av. México entre Parroquia y Zapata, Col. Santa Cruz Atoyac, apliquen reglamento tránsito no aplicarlo es CORRUPCION, cambien policías del cuadrante","['camión', 'doble', 'fila', 'descargar', 'vía', 'público', 'existir', 'andén', 'mismo', 'av', 'méxico', 'parroquia', 'zapata', 'col', 'santa', 'cruz', 'apoyar', 'aplicar', 'reglamento', 'tránsito', 'aplicar él', 'corrupcion', 'cambiar', 'policía', 'cuadrante']",[],['UCS_GCDMX'],0,0,0,2597272124,PzaUniv,bj_pza,2014-06-30 20:41:02,0,3,25,2020-01-16 09:59:59,2020,01,16,09,59,14,Benito Juárez,-99.1611346584,19.3806424162
1217839195781242889,tránsito,palabras clave,"@SSP_CDMX Camiones en doble fila Descargando en la vía pública, cuando existen andenes para lo mismo, Av. México entre Parroquia y Zapata, Col. Santa Cruz Atoyac, apliquen reglamento tránsito no aplicarlo es CORRUPCION, cambien policías del cuadrante","['camión', 'doble', 'fila', 'descargar', 'vía', 'público', 'existir', 'andén', 'mismo', 'av', 'méxico', 'parroquia', 'zapata', 'col', 'santa', 'cruz', 'apoyar', 'aplicar', 'reglamento', 'tránsito', 'aplicar él', 'corrupcion', 'cambiar', 'policía', 'cuadrante']",[],['SSP_CDMX'],0,0,0,2597272124,PzaUniv,bj_pza,2014-06-30 20:41:02,0,3,25,2020-01-16 10:01:05,2020,01,16,10,01,14,Benito Juárez,-99.1611346584,19.3806424162
1217839752080171008,tránsito,palabras clave,"@transito_CDMX Camiones en doble fila Descargando en la vía pública, cuando existen andenes para lo mismo, Av. México entre Parroquia y Zapata, Col. Santa Cruz Atoyac, apliquen reglamento tránsito no aplicarlo es CORRUPCION, cambien policías del cuadrante","['camión', 'doble', 'fila', 'descargar', 'vía', 'público', 'existir', 'andén', 'mismo', 'av', 'méxico', 'parroquia', 'zapata', 'col', 'santa', 'cruz', 'apoyar', 'aplicar', 'reglamento', 'tránsito', 'aplicar él', 'corrupcion', 'cambiar', 'policía', 'cuadrante']",[],['transito_CDMX'],0,0,0,2597272124,PzaUniv,bj_pza,2014-06-30 20:41:02,0,3,25,2020-01-16 10:03:17,2020,01,16,10,03,14,Benito Juárez,-99.1611346584,19.3806424162
1217839879381495808,incendio,palabras clave,"#QPI #QPINACIONAL

FUERTE INCENDIO CONSUME EL MERCADO MORELOS🚒

La noche del miércoles y parte de la madrugada de este jueves, los bomberos combatieron el fuego que consumió al menos 12 locales del Mercado Morelos, en la Alcaldía Venustiano Carranza. https://t.co/4OLsaegQ5F","['fuerte', 'incendio', 'consumir', 'mercado', 'morelo', 'noche', 'miércoles', 'parte', 'madrugada', 'jueves', 'bombero', 'combatir', 'fuego', 'consumir', 'menos', '12', 'local', 'mercado', 'morelos', 'alcaldía', 'venustiano', 'carranza']","['QPI', 'QPINACIONAL']",[],0,0,0,1154236110920474624,¿Qué Plan Informa?,QuePlanInforma,2019-07-24 21:45:08,0,29,129,2020-01-16 10:03:48,2020,01,16,10,03,17,Venustiano Carranza,-99.0931057959,19.4304954545
1217847383318548481,tránsito,palabras clave,@monro1_ Le falta conocer la ciudad para darse cuenta que hay desniveles que cruzan Tlalpan SIN lateral y leer el Reglamento de Tránsito que dice que ciclistas pueden ocupar el carril de circulación al no ser vías de acceso controlado. La ignorancia es peligrosa. https://t.co/2Os5h640YL,"['faltar', 'conocer', 'ciudad', 'dar él', 'cuenta', 'desnivel', 'cruzar', 'tlalpan', 'lateral', 'leer', 'reglamento', 'tránsito', 'decir', 'ciclista', 'poder', 'ocupar', 'carril', 'circulación', 'ser', 'vía', 'acceso', 'controlado', 'ignorancia', 'peligroso']",[],['monro1_'],0,0,0,200179397,𝓒𝓪𝓻𝓶𝓮𝓷 𝓥á𝔃𝓺𝓾𝓮𝔃,Ellenwen,2010-10-08 10:56:46,0,1320,966,2020-01-16 10:33:37,2020,01,16,10,33,12,Tlalpan,-99.2062207957,19.1983396763
1217849370185490432,tránsito,palabras clave,"@IztacalcoAl Este auto fue chocado en iztacalco y calle 3, ya se levanto el reporte y no lo quitan esta en mera esquina de una calle complicada porque es la que desahoga el trafico a Rojo Gómez, hasta cuando dejaran de hacer campaña y se pondran a trabajar. #armandoquintero https://t.co/oLr6DMDDbp","['auto', 'chocado', 'iztacalco', 'calle', 'levanto', 'reporte', 'quitar', 'mero', 'esquina', 'calle', 'complicado', 'desahogo', 'trafico', 'rojo', 'gomez', 'dejar', 'hacer', 'campaña', 'poner', 'trabajar']",['armandoquintero'],['IztacalcoAl'],0,0,0,138184101,MAC,IMadjuntas,2010-04-28 15:28:07,0,69,198,2020-01-16 10:41:31,2020,01,16,10,41,6,Iztacalco,-99.094329797,19.396911897
1217862507370553345,tránsito,palabras clave,Ayúdenme a darle seguimiento a estas violaciones al reglamento de Tránsito siempre es lo mismo todo el día carros en la banqueta Eje 8 popocatepetl #85 col. Portales Sur Alcaldía Benito Juárez cp 03300 @OVIALCDMX @SSP_CDMX @UCS_GCDMX @arnemx @supercivicosmx @BJAlcaldia https://t.co/uxYrYnwsDM,"['ayúdenmar', 'dar él', 'seguimiento', 'violación', 'reglamento', 'tránsito', 'siempre', 'mismo', 'día', 'carro', 'banqueta', 'eje', 'popocatepetl', 'col', 'portal', 'sur', 'alcaldía', 'benito', 'juarez', 'cp', '03300']",['85'],"['OVIALCDMX', 'SSP_CDMX', 'UCS_GCDMX', 'arnemx', 'supercivicosmx', 'BJAlcaldia']",0,1,0,311289390,Ángel_José_Vazquez,ELEFECTIVO455,2011-06-05 00:04:06,0,5,30,2020-01-16 11:33:43,2020,01,16,11,33,14,Benito Juárez,-99.1611346584,19.3806424162
1217865334985760768,incendio,palabras clave,"REPORTAN INCENDIO 🔥🚒 en Tonalá, Col. El Mirador, Josefa Ortiz De Domínguez y Cuauhtémoc. Tome precauciones","['reportar', 'incendio', 'tonal', 'col', 'mirador', 'josefa', 'ortiz', 'dominguez', 'cuauhtemoc', 'tomar', 'precaución']",[],[],0,0,0,4501789032,Escudo Urbano C5 Jalisco,EscudoUrbanoJal,2015-12-08 18:15:15,0,45932,40,2020-01-16 11:44:57,2020,01,16,11,44,15,Cuauhtémoc,-99.1490557562,19.4313734294
1217870089929797634,tránsito,coordenadas,"@ViveStaFe @jpsenosiain @Claudiashein @OVIALCDMX @SSP_CDMX Artículos 2o y 17 del Reglamento de Tránsito, lea!!!!","['artículo', '2o', '17', 'reglamento', 'tránsito', 'leer']",[],"['ViveStaFe', 'jpsenosiain', 'Claudiashein', 'OVIALCDMX', 'SSP_CDMX']",0,0,0,132654328,Yorch BK,liciusjorge,2010-04-13 14:48:21,0,171,632,2020-01-16 12:03:51,2020,01,16,12,03,12,Tlalpan,-99.1600234,19.152878
1217874114582654979,tránsito,palabras clave,@MA_Orellano @todonoticias @Kicillofok Pues considero que es una obra que agilizaría el tráfico de vehículos y eliminaría los accidentes de tránsito por lo que estaría bueno que se continúe haciendo 🤷🏽‍♂️,"['pues', 'considerar', 'obra', 'utilizar', 'tráfico', 'vehículo', 'eliminar', 'accidente', 'tránsito', 'bueno', 'continúar', 'hacer']",[],"['MA_Orellano', 'todonoticias', 'Kicillofok']",0,2,0,578605730,George,jorgeledesmaok,2012-05-12 21:20:42,0,112,262,2020-01-16 12:19:50,2020,01,16,12,19,9,Milpa Alta,-56.908633,-37.1373157
