pubID,topicQuery,typeQuery,tweet,tokens,hashtags,mentions,likeCount,replyCount,retweetCount,authorID,authorName,authorUsername,authorCreatedAt,authorVerified,followersCount,followingCount,pubDate,pubYear,pubMonth,pubDay,pubHour,pubMinute,geoID,geoName,longitude,latitude
1228741937550831622,tránsito,palabras clave,"Un #accidente de #tránsito en Paseo de las  Jacarandas, Nueva Vallejo, Gustavo A. Madero fue reportado a la #CruzRojaMexicana, te recomendamos tener cuidado al transitar en esa zona https://t.co/wmUNDiJyMN","['paseo', 'jacaranda', 'nuevo', 'vallejo', 'gustavo', 'madero', 'reportado', 'recomendar', 'tener', 'cuidado', 'transitar', 'zona']","['accidente', 'tránsito', 'CruzRojaMexicana']",[],1,0,0,476050170,Cruz Roja CDMX,CruzRoja_CDMX,2012-01-27 12:27:33,0,43836,370,2020-02-15 12:04:41,2020,02,15,12,04,5,Gustavo A. Madero,-99.1158642087,19.5040652077
1228765860833251328,tránsito,palabras clave,"En la dirección Pino, Florida, Álvaro Obregón un vehículo de la #CruzRojaMexicana atiende un #accidente de #tránsito, evita esas vialidades https://t.co/nI6HQerGu8","['dirección', 'pino', 'florida', 'alvaro', 'obregon', 'vehículo', 'atender', 'evitar', 'vialidad']","['CruzRojaMexicana', 'accidente', 'tránsito']",[],3,0,0,476050170,Cruz Roja CDMX,CruzRoja_CDMX,2012-01-27 12:27:33,0,43841,370,2020-02-15 13:39:45,2020,02,15,13,39,10,Álvaro Obregón,-99.246819712,19.336175562
1228771821622890497,tránsito,palabras clave,"@MarkoCortes Por favor investiguen a una escuela ""PREPARACION IPN"" tienen más de 6 casas en las colonias San Bartolo Atepehuacan y Planetario Lindavista,  Alcaldía GAM desde hace un año con MORENA, provocando muchos problemas de tránsito,tumultos de estudiantes. DENUNCIA ANONIMA.","['favor', 'investigar', 'escuela', 'preparacion', 'ipn', 'casa', 'colonia', 'san', 'barroco', 'atepehuacar', 'planetario', 'lindavista', 'alcaldía', 'gam', 'hacer', 'año', 'morén', 'provocar', 'problema', 'tránsito', 'tumultos', 'estudiant', 'denunciar', 'anonimo']",[],['MarkoCortes'],0,0,0,709798615993069569,cecilyaarias,cecilyaarias,2016-03-15 11:49:12,0,2,31,2020-02-15 14:03:26,2020,02,15,14,03,5,Gustavo A. Madero,-99.1158642087,19.5040652077
1228796704503345152,tránsito,palabras clave,"Al transitar por Melchor Ocampo, Veronica Anzures, Miguel Hidalgo encontrarás un #accidente de #tránsito atendido por #CruzRojaMexicana, ten cuidado y disminuye tu velocidad  https://t.co/Nl9WICaQbB","['transitar', 'melchor', 'ocampo', 'veronico', 'azules', 'miguel', 'hidalgo', 'encontrarás', 'atendido', 'ten', 'cuidado', 'disminuir', 'velocidad']","['accidente', 'tránsito', 'CruzRojaMexicana']",[],1,0,1,476050170,Cruz Roja CDMX,CruzRoja_CDMX,2012-01-27 12:27:33,0,43836,370,2020-02-15 15:42:18,2020,02,15,15,42,16,Miguel Hidalgo,-99.2045669144,19.4280623649
1228798559564304384,tránsito,palabras clave,"Un #accidente de #tránsito en Melchor Ocampo, Veronica Anzures, Miguel Hidalgo fue reportado a la #CruzRojaMexicana, te recomendamos tener cuidado al transitar en esa zona https://t.co/Nl9WICaQbB","['melchor', 'ocampo', 'veronico', 'azules', 'miguel', 'hidalgo', 'reportado', 'recomendar', 'tener', 'cuidado', 'transitar', 'zona']","['accidente', 'tránsito', 'CruzRojaMexicana']",[],1,0,0,476050170,Cruz Roja CDMX,CruzRoja_CDMX,2012-01-27 12:27:33,0,43836,370,2020-02-15 15:49:41,2020,02,15,15,49,16,Miguel Hidalgo,-99.2045669144,19.4280623649
1228807816032522241,tránsito,palabras clave,"Una #ambulancia de #CruzRojaMexicana está atendiendo un #accidente de #tránsito en Av Insurgentes Norte, Guadalupe Insurgentes, Gustavo A. Madero extrema precauciones al pasar por ese lugar https://t.co/rA6tllI11P","['atender', 'av', 'insurgente', 'norte', 'guadalupe', 'insurgentes', 'gustavo', 'madero', 'extremo', 'precaución', 'pasar', 'lugar']","['ambulancia', 'CruzRojaMexicana', 'accidente', 'tránsito']",[],1,0,0,476050170,Cruz Roja CDMX,CruzRoja_CDMX,2012-01-27 12:27:33,0,43836,370,2020-02-15 16:26:28,2020,02,15,16,26,5,Gustavo A. Madero,-99.1158642087,19.5040652077
1228808580452802563,tránsito,palabras clave,"#CruzRojaMexicana está atendiendo un #accidente de #tránsito en Calz Vallejo, Industrial Vallejo, Azcapotzalco con una #ambulancia donada con tus aportaciones https://t.co/Vl1M5K3Kmr","['atender', 'call', 'vallejo', 'industrial', 'vallejo', 'azcapotzalco', 'donado', 'aportación']","['CruzRojaMexicana', 'accidente', 'tránsito', 'ambulancia']",[],1,0,0,476050170,Cruz Roja CDMX,CruzRoja_CDMX,2012-01-27 12:27:33,0,43836,370,2020-02-15 16:29:30,2020,02,15,16,29,2,Azcapotzalco,-99.1821069423,19.4853286147
1228834026586361858,tránsito,palabras clave,"#CruzRojaMexicana está ayudando en un #accidente de #tránsito en Av Obregon, Cuauhtémoc, San Luis Río Colorado, ten cuidado al pasar por el lugar https://t.co/X5hTlRHwhb","['ayudar', 'av', 'obregon', 'cuauhtemoc', 'san', 'luis', 'río', 'colorado', 'ten', 'cuidado', 'pasar', 'lugar']","['CruzRojaMexicana', 'accidente', 'tránsito']",[],0,0,0,708088889785778177,Cruz Roja Sonora,CruzRojaSonora,2016-03-10 18:35:21,0,1117,152,2020-02-15 18:10:37,2020,02,15,18,10,15,Cuauhtémoc,-99.1490557562,19.4313734294
1228847878577303555,tránsito,palabras clave,"Personal de la #CruzRojaMexicana auxilian a un paciente en Calle 9, Aguilera, Azcapotzalco debido a un #accidente de #tránsito https://t.co/WGrEEIzQCq","['personal', 'auxiliar', 'paciente', 'calle', 'aguilera', 'azcapotzalco', 'debido']","['CruzRojaMexicana', 'accidente', 'tránsito']",[],3,0,0,476050170,Cruz Roja CDMX,CruzRoja_CDMX,2012-01-27 12:27:33,0,43836,370,2020-02-15 19:05:39,2020,02,15,19,05,2,Azcapotzalco,-99.1821069423,19.4853286147
1228849723571920898,tránsito,palabras clave,"@seduviCDMX @inveacdmx Una revisión a los locales comerciales en ampliación San Marcos norte, Xochimilco que obstruyen las calles al tránsito vehicular y peatonal cuando aquí las calles son muy estrechas y pueden provocar accidentes a los peatones @JoseCarlosXoch","['revisión', 'local', 'comercial', 'ampliación', 'san', 'marcos', 'norte', 'xochimilco', 'obstruir', 'calle', 'tránsito', 'vehicular', 'peatonal', 'aquí', 'calle', 'estrecho', 'poder', 'provocar', 'accidente', 'peatón']",[],"['seduviCDMX', 'inveacdmx', 'JoseCarlosXoch']",0,0,0,1171961863816581121,Katu,gatosvagabundos,2019-09-11 19:41:30,0,44,201,2020-02-15 19:12:59,2020,02,15,19,12,13,Xochimilco,-99.0903636045,19.2451450458
1228853422650163200,tránsito,palabras clave,"Personal de la #CruzRojaMexicana auxilian a un paciente en Loreto, Loreto, Álvaro Obregón debido a un #accidente de #tránsito https://t.co/mrDRCywFA6","['personal', 'auxiliar', 'paciente', 'loreto', 'loreto', 'alvaro', 'obregon', 'debido']","['CruzRojaMexicana', 'accidente', 'tránsito']",[],1,0,0,476050170,Cruz Roja CDMX,CruzRoja_CDMX,2012-01-27 12:27:33,0,43841,370,2020-02-15 19:27:41,2020,02,15,19,27,10,Álvaro Obregón,-99.246819712,19.336175562
1228857690509783040,tránsito,palabras clave,"Un #accidente de #tránsito en Camino a san Juan de Aragon, Ampliación Casas Alemán, Gustavo A. Madero fue reportado a la #CruzRojaMexicana, te recomendamos tener cuidado al transitar en esa zona https://t.co/zhbHR3DwKS","['camino', 'san', 'juan', 'aragon', 'ampliación', 'casa', 'alemán', 'gustavo', 'madero', 'reportado', 'recomendar', 'tener', 'cuidado', 'transitar', 'zona']","['accidente', 'tránsito', 'CruzRojaMexicana']",[],3,0,0,476050170,Cruz Roja CDMX,CruzRoja_CDMX,2012-01-27 12:27:33,0,43836,370,2020-02-15 19:44:39,2020,02,15,19,44,5,Gustavo A. Madero,-99.1158642087,19.5040652077
1228857769911996416,tránsito,palabras clave,@Claudiashein @s @Alc_Iztapalapa A mi me emocionaría que los microbuseros respetaran el reglamento de tránsito.,"['emocionado', 'microbús', 'respetar', 'reglamento', 'tránsito']",[],"['Claudiashein', 's', 'Alc_Iztapalapa']",0,0,0,44063079,Osoberto “yo si hice mi tesis” Rodriguez,IngCanoRdz,2009-06-01 23:02:41,0,2302,2412,2020-02-15 19:44:58,2020,02,15,19,44,7,Iztapalapa,-99.0567989642,19.3491663204
1228858107905921026,tránsito,palabras clave,"Personal de la #CruzRojaMexicana auxilian a un paciente en Campo Hormiguero, San Miguel Amantla, Azcapotzalco debido a un #accidente de #tránsito https://t.co/8l4T7xVsbX","['personal', 'auxiliar', 'paciente', 'campo', 'hormiguero', 'san', 'miguel', 'amante', 'azcapotzalco', 'debido']","['CruzRojaMexicana', 'accidente', 'tránsito']",[],1,0,0,476050170,Cruz Roja CDMX,CruzRoja_CDMX,2012-01-27 12:27:33,0,43836,370,2020-02-15 19:46:18,2020,02,15,19,46,2,Azcapotzalco,-99.1821069423,19.4853286147
1228859497826988033,tránsito,palabras clave,"#CruzRojaMexicana está atendiendo un #accidente de #tránsito en Periferico, Periodista, Miguel Hidalgo con una #ambulancia donada con tus aportaciones https://t.co/sfoRw86j3p","['atender', 'periférico', 'periodista', 'miguel', 'hidalgo', 'donado', 'aportación']","['CruzRojaMexicana', 'accidente', 'tránsito', 'ambulancia']",[],4,0,0,476050170,Cruz Roja CDMX,CruzRoja_CDMX,2012-01-27 12:27:33,0,43836,370,2020-02-15 19:51:50,2020,02,15,19,51,16,Miguel Hidalgo,-99.2045669144,19.4280623649
1228866432760311808,tránsito,palabras clave,@OVIALCDMX sabe si hay bloqueo o accidente en viaducto tlalpan? Hay mucho tráfico y no avanza,"['saber', 'si', 'bloqueo', 'accidente', 'viaducto', 'tlalpan', 'tráfico', 'avanzar']",[],['OVIALCDMX'],0,0,0,103335562,sandra,sandraroman2,2010-01-09 12:11:26,0,888,1662,2020-02-15 20:19:23,2020,02,15,20,19,12,Tlalpan,-99.2062207957,19.1983396763
1228868779096072192,tránsito,palabras clave,"@seduviCDMX @inveacdmx @JoseCarlosXoch @Claudiashein urge revisión a locales comerciales obstruyen la calle al paso peatonal y vehicular provocando tráfico obligando a peatones caminar sobre las calles sin banquetas y angostas, en Prol. Tamarindos, col. Ampliación San Marcos norte, Xochimilco.","['urgir', 'revisión', 'local', 'comercial', 'obstruir', 'calle', 'paso', 'peatonal', 'vehicular', 'provocar', 'tráfico', 'obligar', 'peatón', 'caminar', 'calle', 'banqueta', 'angosto', 'rol', 'tamarindo', 'col', 'ampliación', 'san', 'marcos', 'norte', 'xochimilco']",[],"['seduviCDMX', 'inveacdmx', 'JoseCarlosXoch', 'Claudiashein']",0,0,0,1171961863816581121,Katu,gatosvagabundos,2019-09-11 19:41:30,0,44,201,2020-02-15 20:28:42,2020,02,15,20,28,13,Xochimilco,-99.0903636045,19.2451450458
1228871565338726400,tránsito,coordenadas,He visto agentes de tránsito conformarse con 15 y unas galletas emperador. https://t.co/CuVyj4g7Ve,"['ver', 'agente', 'tránsito', 'conformar él', '15', 'uno', 'galleta', 'emperador']",[],[],5,2,0,21320483,Juan Mi,griego_tragico,2009-02-19 11:46:32,0,1044,897,2020-02-15 20:39:47,2020,02,15,20,39,17,Venustiano Carranza,-99.259495,19.3863707
1228900976016416769,incendio,palabras clave,"#CedeElPaso ⚠️🚨  Bomberos se aproximan para trabajar por incendio en domicilio, colonia Santa Cruz Meyehualco, @Alc_Iztapalapa.  #C5  #911CDMX

@SSP_CDMX en el lugar.  🚔","['bombero', 'aproximar', 'trabajar', 'incendio', 'domicilio', 'colonia', 'santa', 'cruz', 'meyehualco', 'lugar']","['CedeElPaso', 'C5', '911CDMX']","['Alc_Iztapalapa', 'SSP_CDMX']",29,3,2,195951901,C5 CDMX,C5_CDMX,2010-09-27 17:51:04,1,947207,760,2020-02-15 22:36:39,2020,02,15,22,36,7,Iztapalapa,-99.0567989642,19.3491663204
1228909139948077056,incendio,palabras clave,"#Precaución 🚨  Servicios de emergencia trabajan por  incendio en domicilio, colonia Santa Cruz Meyehualco, 
@Alc_Iztapalapa.  #C5  #911CDMX","['servicio', 'emergencia', 'trabajar', 'incendio', 'domicilio', 'colonia', 'santa', 'cruz', 'meyehualco']","['Precaución', 'C5', '911CDMX']",['Alc_Iztapalapa'],10,0,3,195951901,C5 CDMX,C5_CDMX,2010-09-27 17:51:04,1,947207,760,2020-02-15 23:09:05,2020,02,15,23,09,7,Iztapalapa,-99.0567989642,19.3491663204
1228918814022291456,tránsito,palabras clave,"Tránsito lento sobre Viaducto Miguel Alemán al poniente, de Calzada de Tlalpan hasta Av. División del Norte.  #C5 #MovilidadCDMX https://t.co/gyLJ4zfV4N","['tránsito', 'lento', 'viaducto', 'miguel', 'alemán', 'poniente', 'calzado', 'tlalpan', 'av', 'división', 'norte']","['C5', 'MovilidadCDMX']",[],10,0,0,195951901,C5 CDMX,C5_CDMX,2010-09-27 17:51:04,1,947201,760,2020-02-15 23:47:32,2020,02,15,23,47,12,Tlalpan,-99.2062207957,19.1983396763
1228922566783459329,tránsito,palabras clave,"Al transitar por Periferico, 8 de Agosto, Álvaro Obregón encontrarás un #accidente de #tránsito atendido por #CruzRojaMexicana, ten cuidado y disminuye tu velocidad  https://t.co/42c7Yfkltf","['transitar', 'periférico', 'agosto', 'alvaro', 'obregon', 'encontrarás', 'atendido', 'ten', 'cuidado', 'disminuir', 'velocidad']","['accidente', 'tránsito', 'CruzRojaMexicana']",[],3,0,0,476050170,Cruz Roja CDMX,CruzRoja_CDMX,2012-01-27 12:27:33,0,43841,370,2020-02-16 00:02:26,2020,02,16,00,02,10,Álvaro Obregón,-99.246819712,19.336175562
1228940401727483904,tránsito,palabras clave,"Una #ambulancia de #CruzRojaMexicana está atendiendo un #accidente de #tránsito en Patriotismo, Escandón I Sección, Miguel Hidalgo extrema precauciones al pasar por ese lugar https://t.co/wwpqv1852Z","['atender', 'patriotismo', 'escalón', 'sección', 'miguel', 'hidalgo', 'extremo', 'precaución', 'pasar', 'lugar']","['ambulancia', 'CruzRojaMexicana', 'accidente', 'tránsito']",[],4,0,2,476050170,Cruz Roja CDMX,CruzRoja_CDMX,2012-01-27 12:27:33,0,43836,370,2020-02-16 01:13:19,2020,02,16,01,13,16,Miguel Hidalgo,-99.2045669144,19.4280623649
1228947729944064000,tránsito,palabras clave,"Personal de la #CruzRojaMexicana auxilian a un paciente en Eje Central, Centro (Área 2), Cuauhtémoc debido a un #accidente de #tránsito https://t.co/KVjSoQ5Tfu","['personal', 'auxiliar', 'paciente', 'eje', 'central', 'centro', 'área', 'cuauhtemoc', 'debido']","['CruzRojaMexicana', 'accidente', 'tránsito']",[],1,0,1,476050170,Cruz Roja CDMX,CruzRoja_CDMX,2012-01-27 12:27:33,0,43836,370,2020-02-16 01:42:26,2020,02,16,01,42,15,Cuauhtémoc,-99.1490557562,19.4313734294
1228947907442827264,tránsito,palabras clave,"Una #ambulancia de #CruzRojaMexicana está atendiendo un #accidente de #tránsito en Av Gran Canal, Nueva Atzacoalco, Gustavo A. Madero extrema precauciones al pasar por ese lugar https://t.co/KFHTa3lXUU","['atender', 'av', 'gran', 'canal', 'nuevo', 'atzacoalco', 'gustavo', 'madero', 'extremo', 'precaución', 'pasar', 'lugar']","['ambulancia', 'CruzRojaMexicana', 'accidente', 'tránsito']",[],1,0,0,476050170,Cruz Roja CDMX,CruzRoja_CDMX,2012-01-27 12:27:33,0,43836,370,2020-02-16 01:43:08,2020,02,16,01,43,5,Gustavo A. Madero,-99.1158642087,19.5040652077
1228953994841722880,tránsito,palabras clave,"En la dirección Paseo del Pedregal, Jardines del Pedregal, Álvaro Obregón un vehículo de la #CruzRojaMexicana atiende un #accidente de #tránsito, evita esas vialidades https://t.co/1IaktS0mpX","['dirección', 'paseo', 'pedregal', 'jardines', 'pedregal', 'alvaro', 'obregon', 'vehículo', 'atender', 'evitar', 'vialidad']","['CruzRojaMexicana', 'accidente', 'tránsito']",[],1,0,0,476050170,Cruz Roja CDMX,CruzRoja_CDMX,2012-01-27 12:27:33,0,43841,370,2020-02-16 02:07:19,2020,02,16,02,07,10,Álvaro Obregón,-99.246819712,19.336175562
1228957071917404160,tránsito,palabras clave,"En la dirección Av Biologo Maximino Martinez, San Salvador Xochimanca, Azcapotzalco un vehículo de la #CruzRojaMexicana atiende un #accidente de #tránsito, evita esas vialidades https://t.co/eEjhZI511k","['dirección', 'av', 'biology', 'maximo', 'martinez', 'san', 'salvador', 'xochimanca', 'azcapotzalco', 'vehículo', 'atender', 'evitar', 'vialidad']","['CruzRojaMexicana', 'accidente', 'tránsito']",[],2,0,0,476050170,Cruz Roja CDMX,CruzRoja_CDMX,2012-01-27 12:27:33,0,43836,370,2020-02-16 02:19:33,2020,02,16,02,19,2,Azcapotzalco,-99.1821069423,19.4853286147
1228960028784242688,tránsito,palabras clave,"Personal de la #CruzRojaMexicana auxilian a un paciente en Eje 10 sur, La Otra Banda, Álvaro Obregón debido a un #accidente de #tránsito https://t.co/Tc6Z07Brqj","['personal', 'auxiliar', 'paciente', 'eje', '10', 'sur', 'banda', 'alvaro', 'obregon', 'debido']","['CruzRojaMexicana', 'accidente', 'tránsito']",[],1,0,0,476050170,Cruz Roja CDMX,CruzRoja_CDMX,2012-01-27 12:27:33,0,43841,370,2020-02-16 02:31:18,2020,02,16,02,31,10,Álvaro Obregón,-99.246819712,19.336175562
1228972439868190720,tránsito,palabras clave,"Una #ambulancia de la #CruzRojaMexicana labora atendiendo a un paciente herido por un #accidente de #tránsito en Calle 22, Santa Rosa, Gustavo A. Madero https://t.co/s8LpsQBXax","['laborar', 'atender', 'paciente', 'herido', 'calle', '22', 'santa', 'rosa', 'gustavo', 'madero']","['ambulancia', 'CruzRojaMexicana', 'accidente', 'tránsito']",[],1,0,0,476050170,Cruz Roja CDMX,CruzRoja_CDMX,2012-01-27 12:27:33,0,43836,370,2020-02-16 03:20:37,2020,02,16,03,20,5,Gustavo A. Madero,-99.1158642087,19.5040652077
1229004399030173701,tránsito,palabras clave,"Una #ambulancia de #CruzRojaMexicana está atendiendo un #accidente de #tránsito en Cuitlahuac, Un Hogar Para Cada Trabajador, Azcapotzalco extrema precauciones al pasar por ese lugar https://t.co/P5IVgdkEUL","['atender', 'cuitlahuac', 'hogar', 'cada', 'trabajador', 'azcapotzalco', 'extremo', 'precaución', 'pasar', 'lugar']","['ambulancia', 'CruzRojaMexicana', 'accidente', 'tránsito']",[],1,0,0,476050170,Cruz Roja CDMX,CruzRoja_CDMX,2012-01-27 12:27:33,0,43836,370,2020-02-16 05:27:37,2020,02,16,05,27,2,Azcapotzalco,-99.1821069423,19.4853286147
1229011038898544645,tránsito,coordenadas,"05:52 #PrecauciónVial | Afectada la circulación en carriles centrales de Viaducto Miguel Alemán a la altura de Av. Patriotismo hacia el Oriente, anticipe su paso a carriles laterales. https://t.co/WWCIIAPsiS","['05', '52', 'afectado', 'circulación', 'carril', 'central', 'viaducto', 'miguel', 'alemán', 'altura', 'av', 'patriotismo', 'hacia', 'oriente', 'anticipar', 'paso', 'carril', 'lateral']",['PrecauciónVial'],[],5,0,1,166594238,OVIAL_SSCCDMX,OVIALCDMX,2010-07-14 09:00:43,1,1942069,135,2020-02-16 05:54:00,2020,02,16,05,54,16,Miguel Hidalgo,-99.1843501,19.3998346
1229023468009803776,tránsito,palabras clave,"#CruzRojaMexicana está atendiendo un #accidente de #tránsito en Paseo de la Reforma, Lomas Altas, Miguel Hidalgo con una #ambulancia donada con tus aportaciones https://t.co/7duitLYjw5","['atender', 'paseo', 'reforma', 'loma', 'alto', 'miguel', 'hidalgo', 'donado', 'aportación']","['CruzRojaMexicana', 'accidente', 'tránsito', 'ambulancia']",[],2,0,0,476050170,Cruz Roja CDMX,CruzRoja_CDMX,2012-01-27 12:27:33,0,43836,370,2020-02-16 06:43:23,2020,02,16,06,43,16,Miguel Hidalgo,-99.2045669144,19.4280623649
1229048197680513025,incendio,coordenadas,08:19 #PrecauciónVial | Ceda el paso a los equipos de emergencia en Anillo Periférico y la carretera Picacho-Ajusco por incendio https://t.co/39wsewQLP9,"['08', '19', 'cedar', 'paso', 'equipo', 'emergenciar', 'anillo', 'periférico', 'carretero', 'picacho-ajusto', 'incendio']",['PrecauciónVial'],[],6,0,1,166594238,OVIAL_SSCCDMX,OVIALCDMX,2010-07-14 09:00:43,1,1942061,135,2020-02-16 08:21:39,2020,02,16,08,21,16,Miguel Hidalgo,-99.1843501,19.3998346
1229071776795308037,tránsito,coordenadas,"@UCS_GCDMX @Geordazy @SSP_CDMX @OVIALCDMX @La_Portales Deberían cambiar el reglamento de tránsito! Y dejarlo por lo menos como estaba, antes se respetaban lo s señalamientos o por lo menos no dejabas el auto valiéndote madre que te digan algo.","['deber', 'cambiar', 'reglamento', 'tránsito', 'dejar él', 'menos', 'respetar', 'señalamiento', 'menos', 'dejar', 'auto', 'valer él', 'madre', 'decir']",[],"['UCS_GCDMX', 'Geordazy', 'SSP_CDMX', 'OVIALCDMX', 'La_Portales']",1,0,0,2741006517,Jose Stern,starmusicJose,2014-08-12 12:24:20,0,25,83,2020-02-16 09:55:21,2020,02,16,09,55,12,Tlalpan,-99.140238,19.2846922
1229072947257561089,tránsito,palabras clave,"🚴🏻‍♂️🏍️ ¡Cambian ley para proteger a ciclistas!🚴🏻‍♂️🏍️
Los cambios al Reglamento de Tránsito en Benito Juárez aplican para conductores de bicicletas, triciclo, bici moto, motocicleta, cuatrimoto y moto con carro lateral. 👇🏻👇🏻https://t.co/M2hkIxcoQU","['cambiar', 'ley', 'proteger', 'ciclista', 'cambio', 'reglamento', 'tránsito', 'benito', 'juarez', 'aplicar', 'conductor', 'bicicleta', 'triciclo', 'bici', 'moto', 'motocicleta', 'cuatrimotor', 'moto', 'carro', 'lateral']",[],[],0,0,1,155717277,Luces del Siglo,lucesdelsiglo,2010-06-14 16:36:25,0,22171,1602,2020-02-16 10:00:00,2020,02,16,10,00,14,Benito Juárez,-99.1611346584,19.3806424162
1229075431078420481,tránsito,palabras clave,"#AlMomento
Una #Ambulancia de #ProtecciónCivil de 
@Alc_Iztapalapa atiende un accidente de tránsito, en el eje 6 Sur en la colonia Margarita Maza de Juárez
No se distraiga al pasar.
@isidrocorro @MrElDiablo8 @tritonazteca11 @ElPolloCDMX @azucenau @alertasurbanas @Armando_Mtz_A7 https://t.co/pJbTBOc68A","['atender', 'accidente', 'tránsito', 'eje', 'sur', 'colonia', 'margarita', 'maza', 'juárezno', 'distraer', 'pasar']","['AlMomento', 'Ambulancia', 'ProtecciónCivil']","['Alc_Iztapalapa', 'isidrocorro', 'MrElDiablo8', 'tritonazteca11', 'ElPolloCDMX', 'azucenau', 'alertasurbanas', 'Armando_Mtz_A7']",3,1,1,4826633656,Ciudadano Vigilante,VigilanteCDMX,2016-01-19 00:53:49,0,8310,520,2020-02-16 10:09:52,2020,02,16,10,09,7,Iztapalapa,-99.0567989642,19.3491663204
1229089261783261191,tránsito,palabras clave,"En la dirección Platino, Valle Gómez, Cuauhtémoc un vehículo de la #CruzRojaMexicana atiende un #accidente de #tránsito, evita esas vialidades https://t.co/28Znz9s4Ta","['dirección', 'platino', 'valle', 'gomez', 'cuauhtemoc', 'vehículo', 'atender', 'evitar', 'vialidad']","['CruzRojaMexicana', 'accidente', 'tránsito']",[],0,0,1,476050170,Cruz Roja CDMX,CruzRoja_CDMX,2012-01-27 12:27:33,0,43836,370,2020-02-16 11:04:50,2020,02,16,11,04,15,Cuauhtémoc,-99.1490557562,19.4313734294
1229099485470568450,incendio,palabras clave,ayer se prendio fuego una maderera xla q paso siempre. hoy llego a otro trabajo y estan los bomberos en el mc donalds de enfrente. soy el encantador de incendios 🔥🔥🔥 https://t.co/fdmkaCINC9,"['ayer', 'predio', 'fuego', 'maderera', 'xla', 'paso', 'siempre', 'hoy', 'llego', 'trabajo', 'estan', 'bomberos', 'mc', 'donald', 'enfrente', 'encantador', 'incendio']",[],[],1,0,0,715064546,BAK O,BababumDeluxe,2012-07-24 16:54:08,0,73,212,2020-02-16 11:45:27,2020,02,16,11,45,8,La Magdalena Contreras,-99.2684129061,19.2689765031
1229130380826923008,tránsito,palabras clave,"@iztacalco_de @Claudiashein @SSP_CDMX Se coordina con policías #TránsitoCDMX para el retiro y sanción de los vehículos
infractores del reglamento de tránsito.","['coordín', 'policía', 'retiro', 'sanción', 'vehículosinfractor', 'reglamento', 'tránsito']",['TránsitoCDMX'],"['iztacalco_de', 'Claudiashein', 'SSP_CDMX']",0,1,0,172346252,Unidad de Contacto del Secretario SSC CDMX,UCS_GCDMX,2010-07-29 07:52:54,1,674364,93,2020-02-16 13:48:13,2020,02,16,13,48,6,Iztacalco,-99.094329797,19.396911897
1229180308206915585,incendio,coordenadas,"@Bomberos_CDMX hay un incendio en Santa Cruz, Xochimilco sobre Av. México casi esquina Lic. Pedro Benavides #bomberoscdmx
Carretera 113 antes de llegar al Mercado","['incendio', 'santa', 'cruz', 'xochimilco', 'av', 'méxico', 'casi', 'esquina', 'lic', 'pedro', 'benavides', 'carretera', '113', 'llegar', 'mercado']",['bomberoscdmx'],['Bomberos_CDMX'],1,0,2,2584153776,L'AbyssMo LBR,AbyssMotta,2014-06-23 09:20:31,0,149,548,2020-02-16 17:06:37,2020,02,16,17,06,13,Xochimilco,-99.07750083031544,19.24469115029526
1229293369194508289,incendio,coordenadas,"00:35 #PrecauciónVial, servicios de emergencia se dirigen hacia Av. Fuerte de Loreto a la altura de Agustín Botello, por incendio de vehículo. https://t.co/EPU6PK9IJP","['00', '35', 'servicio', 'emergencio', 'dirigir', 'hacia', 'av', 'fuerte', 'loreto', 'altura', 'agustin', 'botellar', 'incendio', 'vehículo']",['PrecauciónVial'],[],3,0,0,166594238,OVIAL_SSCCDMX,OVIALCDMX,2010-07-14 09:00:43,1,1942069,135,2020-02-17 00:35:53,2020,02,17,00,35,16,Miguel Hidalgo,-99.1843501,19.3998346
1229303250051989504,tránsito,coordenadas,"01:14 #PrecauciónVial | Por obras sobre Av. Minas de Cristo desde Nicanor Arvide hasta la Av. Alta Tensión con dirección hacia el Sur, carriles libres a la circulación. https://t.co/JJgzO391Em","['01', '14', 'obra', 'av', 'mina', 'cristo', 'nicanor', 'dividir', 'av', 'alto', 'tensión', 'dirección', 'hacia', 'sur', 'carril', 'libre', 'circulación']",['PrecauciónVial'],[],1,0,0,166594238,OVIAL_SSCCDMX,OVIALCDMX,2010-07-14 09:00:43,1,1942069,135,2020-02-17 01:15:08,2020,02,17,01,15,16,Miguel Hidalgo,-99.1843501,19.3998346
1229305236587601921,incendio,coordenadas,"01:22 #PrecauciónVial | Por incendio de vehículo en 5 de Mayo a la altura de Cerrada Apaches, col. San Francisco Culhuacan, servicios de emergencia se aproximan al lugar. https://t.co/sTcxl5icPD","['01', '22', 'incendio', 'vehículo', 'mayo', 'altura', 'cerrado', 'apaches', 'col', 'san', 'francisco', 'culiacan', 'servicios', 'emergencia', 'aproximar', 'lugar']",['PrecauciónVial'],[],2,0,1,166594238,OVIAL_SSCCDMX,OVIALCDMX,2010-07-14 09:00:43,1,1942069,135,2020-02-17 01:23:02,2020,02,17,01,23,16,Miguel Hidalgo,-99.1843501,19.3998346
1229308698981330944,tránsito,coordenadas,"01:36 #PrecauciónVial | Se confina Giotto al cruce con cerrada de Rosa Roja al Oriente, por obras, carriles libres a la circulación. https://t.co/k9uN6igMLD","['01', '36', 'confinar', 'glotto', 'cruce', 'cerrado', 'rosa', 'rojo', 'oriente', 'obra', 'carril', 'libre', 'circulación']",['PrecauciónVial'],[],0,0,2,166594238,OVIAL_SSCCDMX,OVIALCDMX,2010-07-14 09:00:43,1,1942069,135,2020-02-17 01:36:47,2020,02,17,01,36,16,Miguel Hidalgo,-99.1843501,19.3998346
