pubID,topicQuery,typeQuery,tweet,tokens,hashtags,mentions,likeCount,replyCount,retweetCount,authorID,authorName,authorUsername,authorCreatedAt,authorVerified,followersCount,followingCount,pubDate,pubYear,pubMonth,pubDay,pubHour,pubMinute,geoID,geoName,longitude,latitude
1424528396214849541,tránsito,palabras clave,"#CruzRojaMexicana está atendiendo un #accidente de #tránsito en #Guerrero, #Guerrero, #Cuauhtémoc con una #ambulancia donada con tus aportaciones https://t.co/Fxd282jWje","['atender', 'donado', 'aportación']","['CruzRojaMexicana', 'accidente', 'tránsito', 'Guerrero', 'Guerrero', 'Cuauhtémoc', 'ambulancia']",[],0,0,1,476050170,Cruz Roja CDMX,CruzRoja_CDMX,2012-01-27 12:27:33,0,43836,370,2021-08-08 19:30:10,2021,08,08,19,30,15,Cuauhtémoc,-99.1490557562,19.4313734294
1424539422142484485,tránsito,coordenadas,"@AdultoPeaton todos los días hay por lo menos un vehículo estacionado sobre la banqueta, aquí es donde las grúas y los oficiales de tránsito pueden llegar a su meta diaria, Av Xochimilco casi Esq con Calle Dos, Agricola Oriental en la @IztacalcoAl https://t.co/cz7TFeqXm0","['día', 'menos', 'vehículo', 'estacionado', 'banqueta', 'aquí', 'grúas', 'oficial', 'tránsito', 'poder', 'llegar', 'meta', 'diario', 'av', 'xochimilco', 'casi', 'esq', 'calle', 'dos', 'agricola', 'oriental']",[],"['AdultoPeaton', 'IztacalcoAl']",0,0,0,211245581,Smith,smithwill_10,2010-11-02 12:39:19,0,467,2080,2021-08-08 20:13:59,2021,08,08,20,13,6,Iztacalco,-99.137171,19.375769
1424541395528859651,tránsito,palabras clave,"Una #ambulancia de #CruzRojaMexicana está atendiendo un #accidente de #tránsito en #OtoÑo, #Ángel Zimbrón, #Azcapotzalco extrema precauciones al pasar por ese lugar https://t.co/P5BW3eNvTb","['atender', 'zimbrón', 'extremo', 'precaución', 'pasar', 'lugar']","['ambulancia', 'CruzRojaMexicana', 'accidente', 'tránsito', 'OtoÑo', 'Ángel', 'Azcapotzalco']",[],3,0,1,476050170,Cruz Roja CDMX,CruzRoja_CDMX,2012-01-27 12:27:33,0,43841,370,2021-08-08 20:21:50,2021,08,08,20,21,2,Azcapotzalco,-99.1821069423,19.4853286147
1424541434657611778,tránsito,palabras clave,"En la dirección #OtoÑo, #Ángel Zimbrón, #Azcapotzalco un vehículo de la #CruzRojaMexicana atiende un #accidente de #tránsito, evita esas vialidades https://t.co/P5BW3eNvTb","['dirección', 'zimbrón', 'vehículo', 'atender', 'evitar', 'vialidad']","['OtoÑo', 'Ángel', 'Azcapotzalco', 'CruzRojaMexicana', 'accidente', 'tránsito']",[],0,0,1,476050170,Cruz Roja CDMX,CruzRoja_CDMX,2012-01-27 12:27:33,0,43841,370,2021-08-08 20:21:59,2021,08,08,20,21,2,Azcapotzalco,-99.1821069423,19.4853286147
1424544634454351875,tránsito,palabras clave,"@miguelabducido @Alc_Iztapalapa @ClaraBrugadaM @Claudiashein @UCS_GCDMX En este caso en específico es constante sin que haya alguna reprimenda ejemplar con base en el reglamento de tránsito,pero tal parece que el infractor goza de impunidad haciendo quedar a las autoridades como incompetentes,la duda sería ¿cuánto le cuesta esa impunidad?","['caso', 'específico', 'constante', 'alguno', 'reprimenda', 'ejemplar', 'base', 'reglamento', 'tránsito', 'tal', 'parecer', 'infractor', 'gozar', 'impunidad', 'hacer', 'quedar', 'autoridad', 'incompetent', 'duda', 'cuánto', 'costar', 'impunidad']",[],"['miguelabducido', 'Alc_Iztapalapa', 'ClaraBrugadaM', 'Claudiashein', 'UCS_GCDMX']",2,0,0,339982667,🄴🄻 🅄🄹🅄🄻🄴🄹🅄🄻🄸🅃🄰,ElOshkarin,2011-07-21 17:49:11,0,96,134,2021-08-08 20:34:42,2021,08,08,20,34,7,Iztapalapa,-99.0567989642,19.3491663204
1424548720704643073,tránsito,palabras clave,"Si los del tractorazo quieren generar caos y desestabilidad, como hacen esos terroristas disfrazados de camioneros a través de la violencia. No necesitan obstaculizar el tránsito. 
Solo deben dejar de plantar. https://t.co/7EsknlEmaS","['si', 'tractora', 'querer', 'generar', 'cao', 'desestabilizar', 'hacer', 'terrorista', 'disfrazado', 'camionero', 'través', 'violencia', 'necesitar', 'obstaculizar', 'tránsito', 'solo', 'deber', 'dejar', 'plantar']",[],[],26,2,6,383499256,Marcos Josué Fretes💙,Ma_JosueFS94,2011-10-01 18:31:18,0,2882,4948,2021-08-08 20:50:56,2021,08,08,20,50,9,Milpa Alta,-56.2682304,-27.1796379
1424563323882905605,tránsito,palabras clave,"En la dirección #Homero, #Polanco I Sección, #Miguel Hidalgo un vehículo de la #CruzRojaMexicana atiende un #accidente de #tránsito, evita esas vialidades https://t.co/STbPPtsApz","['dirección', 'sección', 'hidalgo', 'vehículo', 'atender', 'evitar', 'vialidad']","['Homero', 'Polanco', 'Miguel', 'CruzRojaMexicana', 'accidente', 'tránsito']",[],7,0,0,476050170,Cruz Roja CDMX,CruzRoja_CDMX,2012-01-27 12:27:33,0,43836,370,2021-08-08 21:48:58,2021,08,08,21,48,16,Miguel Hidalgo,-99.2045669144,19.4280623649
1424564518068396032,tránsito,coordenadas,@CAPUFE Que tiempo lleva que ocurrió el accidente y que tiempo llevada cerraa al tráfico la autopista.,"['tiempo', 'llevar', 'ocurrir', 'accidente', 'tiempo', 'llevada', 'cerrado', 'tráfico', 'autopistar']",[],['CAPUFE'],1,1,1,192353869,angel vazquez,federikito12307,2010-09-18 16:24:35,0,536,1503,2021-08-08 21:53:42,2021,08,08,21,53,16,Miguel Hidalgo,-99.1843501,19.3998346
1424571320826843136,tránsito,palabras clave,"#CruzRojaMexicana está atendiendo un #accidente de #tránsito en #Paganini, #Vallejo, #Gustavo A. Madero con una #ambulancia donada con tus aportaciones https://t.co/UEza7ruSHP","['atender', 'madero', 'donado', 'aportación']","['CruzRojaMexicana', 'accidente', 'tránsito', 'Paganini', 'Vallejo', 'Gustavo', 'ambulancia']",[],2,0,0,476050170,Cruz Roja CDMX,CruzRoja_CDMX,2012-01-27 12:27:33,0,43836,370,2021-08-08 22:20:44,2021,08,08,22,20,5,Gustavo A. Madero,-99.1158642087,19.5040652077
1424586068804919298,tránsito,palabras clave,"Personal de la #CruzRojaMexicana auxilian a un paciente en #Friedrich Chopin, #Peralvillo, #Cuauhtémoc debido a un #accidente de #tránsito https://t.co/QF61q42DIj","['personal', 'auxiliar', 'paciente', 'chopin', 'debido']","['CruzRojaMexicana', 'Friedrich', 'Peralvillo', 'Cuauhtémoc', 'accidente', 'tránsito']",[],5,0,1,476050170,Cruz Roja CDMX,CruzRoja_CDMX,2012-01-27 12:27:33,0,43836,370,2021-08-08 23:19:20,2021,08,08,23,19,15,Cuauhtémoc,-99.1490557562,19.4313734294
1424604315478593540,tránsito,palabras clave,"Al transitar por #Carretera Federal Mex-toluca, #Las Lajas, #Cuajimalpa de Morelos encontrarás un #accidente de #tránsito atendido por #CruzRojaMexicana, ten cuidado y disminuye tu velocidad  https://t.co/aT14HxElAf","['transitar', 'federal', 'mex-toluca', 'laja', 'morelos', 'encontrarás', 'atendido', 'ten', 'cuidado', 'disminuir', 'velocidad']","['Carretera', 'Las', 'Cuajimalpa', 'accidente', 'tránsito', 'CruzRojaMexicana']",[],8,0,2,476050170,Cruz Roja CDMX,CruzRoja_CDMX,2012-01-27 12:27:33,0,43841,370,2021-08-09 00:31:51,2021,08,09,00,31,4,Cuajimalpa de Morelos,-99.3107285253,19.3246343001
1424606510924062726,tránsito,palabras clave,"Al transitar por #Palmira, #C.T.M. El Risco, #Gustavo A. Madero encontrarás un #accidente de #tránsito atendido por #CruzRojaMexicana, ten cuidado y disminuye tu velocidad  https://t.co/n5gRBUcxbX","['transitar', 'risco', 'madero', 'encontrarás', 'atendido', 'ten', 'cuidado', 'disminuir', 'velocidad']","['Palmira', 'C', 'Gustavo', 'accidente', 'tránsito', 'CruzRojaMexicana']",[],4,0,1,476050170,Cruz Roja CDMX,CruzRoja_CDMX,2012-01-27 12:27:33,0,43836,370,2021-08-09 00:40:34,2021,08,09,00,40,5,Gustavo A. Madero,-99.1158642087,19.5040652077
1424613364198776833,tránsito,palabras clave,"En la dirección #Av Progreso, #Ex-Hacienda de Guadalupe Chimalistac, #Álvaro Obregón un vehículo de la #CruzRojaMexicana atiende un #accidente de #tránsito, evita esas vialidades https://t.co/XQ9ykEWTQ9","['dirección', 'progreso', 'guadalupe', 'chimalistac', 'obregon', 'vehículo', 'atender', 'evitar', 'vialidad']","['Av', 'Ex-Hacienda', 'Álvaro', 'CruzRojaMexicana', 'accidente', 'tránsito']",[],5,0,1,476050170,Cruz Roja CDMX,CruzRoja_CDMX,2012-01-27 12:27:33,0,43836,370,2021-08-09 01:07:48,2021,08,09,01,07,10,Álvaro Obregón,-99.246819712,19.336175562
1424636199851921411,tránsito,palabras clave,"02:37 #PrecauciónVial por obras se confina Av. Minas de Cristo desde Nicanor Arvide hasta Av. Alta Tensión hacia el Sur, alcaldía Álvaro Obregón, permanecen carriles libres a la circulación. https://t.co/R1HNHN4geL","['02', '37', 'obra', 'confinar', 'av', 'mina', 'cristo', 'nicanor', 'dividir', 'av', 'alto', 'tensión', 'hacia', 'sur', 'alcaldía', 'alvaro', 'obregon', 'permanecer', 'carril', 'libre', 'circulación']",['PrecauciónVial'],[],1,0,0,166594238,OVIAL_SSCCDMX,OVIALCDMX,2010-07-14 09:00:43,1,1942071,135,2021-08-09 02:38:33,2021,08,09,02,38,10,Álvaro Obregón,-99.246819712,19.336175562
1424637216429596672,tránsito,palabras clave,"Estamos atendiendo en #CruzRojaMexicana un #accidente de #tránsito en #Rosa Damasco, #Molino de Rosas, #Álvaro Obregón extrema precacuciones al pasar por ese lugar https://t.co/6qya8Zzg9h","['atender', 'damasco', 'rosas', 'obregon', 'extremo', 'precaución', 'pasar', 'lugar']","['CruzRojaMexicana', 'accidente', 'tránsito', 'Rosa', 'Molino', 'Álvaro']",[],1,0,0,476050170,Cruz Roja CDMX,CruzRoja_CDMX,2012-01-27 12:27:33,0,43836,370,2021-08-09 02:42:35,2021,08,09,02,42,10,Álvaro Obregón,-99.246819712,19.336175562
1424647272869027843,tránsito,palabras clave,"03:20 #PrecauciónVial  por obras en Av. Vasco de Quiroga entre Av. Javier Barros Sierra y Prolongación Paseo de la Reforma en ambos sentidos, alcaldía Álvaro Obregón, permanecen carriles libres a la circulación. https://t.co/jeEk0MEEDe","['03', '20', 'obra', 'av', 'vasco', 'quiroga', 'av', 'javier', 'barro', 'sierro', 'prolongación', 'paseo', 'reforma', 'ambos', 'alcaldía', 'alvaro', 'obregon', 'permanecer', 'carril', 'libre', 'circulación']",['PrecauciónVial'],[],1,0,1,166594238,OVIAL_SSCCDMX,OVIALCDMX,2010-07-14 09:00:43,1,1942071,135,2021-08-09 03:22:33,2021,08,09,03,22,10,Álvaro Obregón,-99.246819712,19.336175562
1424648793329393667,tránsito,palabras clave,"Al transitar por #Crisantema, #Agricultura, #Miguel Hidalgo encontrarás un #accidente de #tránsito atendido por #CruzRojaMexicana, ten cuidado y disminuye tu velocidad  https://t.co/q3S7JCCpVH","['transitar', 'hidalgo', 'encontrarás', 'atendido', 'ten', 'cuidado', 'disminuir', 'velocidad']","['Crisantema', 'Agricultura', 'Miguel', 'accidente', 'tránsito', 'CruzRojaMexicana']",[],1,0,0,476050170,Cruz Roja CDMX,CruzRoja_CDMX,2012-01-27 12:27:33,0,43836,370,2021-08-09 03:28:35,2021,08,09,03,28,16,Miguel Hidalgo,-99.2045669144,19.4280623649
1424660568762368003,tránsito,palabras clave,"04:14 #PrecauciónVial afectada la circulación por obras en Diagonal San Antonio desde Eje 1 Poniente hasta Yacatas al Oriente, alcaldía Benito Juárez, permanecen carriles libres. https://t.co/vj5OX9mAMf","['04', '14', 'afectado', 'circulación', 'obra', 'diagonal', 'san', 'antonio', 'eje', 'poniente', 'acta', 'oriente', 'alcaldía', 'benito', 'juarez', 'permanecer', 'carril', 'libre']",['PrecauciónVial'],[],1,0,2,166594238,OVIAL_SSCCDMX,OVIALCDMX,2010-07-14 09:00:43,1,1942071,135,2021-08-09 04:15:23,2021,08,09,04,15,14,Benito Juárez,-99.1611346584,19.3806424162
1424700144193245190,tránsito,palabras clave,"#CruzRojaMexicana está ayudando en un #accidente de #tránsito en Blvd. Fremont, Benito Juárez, Puerto Peñasco, ten cuidado al pasar por el lugar https://t.co/AZWNgeHUbC","['ayudar', 'bld', 'vremont', 'benito', 'juarez', 'puerto', 'peñasco', 'ten', 'cuidado', 'pasar', 'lugar']","['CruzRojaMexicana', 'accidente', 'tránsito']",[],0,0,0,708088889785778177,Cruz Roja Sonora,CruzRojaSonora,2016-03-10 18:35:21,0,1117,152,2021-08-09 06:52:38,2021,08,09,06,52,14,Benito Juárez,-99.1611346584,19.3806424162
1424735839691628547,tránsito,palabras clave,"Personal de la #CruzRojaMexicana auxilian a un paciente en #Poniente 44, #Nueva Santa María, #Azcapotzalco debido a un #accidente de #tránsito https://t.co/YqkrS7jjZs","['personal', 'auxiliar', 'paciente', '44', 'santa', 'maría', 'debido']","['CruzRojaMexicana', 'Poniente', 'Nueva', 'Azcapotzalco', 'accidente', 'tránsito']",[],4,0,0,476050170,Cruz Roja CDMX,CruzRoja_CDMX,2012-01-27 12:27:33,0,43841,370,2021-08-09 09:14:29,2021,08,09,09,14,2,Azcapotzalco,-99.1821069423,19.4853286147
1424750006163197959,tránsito,palabras clave,"#Manifestantes afectan un carril a la circulación de Año de Juárez y Hermenegildo Galeana, colonia San Luis Tlaxialtemalco, Alcaldía Xochimilco.","['afectar', 'carril', 'circulación', 'año', 'juarez', 'hermenegildo', 'galena', 'colonia', 'san', 'luis', 'tlaxialtemalco', 'alcaldía', 'xochimilco']",['Manifestantes'],[],2,0,1,40098528,Radio Tráfico Total,trafico889,2009-05-14 16:06:13,1,899101,70,2021-08-09 10:10:46,2021,08,09,10,10,13,Xochimilco,-99.0903636045,19.2451450458
1424765454980157444,tránsito,palabras clave,"@UCS_GCDMX buenos días, se está haciendo tráfico en la calle de Maíz Col Santiago Tepalcatlalpan, Xochimilco. Entre calles Redención y Av 16 de Septiembre. Hay muchos autos estacionados y hay señalamientos de no estacionarse. https://t.co/Me6pNvyw4d","['buen', 'día', 'hacer', 'tráfico', 'calle', 'maíz', 'col', 'santiago', 'tepalcatlalpan', 'xochimilco', 'calles', 'redención', 'av', '16', 'septiembre', 'auto', 'estacionado', 'señalamiento', 'estacionar él']",[],['UCS_GCDMX'],0,1,0,1175076100206190592,El pato estoico,Mr_Estoico_09,2019-09-20 09:56:01,0,6,43,2021-08-09 11:12:09,2021,08,09,11,12,13,Xochimilco,-99.0903636045,19.2451450458
1424784012057485319,tránsito,palabras clave,Favor de enviar personal de transito a esquina de cocoteros y clavelinas vehiculos estacionados en parada oficial de camion de basura y proceder a checar zona de clavelinas col nueva Sta maria Azcapotzalco @UCS_GCDMX @OVIALCDMX @SSC_CDMX @OHarfuch https://t.co/Vq1ZcyAPtF,"['favor', 'enviar', 'personal', 'transito', 'esquina', 'cocotero', 'chavelín', 'vehiculo', 'estacionado', 'parado', 'oficial', 'camion', 'basura', 'proceder', 'checar', 'zona', 'chavelín', 'col', 'nuevo', 'sta', 'mario', 'azcapotzalco']",[],"['UCS_GCDMX', 'OVIALCDMX', 'SSC_CDMX', 'OHarfuch']",1,2,0,1604815676,Ing.ManuelJarilloY,JYM_133,2013-07-18 19:54:04,0,217,789,2021-08-09 12:25:54,2021,08,09,12,25,2,Azcapotzalco,-99.1821069423,19.4853286147
1424786510264537091,tránsito,palabras clave,"#CruzRojaMexicana está ayudando en un #accidente de #tránsito en Miguel Hidalgo y Costilla, Centenario, Hermosillo, ten cuidado al pasar por el lugar https://t.co/ZUIYOueKUR","['ayudar', 'miguel', 'hidalgo', 'costilla', 'centenario', 'hermosillo', 'ten', 'cuidado', 'pasar', 'lugar']","['CruzRojaMexicana', 'accidente', 'tránsito']",[],0,0,0,708088889785778177,Cruz Roja Sonora,CruzRojaSonora,2016-03-10 18:35:21,0,1117,152,2021-08-09 12:35:49,2021,08,09,12,35,16,Miguel Hidalgo,-99.2045669144,19.4280623649
1424794271756996610,tránsito,palabras clave,"@Ma_JosueFS94 El problema de las redes cualquiera sin conocimiento opina.
Claro que debe intervenir.
Entonces para que te plagueas si cierran rutas? El gob debe intervenir pues es tiene la responsabilidad de que la circulación sea libre.
Pero bueno hay que explicar todo con 🍎","['problema', 'red', 'cualquiera', 'conocimiento', 'opinar', 'claro', 'deber', 'intervenir', 'entonces', 'laguna', 'si', 'cerrar', 'ruta', 'gob', 'deber', 'intervenir', 'pues', 'responsabilidad', 'circulación', 'libre', 'bueno', 'explicar']",[],['Ma_JosueFS94'],0,1,0,168353710,hernàn  benìtez r.,hernandbr,2010-07-18 21:18:22,0,789,2163,2021-08-09 13:06:40,2021,08,09,13,06,9,Milpa Alta,-99.0510954218,19.1394565999
1424795025804759042,tránsito,palabras clave,"Una #ambulancia de la #CruzRojaMexicana labora atendiendo a un paciente herido por un #accidente de #tránsito en #Cuitlahuac, #Cosmopolita, #Azcapotzalco https://t.co/AmrYiv8mjT","['laborar', 'atender', 'paciente', 'herido']","['ambulancia', 'CruzRojaMexicana', 'accidente', 'tránsito', 'Cuitlahuac', 'Cosmopolita', 'Azcapotzalco']",[],1,0,0,476050170,Cruz Roja CDMX,CruzRoja_CDMX,2012-01-27 12:27:33,0,43841,370,2021-08-09 13:09:40,2021,08,09,13,09,2,Azcapotzalco,-99.1821069423,19.4853286147
1424809695915782144,tránsito,palabras clave,"@Ma_JosueFS94 Los alimentos como llegan a los centros de distribución? Por avión y trenes seguro.
Si asegurar que lleguen los alimentos como libre circulación no es de interés nacional, estamos más que locos.
Conozco más de vos del tema.
Hasta te puede decir que hay camiones que no paran.","['alimento', 'llegar', 'centro', 'distribución', 'avión', 'tren', 'seguro', 'si', 'asegurar', 'llegar', 'alimento', 'libre', 'circulación', 'interés', 'nacional', 'loco', 'conocer', 'vo', 'tema', 'poder', 'decir', 'camión', 'parar']",[],['Ma_JosueFS94'],0,2,0,168353710,hernàn  benìtez r.,hernandbr,2010-07-18 21:18:22,0,789,2163,2021-08-09 14:07:57,2021,08,09,14,07,9,Milpa Alta,-99.0510954218,19.1394565999
1424828709928849410,tránsito,palabras clave,"#CruzRojaMexicana está ayudando en un #accidente de #tránsito en #Homero, #Polanco I Sección, #Miguel Hidalgo ten cuidado al pasar por el lugar https://t.co/U9kmcekWuB","['ayudar', 'sección', 'hidalgo', 'ten', 'cuidado', 'pasar', 'lugar']","['CruzRojaMexicana', 'accidente', 'tránsito', 'Homero', 'Polanco', 'Miguel']",[],2,0,0,476050170,Cruz Roja CDMX,CruzRoja_CDMX,2012-01-27 12:27:33,0,43836,370,2021-08-09 15:23:31,2021,08,09,15,23,16,Miguel Hidalgo,-99.2045669144,19.4280623649
1424835797799165955,tránsito,palabras clave,"@UCS_GCDMX Denuncio vehículos automotores estacionados en doble fila en la calle Del Catorce, colonia Nicolás Bravo, alcaldía Venustiano Carranza, entre Privada Del Catorce y Canal del Norte. Todos los días violan el Reglamento de Tránsito en esa calle, ¿Por qué lo permiten?","['denuncio', 'vehículo', 'automotor', 'estacionado', 'doble', 'fila', 'calle', 'catorce', 'colonia', 'nicolar', 'bravo', 'alcaldía', 'venustiano', 'carranza', 'privado', 'catorce', 'canal', 'norte', 'día', 'violar', 'reglamento', 'tránsito', 'calle', 'permitir']",[],['UCS_GCDMX'],0,1,0,2845634673,israel vargas,vargasgalvan201,2014-10-26 13:41:22,0,201,277,2021-08-09 15:51:41,2021,08,09,15,51,17,Venustiano Carranza,-99.0931057959,19.4304954545
1424849473595904004,tránsito,palabras clave,"Alto a la Mordida
Agentes de Transito en #Cuauhtemoc paran labores por tiempo indefinido
#Chihuahua
https://t.co/DgDdD5TCn9","['alto', 'mordidaagent', 'transito', 'parar', 'labor', 'tiempo', 'indefinido']","['Cuauhtemoc', 'Chihuahua']",[],2,0,0,35073475,La Polaka,LaPolaka,2009-04-24 17:15:14,0,21468,1325,2021-08-09 16:46:01,2021,08,09,16,46,15,Cuauhtémoc,-99.1490557562,19.4313734294
1424851231311335426,tránsito,palabras clave,"Una #ambulancia de la #CruzRojaMexicana labora atendiendo a un paciente herido por un #accidente de #tránsito en #Parque Lira, #Tacubaya, #Miguel Hidalgo https://t.co/OxYdi2Ae66","['laborar', 'atender', 'paciente', 'herido', 'lira', 'hidalgo']","['ambulancia', 'CruzRojaMexicana', 'accidente', 'tránsito', 'Parque', 'Tacubaya', 'Miguel']",[],2,0,1,476050170,Cruz Roja CDMX,CruzRoja_CDMX,2012-01-27 12:27:33,0,43836,370,2021-08-09 16:53:00,2021,08,09,16,53,16,Miguel Hidalgo,-99.2045669144,19.4280623649
1424853028738412549,tránsito,palabras clave,"@Ma_JosueFS94 Jaja hablando de básicos, cotiza en Chicago pero retacea los guaraníes a sus colaboradores fleteros, porque los precios ""no cierran"", amo de lo que calla y ......, mejor deje de dar datos, porque se vuelve obvio y monótono a la vez. Lo del libre tránsito de acuerdo y para todos.","['jaja', 'hablar', 'básico', 'cotizar', 'chicago', 'setaceo', 'guaraní', 'colaborador', 'letrero', 'precio', 'cerrar', 'amo', 'callar', 'mejor', 'dejar', 'dar', 'dato', 'volver', 'obvio', 'monótono', 'vez', 'libre', 'tránsito', 'acuerdo']",[],['Ma_JosueFS94'],0,1,0,1271969735962476544,Felipe Lopez,lopezfelipe22,2020-06-13 18:57:06,0,383,714,2021-08-09 17:00:09,2021,08,09,17,00,9,Milpa Alta,-99.0510954218,19.1394565999
1424853659511402498,tránsito,palabras clave,"Un #accidente de #tránsito en #Cuitlahuac, #Nueva Santa María, #Azcapotzalco fue reportado a la #CruzRojaMexicana, te recomendamos tener cuidado al transitar en esa zona https://t.co/6qQ9EWUpKc","['santa', 'maría', 'reportado', 'recomendar', 'tener', 'cuidado', 'transitar', 'zona']","['accidente', 'tránsito', 'Cuitlahuac', 'Nueva', 'Azcapotzalco', 'CruzRojaMexicana']",[],0,0,0,476050170,Cruz Roja CDMX,CruzRoja_CDMX,2012-01-27 12:27:33,0,43841,370,2021-08-09 17:02:39,2021,08,09,17,02,2,Azcapotzalco,-99.1821069423,19.4853286147
1424854820171681798,tránsito,palabras clave,"@vinadenuncia @McDonalds @vinadelmar Es verdad se está ocasiónando un caos vial ,  desde hace un tiempo ya , hace falta una ubicación donde no se produzcan accidentes de tránsito y que no entorpezcan las vías  sobre todo en SAN MARTÍN , (alto flujo) sería bueno otro Mc DONALDS  en otro sector","['verdad', 'ocasionar', 'cao', 'vial', 'hacer', 'tiempo', 'hacer', 'falta', 'ubicación', 'producir', 'accidente', 'tránsito', 'entorpecer', 'vías', 'san', 'martín', 'alto', 'flujo', 'bueno', 'mc', 'donald', 'sector']",[],"['vinadenuncia', 'McDonalds', 'vinadelmar']",0,0,1,1099418938964873217,Mustang70,FFORD57,2019-02-23 15:21:16,0,20,34,2021-08-09 17:07:16,2021,08,09,17,07,8,La Magdalena Contreras,-99.2684129061,19.2689765031
1424862659414003712,tránsito,palabras clave,"#CruzRojaMexicana está atendiendo un #accidente de #tránsito en #Circuito Interior, #Santa María la Ribera, #Cuauhtémoc con una #ambulancia donada con tus aportaciones https://t.co/gxbL3PeQaV","['atender', 'interior', 'macer', 'ribera', 'donado', 'aportación']","['CruzRojaMexicana', 'accidente', 'tránsito', 'Circuito', 'Santa', 'Cuauhtémoc', 'ambulancia']",[],1,0,0,476050170,Cruz Roja CDMX,CruzRoja_CDMX,2012-01-27 12:27:33,0,43836,370,2021-08-09 17:38:25,2021,08,09,17,38,15,Cuauhtémoc,-99.1490557562,19.4313734294
1424882274701647872,tránsito,palabras clave,"@estefania_gru @LoroHomero @amcquito Acá frente al CC El Recreo: Calvas y Maldonado, Sarayacu, Rafael Arteta cero control, ningún agente que despeje el espacio público. Al contrario se ve más vendedores, más tráfico, carpas, contaminación auditiva. Así que por acá eso es pura mentira y engaño https://t.co/KwZ4pCUdNY","['acá', 'frente', 'cc', 'recreo', 'calva', 'maldonado', 'sarayacu', 'rafael', 'artesa', 'cero', 'control', 'ninguno', 'agente', 'despeje', 'espacio', 'público', 'contrario', 'ver', 'vendedor', 'tráfico', 'carpas', 'contaminación', 'auditivo', 'así', 'acá', 'puro', 'mentira', 'engaño']",[],"['estefania_gru', 'LoroHomero', 'amcquito']",2,0,0,817842463280861184,Rubén Morales,Rubben_MC,2017-01-07 15:16:52,0,144,258,2021-08-09 18:56:21,2021,08,09,18,56,8,La Magdalena Contreras,-99.2684129061,19.2689765031
1424887962333032449,tránsito,palabras clave,"Un #accidente de #tránsito en #17a de Mayo, #San Bartolo Atepehuacan, #Gustavo A. Madero fue reportado a la #CruzRojaMexicana, te recomendamos tener cuidado al transitar en esa zona https://t.co/AGjaH4TifQ","['mayo', 'barroco', 'atepehuacar', 'madero', 'reportado', 'recomendar', 'tener', 'cuidado', 'transitar', 'zona']","['accidente', 'tránsito', '17a', 'San', 'Gustavo', 'CruzRojaMexicana']",[],0,0,1,476050170,Cruz Roja CDMX,CruzRoja_CDMX,2012-01-27 12:27:33,0,43836,370,2021-08-09 19:18:58,2021,08,09,19,18,5,Gustavo A. Madero,-99.1158642087,19.5040652077
1424905627890028550,tránsito,palabras clave,"@Claudiashein @MICablebusCDMX Y que hicieron con todos los camiones que cubrían esa ruta ?

Siguen generando tráfico ?

Siguen haciendo ruta , sin gente ? 

O sólo hacen chatarra y contaminación en la GAM ?","['hacer', 'camión', 'cubrir', 'ruta', 'seguir', 'generar', 'tráfico', 'seguir', 'hacer', 'ruta', 'gente', 'sólo', 'hacer', 'chatarra', 'contaminación', 'gam']",[],"['Claudiashein', 'MICablebusCDMX']",1,0,1,1037381996014489600,ｊｔ.ｇｌｅｚ®,jt_glezSoyYo,2018-09-05 10:48:36,0,23,375,2021-08-09 20:29:09,2021,08,09,20,29,5,Gustavo A. Madero,-99.1158642087,19.5040652077
1424910134493466624,tránsito,palabras clave,@andreslajous @MICablebusCDMX ¿Y ya atendiste el problema de la línea asesina de camiones que va de Taxqueña a Sn. Ángel (MA de Quevedo) y que viola todas las leyes de tránsito? ¿Qué se hará al respecto? Te tomó 8 años necear por una ciclovía. Yo haré lo mismo a este respecto.,"['entendistir', 'problema', 'líneo', 'asesinar', 'camión', 'ir', 'oaxaqueño', 'sn', 'ángel', 'ma', 'quevedo', 'violar', 'todo', 'ley', 'tránsito', 'hacer', 'respecto', 'tomar', 'año', 'nectar', 'ciclovía', 'hacer', 'mismo', 'respecto']",[],"['andreslajous', 'MICablebusCDMX']",1,0,0,919266248,Fernando Domínguez,fdlegorreta,2012-11-01 09:39:14,0,409,887,2021-08-09 20:47:04,2021,08,09,20,47,9,Milpa Alta,-99.0510954218,19.1394565999
1424910314823430146,tránsito,palabras clave,@andreslajous @MetrobusCDMX ¿Y ya atendiste el problema de la línea asesina de camiones que va de Taxqueña a Sn. Ángel (MA de Quevedo) y que viola todas las leyes de tránsito? ¿Qué se hará al respecto? Te tomó 8 años necear por una ciclovía. Yo haré lo mismo a este respecto.,"['entendistir', 'problema', 'líneo', 'asesinar', 'camión', 'ir', 'oaxaqueño', 'sn', 'ángel', 'ma', 'quevedo', 'violar', 'todo', 'ley', 'tránsito', 'hacer', 'respecto', 'tomar', 'año', 'nectar', 'ciclovía', 'hacer', 'mismo', 'respecto']",[],"['andreslajous', 'MetrobusCDMX']",0,0,0,919266248,Fernando Domínguez,fdlegorreta,2012-11-01 09:39:14,0,409,887,2021-08-09 20:47:47,2021,08,09,20,47,9,Milpa Alta,-99.0510954218,19.1394565999
