pubID,topicQuery,typeQuery,tweet,tokens,hashtags,mentions,likeCount,replyCount,retweetCount,authorID,authorName,authorUsername,authorCreatedAt,authorVerified,followersCount,followingCount,pubDate,pubYear,pubMonth,pubDay,pubHour,pubMinute,geoID,geoName,longitude,latitude
1215358275224469508,tránsito,coordenadas,@SSP_CDMX por favor revisen la vialidad en donde está el hospital del imss Gabriel mancera sobre san Borja por que como estacionan los coches en segunda fila se hace mucho tráfico por ese motivo.,"['favor', 'revisar', 'vialidad', 'hospital', 'miss', 'gabriel', 'mancera', 'san', 'borja', 'estacional', 'coche', 'segundo', 'fila', 'hacer', 'tráfico', 'motivo']",[],['SSP_CDMX'],0,0,0,1549532540,mafer,mafer_maferjc,2013-06-26 19:50:51,0,1,22,2020-01-09 13:42:47,2020,01,09,13,42,10,Álvaro Obregón,-99.1919955,19.357102
1215363026595074050,incendio,palabras clave,"#EvitaLaZona Servicios de emergencia laboran por 🔥 incendio sobre la Carretera México - Xochimilco, colonia Chapultepec, @XochimilcoAl #911CDMX. #C5","['servicio', 'emergencia', 'laborar', 'incendio', 'carretera', 'méxico', 'xochimilco', 'colonia', 'chapultepec']","['EvitaLaZona', '911CDMX', 'C5']",['XochimilcoAl'],4,0,2,195951901,C5 CDMX,C5_CDMX,2010-09-27 17:51:04,1,947198,760,2020-01-09 14:01:40,2020,01,09,14,01,13,Xochimilco,-99.0903636045,19.2451450458
1215365019162087432,incendio,palabras clave,@MinAmbienteCo Se está presentando un incendio forestal en la vía Curomaní- Bosconia en el Departamento del Cesar.,"['presentar', 'incendio', 'forestal', 'vía', 'romaní', 'bosnia', 'departamento', 'cesar']",[],['MinAmbienteCo'],0,0,0,981251532,María Camila Vega.,mariacamila_vc,2012-11-30 15:21:57,0,261,343,2020-01-09 14:09:35,2020,01,09,14,09,17,Venustiano Carranza,-99.0931057959,19.4304954545
1215365918508888066,tránsito,coordenadas,@UCS_GCDMX @SSP_CDMX @Claudiashein @OVIALCDMX Solicito apoyo de patrulla por un percance automovilistico. Cecilio Robelo entre sur 111 y lazaro pavia Col. El parque V.Carranza @A_VCarranza Patrulla de transito MX-004-T6 se le solicita apoyo y se retira del lugar https://t.co/PnCyMJ6i7F,"['solicito', 'apoyo', 'patrulla', 'percance', 'automovilístico', 'cecilio', 'modelo', 'sur', '111', 'lazaro', 'pavia', 'col', 'parque', 'carranza', 'patrulla', 'transito', 'mx-004-t6', 'solicitar', 'apoyo', 'retirar', 'lugar']",[],"['UCS_GCDMX', 'SSP_CDMX', 'Claudiashein', 'OVIALCDMX', 'A_VCarranza']",3,2,2,968918040241991680,Omar,Omar99930381,2018-02-28 12:37:17,0,3,164,2020-01-09 14:13:10,2020,01,09,14,13,15,Cuauhtémoc,-99.128294,19.4043522
1215375289813028864,incendio,palabras clave,"#MuchoOjO Servicios de emergencia se aproximan a incendio en la Carretera México Xochimilco, colonia Chapultepec, Xochimilco https://t.co/rjCNYqcG5J","['servicio', 'emergencia', 'aproximar', 'incendio', 'carretera', 'méxico', 'xochimilco', 'colonia', 'chapultepec', 'xochimilco']",['MuchoOjO'],[],6,0,3,1033941244257476610,OMAC CDMX,omacmx,2018-08-26 22:56:17,0,2895,1114,2020-01-09 14:50:24,2020,01,09,14,50,13,Xochimilco,-99.0903636045,19.2451450458
1215382321462902784,tránsito,palabras clave,"Al transitar por Lafayette, Anzures, Miguel Hidalgo encontrarás un #accidente de #tránsito atendido por #CruzRojaMexicana, ten cuidado y disminuye tu velocidad  https://t.co/f5zkr2dgkX","['transitar', 'lafayette', 'azules', 'miguel', 'hidalgo', 'encontrarás', 'atendido', 'ten', 'cuidado', 'disminuir', 'velocidad']","['accidente', 'tránsito', 'CruzRojaMexicana']",[],0,0,1,476050170,Cruz Roja CDMX,CruzRoja_CDMX,2012-01-27 12:27:33,0,43836,370,2020-01-09 15:18:20,2020,01,09,15,18,16,Miguel Hidalgo,-99.2045669144,19.4280623649
1215387425855430656,tránsito,palabras clave,@savillab @RTP_CiudadDeMex @ClaraBrugadaM @UCS_GCDMX @Alc_Iztapalapa @JerrxG13 @lomasestrella09 @SSP_CDMX Si la alcaldesa no solicita unidades de tránsito la @SSP_CDMX no se los proporciona la señora @ClaraBrugadaM esta obligada a solicitar a la ssp el personal de #TransitoGCDMX  #porquenoeresunapersonanormal https://t.co/Vyn40n4TFe,"['si', 'alcaldesa', 'solicitar', 'unidad', 'tránsito', 'proporcionar', 'señora', 'obligado', 'solicitar', 'ssp', 'personal']","['TransitoGCDMX', 'porquenoeresunapersonanormal']","['savillab', 'RTP_CiudadDeMex', 'ClaraBrugadaM', 'UCS_GCDMX', 'Alc_Iztapalapa', 'JerrxG13', 'lomasestrella09', 'SSP_CDMX', 'SSP_CDMX', 'ClaraBrugadaM']",0,0,0,96285939,፠ᴇᵏ ʙᵃˡᵃᵐ፠,EkBalam79,2009-12-11 23:51:11,0,173,290,2020-01-09 15:38:37,2020,01,09,15,38,7,Iztapalapa,-99.0567989642,19.3491663204
1215395809232965632,tránsito,palabras clave,"*CHOQUE*

*CALZADA DE TLALPAN, CALLE CÁDIZ, COLONIA PUEBLO SAN PABLO TEPETLAPA ALCALDÍA COYOACÁN*

A las 06:30 se registra aparatoso accidente de patrulla de tránsito de la SSC, ya que la misma que se impacta en la… https://t.co/tdti0eIKea","['choque', 'calzado', 'tlalpan', 'calle', 'cáliz', 'colonia', 'pueblo', 'san', 'pablo', 'tepetlapa', 'alcaldía', 'coyoacán', '06', '30', 'registrar', 'aparatoso', 'accidente', 'patrulla', 'tránsito', 'ssc', 'mismo', 'impactar']",[],[],0,0,0,1155980679546593280,COMUNIDAD ACTIVA DE REPORTE A LA CIUDADANÍA,ActivaReporte,2019-07-29 17:17:25,0,2193,782,2020-01-09 16:11:56,2020,01,09,16,11,3,Coyoacán,-99.1503763525,19.3266672536
1215396360373133314,tránsito,palabras clave,"#CruzRojaMexicana está ayudando en un #accidente de #tránsito en Matias Romero, Santa María Malinalco, Azcapotzalco ten cuidado al pasar por el lugar https://t.co/SWEVjn9Bk0","['ayudar', 'matias', 'romero', 'santa', 'maría', 'malinalco', 'azcapotzalco', 'ten', 'cuidado', 'pasar', 'lugar']","['CruzRojaMexicana', 'accidente', 'tránsito']",[],1,0,0,476050170,Cruz Roja CDMX,CruzRoja_CDMX,2012-01-27 12:27:33,0,43836,370,2020-01-09 16:14:07,2020,01,09,16,14,2,Azcapotzalco,-99.1821069423,19.4853286147
1215396605475610624,tránsito,palabras clave,"Personal de la #CruzRojaMexicana auxilian a un paciente en Matias Romero, Santa María Malinalco, Azcapotzalco debido a un #accidente de #tránsito https://t.co/SWEVjn9Bk0","['personal', 'auxiliar', 'paciente', 'matias', 'romero', 'santa', 'maría', 'malinalco', 'azcapotzalco', 'debido']","['CruzRojaMexicana', 'accidente', 'tránsito']",[],1,0,0,476050170,Cruz Roja CDMX,CruzRoja_CDMX,2012-01-27 12:27:33,0,43836,370,2020-01-09 16:15:06,2020,01,09,16,15,2,Azcapotzalco,-99.1821069423,19.4853286147
1215414558552137736,tránsito,palabras clave,"Un #accidente de #tránsito en Benito Juarez, Ley 57, Hermosillo fue reportado a #CruzRojaMexicana, te recomendamos tener cuidado al transitar en esa zona https://t.co/8nh7JUU46k","['benito', 'juarez', 'ley', '57', 'hermosillo', 'reportado', 'recomendar', 'tener', 'cuidado', 'transitar', 'zona']","['accidente', 'tránsito', 'CruzRojaMexicana']",[],0,0,0,708088889785778177,Cruz Roja Sonora,CruzRojaSonora,2016-03-10 18:35:21,0,1117,152,2020-01-09 17:26:26,2020,01,09,17,26,14,Benito Juárez,-99.1611346584,19.3806424162
1215414987361005568,tránsito,coordenadas,@JerrxG13 @Pajaropolitico @Claudiashein hasta cuando ya limitarán la violencia y afectación a la libertad de tránsito?? @UNAM_MX cuando solicitarás apoyo para poner orden y evitar daños a las instalaciones??,"['limitar', 'violencia', 'afectación', 'libertad', 'tránsito', 'solicitar', 'apoyo', 'poner', 'orden', 'evitar', 'daño', 'instalación']",[],"['JerrxG13', 'Pajaropolitico', 'Claudiashein', 'UNAM_MX']",1,0,1,333068026,Javier Ceja,ViejoCeja,2011-07-10 16:49:57,0,1365,4626,2020-01-09 17:28:08,2020,01,09,17,28,16,Miguel Hidalgo,-99.180678,19.444937
1215415425133092877,tránsito,coordenadas,@SSP_CDMX buenas tardes donde puedo aclarar una duda respecto al reglamento de transito.,"['buena', 'tarde', 'poder', 'aclarar', 'duda', 'respecto', 'reglamento', 'transito']",[],['SSP_CDMX'],0,0,0,125770680,J.Cesar Cano,jcesar_cano,2010-03-23 14:35:35,0,76,682,2020-01-09 17:29:53,2020,01,09,17,29,12,Tlalpan,-99.140238,19.2846922
1215417685250584579,tránsito,palabras clave,"Estamos atendiendo en #CruzRojaMexicana un #accidente de #tránsito en Periferico, Reforma Social, Miguel Hidalgo extrema precacuciones al pasar por ese lugar https://t.co/zRKKg5l6gj","['atender', 'periférico', 'reforma', 'social', 'miguel', 'hidalgo', 'extremo', 'precaución', 'pasar', 'lugar']","['CruzRojaMexicana', 'accidente', 'tránsito']",[],1,0,0,476050170,Cruz Roja CDMX,CruzRoja_CDMX,2012-01-27 12:27:33,0,43836,370,2020-01-09 17:38:52,2020,01,09,17,38,16,Miguel Hidalgo,-99.2045669144,19.4280623649
1215420829619503104,tránsito,coordenadas,17:42 #PrecaucionVial manifestantes cierran la circulación de Bucareli a la altura de Ayuntamiento. Utilice como #AlternativaVial  Balderas y Paseo de la Reforma. https://t.co/evmiM4LLgT,"['17', '42', 'manifestante', 'cerrar', 'circulación', 'bucareli', 'altura', 'ayuntamiento', 'utilizar', 'bandera', 'paseo', 'reforma']","['PrecaucionVial', 'AlternativaVial']",[],1,1,0,166594238,OVIAL_SSCCDMX,OVIALCDMX,2010-07-14 09:00:43,1,1942068,135,2020-01-09 17:51:21,2020,01,09,17,51,16,Miguel Hidalgo,-99.1843501,19.3998346
1215422553830936582,tránsito,palabras clave,"#CruzRojaMexicana está ayudando en un #accidente de #tránsito en Periferico, San Lorenzo Huipulco, Tlalpan ten cuidado al pasar por el lugar https://t.co/P2eLOHxkIf","['ayudar', 'periférico', 'san', 'lorenzo', 'huipulco', 'tlalpan', 'ten', 'cuidado', 'pasar', 'lugar']","['CruzRojaMexicana', 'accidente', 'tránsito']",[],3,0,1,476050170,Cruz Roja CDMX,CruzRoja_CDMX,2012-01-27 12:27:33,0,43836,370,2020-01-09 17:58:12,2020,01,09,17,58,12,Tlalpan,-99.2062207957,19.1983396763
1215435252241510400,tránsito,palabras clave,"❌🚗#MovilidadCDMX Tránsito lento sobre Calz. de Tlalpan en ambos sentidos, desde Viaducto Miguel Alemán hasta Av. Taxqueña. #C5 https://t.co/HGLXhLZHCz","['tránsito', 'lento', 'call', 'tlalpan', 'ambos', 'viaducto', 'miguel', 'alemán', 'av', 'oaxaqueño']","['MovilidadCDMX', 'C5']",[],3,0,2,195951901,C5 CDMX,C5_CDMX,2010-09-27 17:51:04,1,947201,760,2020-01-09 18:48:40,2020,01,09,18,48,12,Tlalpan,-99.2062207957,19.1983396763
1215438299264880640,tránsito,palabras clave,"conductores tan vale ma$&amp;%, no ven q pasaron al paradero q está en el carril central a la señora q vendía tamales a un costado d Soriana Kabah, pues siguen estacionandose en el carril lateral, bloquean la circulación, la intención es q se estacionen en ese paradero @TransitoBJ","['conductor', 'tanto', 'valer', 'ma', 'amp', 'ver', 'pasar', 'paradero', 'carril', 'central', 'señora', 'vender', 'tamal', 'costado', 'soriano', 'sabah', 'pues', 'seguir', 'estacionado', 'carril', 'lateral', 'bloquear', 'circulación', 'intención', 'estación', 'paradero']",[],['TransitoBJ'],2,0,2,1041865677659942917,Vick-ingo 😜✌️,vick_cancun2018,2018-09-17 19:45:09,0,114,477,2020-01-09 19:00:46,2020,01,09,19,00,9,Milpa Alta,-99.0510954218,19.1394565999
1215438651817185281,incendio,palabras clave,"🚨#Precaución 🚒👨‍🚒@Bomberos_CDMX laboran en 🔥#Incendio de basura sobre Mafafa y Áloe, colonia Parque Nacional Cerro de la Estrella. @Alc_Iztapalapa. Ante cualquier emergencia llama de inmediato al 📞 #911CDMX #C5 https://t.co/w0BLeiMDXo","['laborar', 'basura', 'fafafa', 'aloe', 'colonia', 'parque', 'nacional', 'cerro', 'estrella', 'cualquiera', 'emergencia', 'llamar', 'inmediato']","['Precaución', 'Incendio', '911CDMX', 'C5']","['Bomberos_CDMX', 'Alc_Iztapalapa']",5,0,3,195951901,C5 CDMX,C5_CDMX,2010-09-27 17:51:04,1,947204,760,2020-01-09 19:02:11,2020,01,09,19,02,7,Iztapalapa,-99.0567989642,19.3491663204
1215445913319034880,tránsito,coordenadas,Tremendo caos vial y los agentes de tránsito ni sus luces @Claudiashein @SSP_CDMX @OVIALCDMX @GobCDMX #CDMX #concienciavial pero no fuera estafar a operadores de trailers por que llegan por manada 🤦🏻 https://t.co/uiIlirRovc https://t.co/Ze73lCgnI0,"['tremendo', 'cao', 'vial', 'agente', 'tránsito', 'luz', 'estafar', 'operador', 'trailer', 'llegar', 'manada']","['CDMX', 'concienciavial']","['Claudiashein', 'SSP_CDMX', 'OVIALCDMX', 'GobCDMX']",0,1,0,384614717,Fherguz,frbtan,2011-10-03 18:49:47,0,142,931,2020-01-09 19:31:02,2020,01,09,19,31,16,Miguel Hidalgo,-99.1843501,19.3998346
1215464518240751617,incendio,coordenadas,"20:43 #PrecauciónVial servicios de emergencia acuden a la Av. Chapultepec y Morelia, col. Roma Norte, alcaldía Cuauhtémoc, por reporte de incendio, permita el paso de los mismos.","['20', '43', 'servicio', 'emergencia', 'acudir', 'av', 'chapultepec', 'morelia', 'col', 'romo', 'norte', 'alcaldía', 'cuauhtemoc', 'reporte', 'incendio', 'permitir', 'paso', 'mismo']",['PrecauciónVial'],[],9,0,3,166594238,OVIAL_SSCCDMX,OVIALCDMX,2010-07-14 09:00:43,1,1942069,135,2020-01-09 20:44:58,2020,01,09,20,44,16,Miguel Hidalgo,-99.1843501,19.3998346
1215468795042512896,tránsito,palabras clave,"⁦@greenpeacemx⁩ ⁦No entiendo el doble mensaje de Greenpeace, el MT no es la mejor opción, tráfico, contaminación, ruido. La mejor opción es SÍ al Trolebús !!! Si al Trolebús en la Alcadia Benito Juárez https://t.co/ltXuVET1cN","['entender', 'doble', 'mensaje', 'greenpeace', 'mt', 'mejor', 'opción', 'tráfico', 'contaminación', 'ruido', 'mejor', 'opción', 'trolebús', 'si', 'trolebús', 'alcaldia', 'benito', 'juarez']",[],['greenpeacemx'],0,0,0,881578181785866240,Lore Vaz Mir,Lorevazmir,2017-07-02 12:19:52,0,52,159,2020-01-09 21:01:57,2020,01,09,21,01,14,Benito Juárez,-99.1611346584,19.3806424162
1215469241962582016,tránsito,palabras clave,"Estamos atendiendo en #CruzRojaMexicana un #accidente de #tránsito en Calle 11, Olivar del Conde 1a Sección, Álvaro Obregón extrema precacuciones al pasar por ese lugar https://t.co/cr6cIdMMCv","['atender', 'calle', '11', 'olivar', 'conde', '1o', 'sección', 'alvaro', 'obregon', 'extremo', 'precaución', 'pasar', 'lugar']","['CruzRojaMexicana', 'accidente', 'tránsito']",[],2,0,2,476050170,Cruz Roja CDMX,CruzRoja_CDMX,2012-01-27 12:27:33,0,43836,370,2020-01-09 21:03:44,2020,01,09,21,03,10,Álvaro Obregón,-99.246819712,19.336175562
1215476065294000128,tránsito,palabras clave,"Al transitar por Progreso, Tepeaca, Álvaro Obregón encontrarás un #accidente de #tránsito atendido por #CruzRojaMexicana, ten cuidado y disminuye tu velocidad  https://t.co/numQXlEdUR","['transitar', 'progreso', 'repesca', 'alvaro', 'obregon', 'encontrarás', 'atendido', 'ten', 'cuidado', 'disminuir', 'velocidad']","['accidente', 'tránsito', 'CruzRojaMexicana']",[],4,0,0,476050170,Cruz Roja CDMX,CruzRoja_CDMX,2012-01-27 12:27:33,0,43836,370,2020-01-09 21:30:51,2020,01,09,21,30,10,Álvaro Obregón,-99.246819712,19.336175562
1215495224748802048,incendio,palabras clave,"#AlMomento | Bomberos municipales sofocaron un incendio en la primaria Benito Juárez, ubicada en la calle Norman Fuentes, en la Zona Centro de la capital. https://t.co/dU3nlkyhSX","['bombero', 'municipal', 'colocar', 'incendio', 'primaria', 'benito', 'juarez', 'ubicada', 'calle', 'normar', 'fuente', 'zona', 'centro', 'capital']",['AlMomento'],[],2,0,1,164777194,El Siglo de Durango,SigloDurango,2010-07-09 12:43:42,1,37206,894,2020-01-09 22:46:59,2020,01,09,22,46,14,Benito Juárez,-99.1611346584,19.3806424162
1215508534697385989,tránsito,palabras clave,"En la dirección Paseo de los Lirios, El Mirador 1A Sección, Tlalpan un vehículo de la #CruzRojaMexicana atiende un #accidente de #tránsito, evita esas vialidades https://t.co/BWhYljH6OO","['dirección', 'paseo', 'lirio', 'mirador', '1a', 'sección', 'tlalpan', 'vehículo', 'atender', 'evitar', 'vialidad']","['CruzRojaMexicana', 'accidente', 'tránsito']",[],0,0,0,476050170,Cruz Roja CDMX,CruzRoja_CDMX,2012-01-27 12:27:33,0,43836,370,2020-01-09 23:39:52,2020,01,09,23,39,12,Tlalpan,-99.2062207957,19.1983396763
1215512254365433856,incendio,palabras clave,"Incendio en Negocio Av. las Torres y 12 de Octubre, colonia Ixtlahuacan, @Alc_Iztapalapa. #C5  #911CDMX
Servicios de emergencia en el lugar. 
⚠️","['incendio', 'negocio', 'av', 'torre', '12', 'octubre', 'colonia', 'ixtlahuacar', 'servicio', 'emergencio', 'lugar']","['C5', '911CDMX']",['Alc_Iztapalapa'],20,1,6,195951901,C5 CDMX,C5_CDMX,2010-09-27 17:51:04,1,947204,760,2020-01-09 23:54:39,2020,01,09,23,54,7,Iztapalapa,-99.0567989642,19.3491663204
1215513781276557312,incendio,coordenadas,"00:00 #PrecauciónVial, servicios de emergencia laboran en Av. #LasTorres y 12 de Octubre, colonia Ixtlahuacan, por incendio.","['00', '00', 'servicio', 'emergencia', 'laborar', 'av', '12', 'octubre', 'colonia', 'ixtlahuacar', 'incendio']","['PrecauciónVial', 'LasTorres']",[],0,0,0,166594238,OVIAL_SSCCDMX,OVIALCDMX,2010-07-14 09:00:43,1,1942061,135,2020-01-10 00:00:43,2020,01,10,00,00,16,Miguel Hidalgo,-99.1843501,19.3998346
1215517462831288320,tránsito,palabras clave,"Una #ambulancia de #CruzRojaMexicana está atendiendo un #accidente de #tránsito en Paseo de las Palmas, Lomas de Reforma, Miguel Hidalgo extrema precauciones al pasar por ese lugar https://t.co/XbN6pBwVlE","['atender', 'paseo', 'palma', 'loma', 'reforma', 'miguel', 'hidalgo', 'extremo', 'precaución', 'pasar', 'lugar']","['ambulancia', 'CruzRojaMexicana', 'accidente', 'tránsito']",[],3,0,1,476050170,Cruz Roja CDMX,CruzRoja_CDMX,2012-01-27 12:27:33,0,43836,370,2020-01-10 00:15:21,2020,01,10,00,15,16,Miguel Hidalgo,-99.2045669144,19.4280623649
1215542201892999168,incendio,coordenadas,"01:53 #PrecauciónVial, servicios de emergencia laboran en Marroquí e Independencia, colonia Centro, por incendio.","['01', '53', 'servicio', 'emergencio', 'laborar', 'marroquí', 'independencia', 'colonia', 'centro', 'incendio']",['PrecauciónVial'],[],3,0,2,166594238,OVIAL_SSCCDMX,OVIALCDMX,2010-07-14 09:00:43,1,1942069,135,2020-01-10 01:53:39,2020,01,10,01,53,16,Miguel Hidalgo,-99.1843501,19.3998346
1215542541782671362,incendio,palabras clave,"Movilización de servicios de emergencia, laboran en local por conato de incendio en calle José Ma. Marroquí de la colonia Centro, alcaldía de Cuauhtémoc. https://t.co/UHUqjNTr2N","['movilización', 'servicio', 'emergencio', 'laborar', 'local', 'conato', 'incendio', 'calle', 'josé', 'ma', 'marroquí', 'colonia', 'centro', 'alcaldía', 'cuauhtemoc']",[],[],8,0,2,903808418728861696,verde,jlleralaprensa,2017-09-01 20:34:53,0,3111,50,2020-01-10 01:55:00,2020,01,10,01,55,15,Cuauhtémoc,-99.1490557562,19.4313734294
1215544018949623808,incendio,coordenadas,#incendio en local comercial del centro histórico moviliza a los servicios de emergencia. Decenas de personas desalojan edificio de Marroquí por la emergencia. @BomberosDFNoOf @Bomberos_CDMX @SSP_CDMX @C5_CDMX #lahistoriadelamadrugada 🌃 https://t.co/NyuDgWhi5n,"['local', 'comercial', 'centro', 'histórico', 'movilizar', 'servicio', 'emergencio', 'decena', 'persona', 'desalojar', 'edificio', 'marroquí', 'emergencio']","['incendio', 'lahistoriadelamadrugada']","['BomberosDFNoOf', 'Bomberos_CDMX', 'SSP_CDMX', 'C5_CDMX']",4,0,2,525112886,Guillermo Segura,memosegura11,2012-03-15 00:57:10,0,6042,257,2020-01-10 02:00:52,2020,01,10,02,00,15,Cuauhtémoc,-99.14311197507244,19.433657995909577
1215609556878925824,tránsito,palabras clave,"Al transitar por Puebla, Roma Norte, Cuauhtémoc encontrarás un #accidente de #tránsito atendido por #CruzRojaMexicana, ten cuidado y disminuye tu velocidad  https://t.co/CSR4AnHZfE","['transitar', 'puebla', 'romo', 'norte', 'cuauhtemoc', 'encontrarás', 'atendido', 'ten', 'cuidado', 'disminuir', 'velocidad']","['accidente', 'tránsito', 'CruzRojaMexicana']",[],6,1,0,476050170,Cruz Roja CDMX,CruzRoja_CDMX,2012-01-27 12:27:33,0,43836,370,2020-01-10 06:21:17,2020,01,10,06,21,15,Cuauhtémoc,-99.1490557562,19.4313734294
1215616114417393667,tránsito,palabras clave,"Les comparto que a las 8:00 hrs. en Av. Cuauhtémoc y Av. Eugenia,, col. Narvarte Poniente, Alcaldía Benito Juárez se esperan manifestantes además ya presenta tránsito lento en Calz. Ignacio Zaragoza desde Anillo Periférico hacia eje 4 Oriente. https://t.co/x6ksAcZRBP","['compartir', '00', 'hrs', 'av', 'cuauhtemoc', 'av', 'eugenia', 'col', 'narvarte', 'poniente', 'alcaldía', 'benito', 'juarez', 'esperar', 'manifestante', 'además', 'presentar', 'tránsito', 'lento', 'call', 'ignacio', 'zaragoza', 'anillo', 'periférico', 'hacia', 'eje', 'oriente']",[],[],0,0,0,134287130,SOL EN LINEA,sol_linea,2010-04-17 18:47:29,0,318,736,2020-01-10 06:47:21,2020,01,10,06,47,14,Benito Juárez,-99.1611346584,19.3806424162
1215623458027163648,tránsito,palabras clave,Tlahuac Linea 12 Trafico Lento,"['tlahuac', 'linea', '12', 'trafico', 'lento']",[],[],0,0,0,1000287780,Reportes App,ReportRedTranDF,2012-12-09 16:05:00,0,408,9,2020-01-10 07:16:32,2020,01,10,07,16,11,Tláhuac,-99.0028216137,19.2769983772
1215630621978124288,tránsito,palabras clave,"07:45 Oficiales de #Tránsito implementan dispositivo para inhibir el acceso de vehículos sobre carril exclusivo de @MetrobusCDMX en Rep. de Argentina y Venezuela, col. Centro, alcaldía Cuauhtémoc. #MovilidadCDMX https://t.co/tkVkKCTS8H","['07', '45', 'oficial', 'implementar', 'dispositivo', 'inhibir', 'acceso', 'vehículo', 'carril', 'exclusivo', 'rep', 'argentina', 'venezuela', 'col', 'centro', 'alcaldía', 'cuauhtemoc']","['Tránsito', 'MovilidadCDMX']",['MetrobusCDMX'],6,1,0,166594238,OVIAL_SSCCDMX,OVIALCDMX,2010-07-14 09:00:43,1,1942068,135,2020-01-10 07:45:00,2020,01,10,07,45,15,Cuauhtémoc,-99.1490557562,19.4313734294
1215632300924338178,tránsito,palabras clave,"@SSP_CDMX @Alc_Iztapalapa @VILLALVAZO13 @inakimanero 
Y para ellos no aplica el reglamento de tránsito? Estacionado en el paso peatonal frente a la alcaldía Iztapalapa https://t.co/MIzVFDfljp","['aplicar', 'reglamento', 'tránsito', 'estacionado', 'paso', 'peatonal', 'frente', 'alcaldía', 'iztapalapa']",[],"['SSP_CDMX', 'Alc_Iztapalapa', 'VILLALVAZO13', 'inakimanero']",0,0,0,1210084146,MEPHISTO VILLEGAS,hellangeljvc,2013-02-22 17:44:54,0,38,162,2020-01-10 07:51:40,2020,01,10,07,51,7,Iztapalapa,-99.0567989642,19.3491663204
1215638863697199104,tránsito,coordenadas,"@LaSEMOVI En veces me pregunto quien carajos diseña y sobre todo pone en circulación camiones tan horribles como los que hoy corren sobre circuito bicentenario. Con un pasillo tan estrecho, lugares para personas con capacidades diferentes con escalones.","['vez', 'preguntar', 'carajo', 'diseñar', 'poner', 'circulación', 'camión', 'tanto', 'horrible', 'hoy', 'correr', 'circuito', 'bicentenario', 'pasillo', 'tanto', 'estrecho', 'lugar', 'persona', 'capacidad', 'diferente', 'escalón']",[],['LaSEMOVI'],0,1,0,2343022285,Carmen Millán,carmillanm,2014-02-13 21:56:32,0,11,116,2020-01-10 08:17:45,2020,01,10,08,17,15,Cuauhtémoc,-99.259495,19.3863707
1215639057746690048,tránsito,palabras clave,@SSC_Pue @Heineken_MX camiones generando tráfico al esperar cargar combustible en calzada Zaragoza frente a estadio Cuauhtémoc https://t.co/xSPM2dfiYv,"['camión', 'generar', 'tráfico', 'esperar', 'cargar', 'combustible', 'calzado', 'zaragoza', 'frente', 'estadio', 'cuauhtemoc']",[],"['SSC_Pue', 'Heineken_MX']",0,0,0,239599956,Jorge Fidel T,JorgeFidel23,2011-01-17 18:35:07,0,69,261,2020-01-10 08:18:31,2020,01,10,08,18,15,Cuauhtémoc,-99.1490557562,19.4313734294
1215640972773728256,tránsito,palabras clave,"Personal de la #CruzRojaMexicana auxilian a un paciente en Insurgentes, Juárez, Cuauhtémoc debido a un #accidente de #tránsito https://t.co/myld3xCtOB","['personal', 'auxiliar', 'paciente', 'insurgente', 'juarez', 'cuauhtemoc', 'debido']","['CruzRojaMexicana', 'accidente', 'tránsito']",[],0,0,0,476050170,Cruz Roja CDMX,CruzRoja_CDMX,2012-01-27 12:27:33,0,43836,370,2020-01-10 08:26:08,2020,01,10,08,26,15,Cuauhtémoc,-99.1490557562,19.4313734294
1215655078767538178,incendio,palabras clave,"#ULTIMAHORA MATA A BALAZOS A COMPAÑEROS Y MAESTRA, LUEGO SE SUICIDA
SUCEDIÓ EN UN COLEGIO DE #TORREÓN 
Esta mañana se reportaron detonaciones de fuego en un colegio ubicado a la altura del Bosque Venustiano Carranza de Torreón.
Un menor de 8 años atacó a balazos a sus compañeros","['matar', 'balazo', 'compañero', 'maestro', 'luego', 'suicidasucedeír', 'colegio', 'mañana', 'reportar', 'detonación', 'fuego', 'colegio', 'ubicado', 'altura', 'bosque', 'venustiano', 'carranza', 'torreón', 'menor', 'año', 'atacar', 'balazo', 'compañero']","['ULTIMAHORA', 'TORREÓN']",[],0,0,0,846886606212665344,🦂Alacrán Avitia,AlacranAvitia,2017-03-28 18:47:56,0,277,2826,2020-01-10 09:22:11,2020,01,10,09,22,17,Venustiano Carranza,-99.0931057959,19.4304954545
1215656454524370945,tránsito,palabras clave,"Una #ambulancia de la #CruzRojaMexicana labora atendiendo a un paciente herido por un #accidente de #tránsito en Av. Nuevo Leon, Condesa, Cuauhtémoc https://t.co/TlK8Fh7Ozo","['laborar', 'atender', 'paciente', 'herido', 'av', 'nuevo', 'leon', 'condesa', 'cuauhtemoc']","['ambulancia', 'CruzRojaMexicana', 'accidente', 'tránsito']",[],1,0,0,476050170,Cruz Roja CDMX,CruzRoja_CDMX,2012-01-27 12:27:33,0,43836,370,2020-01-10 09:27:39,2020,01,10,09,27,15,Cuauhtémoc,-99.1490557562,19.4313734294
1215658522106630145,tránsito,palabras clave,"Un #accidente de #tránsito en Tuxpan, Roma Sur, Cuauhtémoc fue reportado a la #CruzRojaMexicana, te recomendamos tener cuidado al transitar en esa zona https://t.co/FAg6aL1lcN","['topar', 'romo', 'sur', 'cuauhtemoc', 'reportado', 'recomendar', 'tener', 'cuidado', 'transitar', 'zona']","['accidente', 'tránsito', 'CruzRojaMexicana']",[],0,0,0,476050170,Cruz Roja CDMX,CruzRoja_CDMX,2012-01-27 12:27:33,0,43836,370,2020-01-10 09:35:52,2020,01,10,09,35,15,Cuauhtémoc,-99.1490557562,19.4313734294
