pubID,topicQuery,typeQuery,tweet,tokens,hashtags,mentions,likeCount,replyCount,retweetCount,authorID,authorName,authorUsername,authorCreatedAt,authorVerified,followersCount,followingCount,pubDate,pubYear,pubMonth,pubDay,pubHour,pubMinute,geoID,geoName,longitude,latitude
1496522947175006215,tránsito,coordenadas,"#CICSA  Las Cámaras De Combustión CICSA con ventilador de circulación de aire, para un horno continuo para secado de pintura con quemador hornopak para gas natural. 🥳🥰 https://t.co/yLW1mZjaXs 😊🙂 https://t.co/sLbk1XRGK5","['cámara', 'combustión', 'casa', 'ventilador', 'circulación', 'aire', 'horno', 'continuo', 'secado', 'pintura', 'quemador', 'hornopak', 'gas', 'natural']",['CICSA'],[],0,0,0,581297830,CICSA,CICSAdeCV,2012-05-15 16:15:37,0,1046,2800,2022-02-23 10:30:49,2022,02,23,10,30,4,Cuajimalpa de Morelos,-99.1750717163086,19.38321304321289
1496526313452183555,tránsito,palabras clave,"Puta madre contigo Xochimilco, siempre pinche tráfico para salir.
Si no cierran para celebrar alguna figura de yeso, sale alguna otra pendejada.","['puta', 'madre', 'contigo', 'xochimilco', 'siempre', 'pinche', 'tráfico', 'salir', 'si', 'cerrar', 'celebrar', 'alguno', 'figura', 'yeso', 'salir', 'alguno', 'ponderada']",[],[],5,0,1,74971592,Mr. Frog,Samaugac,2009-09-17 03:13:30,0,192,462,2022-02-23 10:44:11,2022,02,23,10,44,13,Xochimilco,-99.0903636045,19.2451450458
1496526889229467651,incendio,palabras clave,"Por #incendio de casa, Servicios de Emergencia laboran en calle Quinta Cda. de las Rosas y 3ra Cda. las Rosas, col. La Magdalena Culhuacán, alcaldía Coyoacán. Alternativas: Las Rosas y 20 de Agosto.","['casa', 'servicio', 'emergencio', 'laborar', 'calle', 'quinto', 'cda', 'rosas', '3ra', 'cda', 'rosas', 'col', 'magdalena', 'culhuacán', 'alcaldía', 'coyoacán', 'alternativo', 'rosa', '20', 'agosto']",['incendio'],[],4,0,0,40098528,Radio Tráfico Total,trafico889,2009-05-14 16:06:13,1,899098,70,2022-02-23 10:46:29,2022,02,23,10,46,3,Coyoacán,-99.1503763525,19.3266672536
1496535324109021186,tránsito,palabras clave,"Calz. de Tlalpan con transito lento  de Eje 5 Sur hacia Viaducto Río Piedad.
Toma precauciones.

# ApoyoVial https://t.co/HQxVEyg5dD","['call', 'tlalpan', 'transito', 'lento', 'eje', 'sur', 'hacia', 'viaducto', 'río', 'piedad', 'tomar', 'precaución', 'apoyovial']",[],[],0,0,0,1429847377393954818,ApoyoVial,InfotrafficMX,2021-08-23 10:47:47,0,2268,4977,2022-02-23 11:20:00,2022,02,23,11,20,12,Tlalpan,-99.2062207957,19.1983396763
1496537745585586181,incendio,palabras clave,"Bomberos de la CdMx recibe reporte de incendio en colonia Zona Rústica Xochimilco, en @XochimilcoAl; acudimos al lugar para verificar la situación y mantener a la ciudadanía informada.","['bombero', 'cdmx', 'recibir', 'reporte', 'incendio', 'colonia', 'zona', 'rústico', 'xochimilco', 'audios', 'lugar', 'verificar', 'situación', 'mantener', 'ciudadanía', 'informado']",[],['XochimilcoAl'],23,2,5,1091042850618232832,Bomberos Ciudad de México Oficial,Bomberos_CDMX,2019-01-31 12:37:40,1,85019,187,2022-02-23 11:29:37,2022,02,23,11,29,13,Xochimilco,-99.0903636045,19.2451450458
1496537922862039040,tránsito,palabras clave,"Una #ambulancia de #CruzRojaMexicana está atendiendo un #accidente de #tránsito en  Av de los #Poetas,  #Torres de #Potrero,  #Álvaro #Obregón extrema precauciones al pasar por ese lugar https://t.co/MkEorBaH7I","['atender', 'av', 'extremo', 'precaución', 'pasar', 'lugar']","['ambulancia', 'CruzRojaMexicana', 'accidente', 'tránsito', 'Poetas', 'Torres', 'Potrero', 'Álvaro', 'Obregón']",[],0,0,0,476050170,Cruz Roja CDMX,CruzRoja_CDMX,2012-01-27 12:27:33,0,43836,370,2022-02-23 11:30:19,2022,02,23,11,30,10,Álvaro Obregón,-99.246819712,19.336175562
1496538900541710346,tránsito,palabras clave,"Al transitar por  Av de los #Poetas,  #Torres de #Potrero,  #Álvaro #Obregón encontrarás un #accidente de #tránsito atendido por #CruzRojaMexicana, ten cuidado y disminuye tu velocidad  https://t.co/MkEorBaH7I","['transitar', 'av', 'encontrarás', 'atendido', 'ten', 'cuidado', 'disminuir', 'velocidad']","['Poetas', 'Torres', 'Potrero', 'Álvaro', 'Obregón', 'accidente', 'tránsito', 'CruzRojaMexicana']",[],0,0,0,476050170,Cruz Roja CDMX,CruzRoja_CDMX,2012-01-27 12:27:33,0,43836,370,2022-02-23 11:34:12,2022,02,23,11,34,10,Álvaro Obregón,-99.246819712,19.336175562
1496539860911497220,incendio,palabras clave,"🚨 Servicios de emergencia se aproximan para trabajar por incendio de pastizal, Canal Nacional y Anillo Periférico, colonia Zona Turística Xochimilco, @XochimilcoAl.  #C5 #911CDMX","['servicio', 'emergencia', 'aproximar', 'trabajar', 'incendio', 'pastizal', 'canal', 'nacional', 'anillo', 'periférico', 'colonio', 'zona', 'turístico', 'xochimilco']","['C5', '911CDMX']",['XochimilcoAl'],18,0,4,195951901,C5 CDMX,C5_CDMX,2010-09-27 17:51:04,1,947204,760,2022-02-23 11:38:01,2022,02,23,11,38,13,Xochimilco,-99.0903636045,19.2451450458
1496540651776884740,tránsito,palabras clave,Ma de 30 en la fila desde paseo Usumacinta y apenas voy a la mitad y todo por la vacuna #COVID19 #3radossis tráfico de la fregada,"['ma', '30', 'fila', 'paseo', 'usumacinta', 'apenas', 'ir', 'mitad', 'vacuna', 'tráfico', 'frenado']","['COVID19', '3radossis']",[],1,0,0,327776126,ricardo alejo moreno,ricarma20,2011-07-01 22:00:58,0,127,196,2022-02-23 11:41:10,2022,02,23,11,41,9,Milpa Alta,-92.94506063805927,17.98442673507494
1496540679790551054,incendio,palabras clave,"#Precauciones |

Servicios de emergencia se dirigen a Canal Nacional y Anillo Periférico, colonia Zona Turística Xochimilco, @XochimilcoAl, por incendio de pastizal.","['servicio', 'emergencio', 'dirigir', 'canal', 'nacional', 'anillo', 'periférico', 'colonio', 'zona', 'turístico', 'xochimilco', 'incendio', 'pastizal']",['Precauciones'],['XochimilcoAl'],28,0,6,293063533,JORGE BECERRIL JB/8,MrElDiablo8,2011-05-04 12:00:15,1,173855,888,2022-02-23 11:41:17,2022,02,23,11,41,13,Xochimilco,-99.0903636045,19.2451450458
1496541471071219721,incendio,palabras clave,"Servicios de Emergencia laboran por incendio de Pastizal sobre Canal de Chalco en los límites de Xochimilco, Iztapalapa y Tláhuac. 

Cede el paso a las unidades! Si vives cerca del sitio mantén cerradas puertas y ventanas. 

Foto especial: https://t.co/WJnpwRa1vw","['servicio', 'emergencia', 'laborar', 'incendio', 'pastizal', 'canal', 'chaleco', 'límites', 'xochimilco', 'iztapalapa', 'tláhuac', 'ceder', 'paso', 'unidad', 'si', 'vivir', 'cerca', 'sitio', 'mantar', 'cerrado', 'puerta', 'ventana', 'foto', 'especial']",[],[],10,0,4,1651261454,Elías G.,USARHM,2013-08-06 15:15:12,0,10269,850,2022-02-23 11:44:25,2022,02,23,11,44,11,Tláhuac,-99.0028216137,19.2769983772
1496552013475241984,tránsito,palabras clave,"FOTOS📲 Choferes de la #Ruta14 exigieron un alto al aumento de mototaxis... aseguraron que vehículos han tomado vías primarias en #Iztapalapa. #Escuadrón201 #bloqueo #circulación #denuncia 

https://t.co/o53HxtKWVT","['foto', 'chofer', 'exigir', 'alto', 'aumento', 'mototaxis', 'asegurar', 'vehículo', 'tomado', 'vía', 'primario']","['Ruta14', 'Iztapalapa', 'Escuadrón201', 'bloqueo', 'circulación', 'denuncia']",[],0,0,0,621313871,CDMXenlaRed.com,CDMXenlared,2012-06-28 15:13:19,0,70303,583,2022-02-23 12:26:19,2022,02,23,12,26,7,Iztapalapa,-99.0567989642,19.3491663204
1496552686011011082,tránsito,palabras clave,"#CruzRojaMexicana está atendiendo un #accidente de #tránsito en  #Poniente 150,  #Industrial #Vallejo, #Azcapotzalco con una #ambulancia donada con tus aportaciones https://t.co/fiO4Ih6qRx","['atender', '150', 'donado', 'aportación']","['CruzRojaMexicana', 'accidente', 'tránsito', 'Poniente', 'Industrial', 'Vallejo', 'Azcapotzalco', 'ambulancia']",[],0,0,0,476050170,Cruz Roja CDMX,CruzRoja_CDMX,2012-01-27 12:27:33,0,43836,370,2022-02-23 12:28:59,2022,02,23,12,28,2,Azcapotzalco,-99.1821069423,19.4853286147
1496559143930322949,tránsito,palabras clave,"Estamos atendiendo en #CruzRojaMexicana un #accidente de #tránsito en  #Insurgentes sur,  #Roma #Norte, #Cuauhtémoc extrema precacuciones al pasar por ese lugar https://t.co/6HzHzwqLCo","['atender', 'sur', 'extremo', 'precaución', 'pasar', 'lugar']","['CruzRojaMexicana', 'accidente', 'tránsito', 'Insurgentes', 'Roma', 'Norte', 'Cuauhtémoc']",[],0,0,0,476050170,Cruz Roja CDMX,CruzRoja_CDMX,2012-01-27 12:27:33,0,43836,370,2022-02-23 12:54:39,2022,02,23,12,54,15,Cuauhtémoc,-99.1490557562,19.4313734294
1496568592556515344,tránsito,palabras clave,"Personal de la #CruzRojaMexicana auxilian a un paciente en  Rio #Consulado, #Atlampa, #Cuauhtémoc debido a un #accidente de #tránsito https://t.co/VCIKzNFdXF","['personal', 'auxiliar', 'paciente', 'rio', 'debido']","['CruzRojaMexicana', 'Consulado', 'Atlampa', 'Cuauhtémoc', 'accidente', 'tránsito']",[],0,0,0,476050170,Cruz Roja CDMX,CruzRoja_CDMX,2012-01-27 12:27:33,0,43836,370,2022-02-23 13:32:12,2022,02,23,13,32,15,Cuauhtémoc,-99.1490557562,19.4313734294
1496570871133216770,incendio,palabras clave,"Se registró un #incendio de pasto seco en Av. Canal de Chalco, col. Parque Ecológico de Xochimilco, @XochimilcoAl. No hubo lesionados. Equipos de emergencia controlaron la flama y realizaron trabajos de enfriamiento. https://t.co/MKpj6lg7RR","['registrar', 'pasto', 'seco', 'av', 'canal', 'chaleco', 'col', 'parque', 'ecológico', 'xochimilco', 'lesionado', 'equipo', 'emergencio', 'controlar', 'flama', 'realizar', 'trabajo', 'enfriamiento']",['incendio'],['XochimilcoAl'],19,0,8,109157742,Secretaría de Gestión Integral de Riesgos y PC,SGIRPC_CDMX,2010-01-27 22:10:24,1,1146211,570,2022-02-23 13:41:15,2022,02,23,13,41,13,Xochimilco,-99.0903636045,19.2451450458
1496572318059044867,tránsito,palabras clave,"En la dirección #Cordoba,  #Roma #Norte, #Cuauhtémoc un vehículo de la #CruzRojaMexicana atiende un #accidente de #tránsito, evita esas vialidades https://t.co/pLMGyYIPof","['dirección', 'vehículo', 'atender', 'evitar', 'vialidad']","['Cordoba', 'Roma', 'Norte', 'Cuauhtémoc', 'CruzRojaMexicana', 'accidente', 'tránsito']",[],0,0,0,476050170,Cruz Roja CDMX,CruzRoja_CDMX,2012-01-27 12:27:33,0,43836,370,2022-02-23 13:47:00,2022,02,23,13,47,15,Cuauhtémoc,-99.1490557562,19.4313734294
1496573204655185924,incendio,palabras clave,"🚨 Servicios de emergencia acudieron para trabajar por incendio de pastizal, Camino a Xitle y Paseo Girasol, colonia Tlalpuente, Tlalpan. https://t.co/X59P6BTJRD","['servicio', 'emergencia', 'acudir', 'trabajar', 'incendio', 'pastizal', 'camino', 'title', 'paseo', 'girasol', 'colonia', 'tlalpuente', 'tlalpan']",[],[],0,0,0,1155980679546593280,COMUNIDAD ACTIVA DE REPORTE A LA CIUDADANÍA,ActivaReporte,2019-07-29 17:17:25,0,2193,782,2022-02-23 13:50:31,2022,02,23,13,50,12,Tlalpan,-99.2062207957,19.1983396763
1496573254672265226,incendio,palabras clave,"🚨 Servicios de emergencia acudieron para trabajar por incendio de pastizal, Camino a Xitle y Paseo Girasol, colonia Tlalpuente, Tlalpan. https://t.co/Yw5oZwOz3u","['servicio', 'emergencia', 'acudir', 'trabajar', 'incendio', 'pastizal', 'camino', 'title', 'paseo', 'girasol', 'colonia', 'tlalpuente', 'tlalpan']",[],[],0,0,0,984214679147905029,Saúl Hernández garcia,SalHernndezgar1,2018-04-11 17:40:40,0,430,1122,2022-02-23 13:50:43,2022,02,23,13,50,12,Tlalpan,-99.2062207957,19.1983396763
1496574170758463488,incendio,palabras clave,"Bomberos de la CdMx laboraron en incendio de pasto seco y hojarasca en aproximadamente 1500 metros cuadrados, en  Avenida Morelos, Pueblo San Miguel Topilejo, Tlalpan https://t.co/GN2gZ7QGfW","['bombero', 'cdmx', 'elaborar', 'incendio', 'pasto', 'seco', 'hojarasca', 'aproximadamente', '1500', 'metros', 'cuadrados', 'avenida', 'morelos', 'pueblo', 'san', 'miguel', 'topillo', 'tlalpan']",[],[],0,0,0,1155980679546593280,COMUNIDAD ACTIVA DE REPORTE A LA CIUDADANÍA,ActivaReporte,2019-07-29 17:17:25,0,2193,782,2022-02-23 13:54:21,2022,02,23,13,54,12,Tlalpan,-99.2062207957,19.1983396763
1496574333342429199,incendio,palabras clave,"Bomberos de la CdMx laboraron en incendio de pasto seco y hojarasca en aproximadamente 1500 metros cuadrados, en  Avenida Morelos, Pueblo San Miguel Topilejo, Tlalpan https://t.co/GEP16PF7vA","['bombero', 'cdmx', 'elaborar', 'incendio', 'pasto', 'seco', 'hojarasca', 'aproximadamente', '1500', 'metros', 'cuadrados', 'avenida', 'morelos', 'pueblo', 'san', 'miguel', 'topillo', 'tlalpan']",[],[],0,0,0,984214679147905029,Saúl Hernández garcia,SalHernndezgar1,2018-04-11 17:40:40,0,430,1122,2022-02-23 13:55:00,2022,02,23,13,55,12,Tlalpan,-99.2062207957,19.1983396763
1496575181040635913,incendio,palabras clave,"Bomberos de la CdMx laboraron en incendio de aproximadamente 200 metros cuadrados de pasto seco, basura y troncos, en Avenida México-Ajusco, colonia Magdalena Petlacalco, en Tlalpan.

En seguimiento al incendio registrado en colonia Magdalena Petlacalco, en Tlalpan, 
1/2 https://t.co/D8dScW6mYY","['bombero', 'cdmx', 'elaborar', 'incendio', 'aproximadamente', '200', 'metro', 'cuadrado', 'pasto', 'seco', 'basura', 'tronco', 'avenido', 'méxico-ajusto', 'colonia', 'magdalena', 'petlacalco', 'tlalpan', 'seguimiento', 'incendio', 'registrado', 'colonia', 'magdalena', 'petlacalco', 'tlalpan']",[],[],0,1,0,984214679147905029,Saúl Hernández garcia,SalHernndezgar1,2018-04-11 17:40:40,0,430,1122,2022-02-23 13:58:22,2022,02,23,13,58,12,Tlalpan,-99.2062207957,19.1983396763
1496575841387507713,incendio,palabras clave,"Incendio consume cocina de restaurante en #Xochimilco en CdMx

https://t.co/18hgklyVQx https://t.co/jeS76mzCpH","['incendio', 'consumir', 'cocina', 'restaurante', 'cdmx']",['Xochimilco'],[],4,0,1,24969337,Milenio,Milenio,2009-03-17 16:26:38,1,5628710,0,2022-02-23 14:01:00,2022,02,23,14,01,13,Xochimilco,-99.0903636045,19.2451450458
1496576083000442891,incendio,palabras clave,"Bomberos de la CdMx recibieron reporte de incendio en colonia Huichapan, en Xochimilco; acudimos al lugar para verificar la situación y mantener a la ciudadanía informada.

En seguimiento al incendio se confirma la dirección en Avenida Prolongación del Norte, colonia 
1/2 https://t.co/LRRw3ePpT9","['bombero', 'cdmx', 'recibir', 'reporte', 'incendio', 'colonia', 'huichapan', 'xochimilco', 'audio', 'lugar', 'verificar', 'situación', 'mantener', 'ciudadanía', 'informado', 'seguimiento', 'incendio', 'confirmar', 'dirección', 'avenido', 'prolongación', 'norte', 'colonia']",[],[],2,1,1,984214679147905029,Saúl Hernández garcia,SalHernndezgar1,2018-04-11 17:40:40,0,430,1122,2022-02-23 14:01:57,2022,02,23,14,01,13,Xochimilco,-99.0903636045,19.2451450458
1496579176706490379,incendio,palabras clave,Bomberos de la #CDMX lograron sofocar un incendio dentro de una cocina en un restaurante en Xochimilco 🔽 https://t.co/2ObMo9cfXY,"['bombero', 'lograr', 'sofocar', 'incendio', 'dentro', 'cocina', 'restaurante', 'xochimilco']",['CDMX'],[],0,0,0,1301271666,Noticias En La Mira,OficialEnLaMira,2013-03-25 15:51:15,0,320312,1549,2022-02-23 14:14:15,2022,02,23,14,14,13,Xochimilco,-99.0903636045,19.2451450458
1496581437709066240,tránsito,palabras clave,"@OVIALCDMX @UCS_GCDMX se necesita urgente y todos los días un agente de tránsito en av san lobezno y ermita del iztapalapa,  los camiones toman hasta 3 carriles para hacer parada generan caos vial","['necesitar', 'urgente', 'día', 'agente', 'tránsito', 'av', 'san', 'lorenzo', 'ermita', 'iztapalapa', 'camión', 'tomar', 'carril', 'hacer', 'parada', 'generar', 'cao', 'vial']",[],"['OVIALCDMX', 'UCS_GCDMX']",0,1,0,1061456692301492224,Dr Gabriel AR,Gab01214483,2018-11-10 21:12:51,0,24,136,2022-02-23 14:23:14,2022,02,23,14,23,7,Iztapalapa,-99.0567989642,19.3491663204
1496582450851758080,tránsito,palabras clave,"Solicitamos el apoyo de #transito para retirar obstaculos de la Av. Principal. Av. De las torres y esq. Azucena, Col. Torres de Potrero, Alvaro Obregón. Hay una escuela a 50mts y Los dueños no permiten estacionarse, se ponen muy agresivos. @UCS_GCDMX @SSC_CDMX https://t.co/LSskPk5Avr","['solicitar', 'apoyo', 'retirar', 'obstaculo', 'av', 'principal', 'av', 'torre', 'esq', 'azucén', 'col', 'torre', 'potrero', 'alvaro', 'obregon', 'escuela', '50mts', 'dueño', 'permitir', 'estacionar él', 'poner', 'agresivo']",['transito'],"['UCS_GCDMX', 'SSC_CDMX']",1,1,0,1268590658857521153,Siempre Chingndo,VigiladoAndamos,2020-06-04 11:09:28,0,8,15,2022-02-23 14:27:16,2022,02,23,14,27,10,Álvaro Obregón,-99.246819712,19.336175562
1496595188667412480,tránsito,palabras clave,"Una #ambulancia de la #CruzRojaMexicana labora atendiendo a un paciente herido por un #accidente de #tránsito en  #Baja #California,  #Roma Sur, #Cuauhtémoc https://t.co/ojapZatR18","['laborar', 'atender', 'paciente', 'herido', 'sur']","['ambulancia', 'CruzRojaMexicana', 'accidente', 'tránsito', 'Baja', 'California', 'Roma', 'Cuauhtémoc']",[],0,0,0,476050170,Cruz Roja CDMX,CruzRoja_CDMX,2012-01-27 12:27:33,0,43836,370,2022-02-23 15:17:53,2022,02,23,15,17,15,Cuauhtémoc,-99.1490557562,19.4313734294
1496597943842971656,incendio,palabras clave,"REPORTAN INCENDIO 🔥🚒 en El Salto, Col. Las Pintas, Francisco Marquez y Álvaro Obregón. Tome precauciones","['reportar', 'incendio', 'salto', 'col', 'pinta', 'francisco', 'marquez', 'alvaro', 'obregon', 'tomar', 'precaución']",[],[],1,0,1,4501789032,Escudo Urbano C5 Jalisco,EscudoUrbanoJal,2015-12-08 18:15:15,0,45929,40,2022-02-23 15:28:49,2022,02,23,15,28,10,Álvaro Obregón,-99.246819712,19.336175562
1496598709177565190,tránsito,palabras clave,"@lavozdepolanco @SOBSECDMX @AlcaldiaMHmx Eso lo he denunciado desde hace 20 años, y nunca me respondieron. Supongo que la Alcaldía Miguel Hidalgo es la encargada de esa función, además de día afecta mucho el tráfico.","['denunciado', 'hacer', '20', 'año', 'nunca', 'responder', 'suponer', 'alcaldía', 'miguel', 'hidalgo', 'encargado', 'función', 'además', 'día', 'afectar', 'tráfico']",[],"['lavozdepolanco', 'SOBSECDMX', 'AlcaldiaMHmx']",1,0,0,724394750216790016,Ramiro Marín Díaz,ramiromarin66,2016-04-24 18:29:01,0,172,72,2022-02-23 15:31:52,2022,02,23,15,31,16,Miguel Hidalgo,-99.2045669144,19.4280623649
1496599203962925062,tránsito,palabras clave,"Personal de la #CruzRojaMexicana auxilian a un paciente en #Patriotismo,  #Hipódromo #Condesa, #Cuauhtémoc debido a un #accidente de #tránsito https://t.co/klJHBhOkTN","['personal', 'auxiliar', 'paciente', 'debido']","['CruzRojaMexicana', 'Patriotismo', 'Hipódromo', 'Condesa', 'Cuauhtémoc', 'accidente', 'tránsito']",[],2,0,0,476050170,Cruz Roja CDMX,CruzRoja_CDMX,2012-01-27 12:27:33,0,43836,370,2022-02-23 15:33:50,2022,02,23,15,33,15,Cuauhtémoc,-99.1490557562,19.4313734294
1496601138342371331,tránsito,coordenadas,"@cronicas_ciudad Es que Bucareli es una calle fantástica. Estando ahí, agradezco el tránsito lento para ver las fachadas. Sería interesantísimo leer más sobre la historia de esos edificios.
¡Excelente tarde!","['bucareli', 'calle', 'fantástico', 'ahí', 'agradecer', 'tránsito', 'lento', 'ver', 'fachada', 'interesantísimo', 'leer', 'historia', 'edificio', 'excelente', 'tarde']",[],['cronicas_ciudad'],2,0,0,110487400,Luis Armando,LuisArmandoA,2010-02-01 12:35:51,0,605,1292,2022-02-23 15:41:31,2022,02,23,15,41,10,Álvaro Obregón,-99.1919955,19.357102
1496603799535902724,tránsito,palabras clave,"@Antoine022K @Alc_Iztapalapa @ClaraBrugadaM @LaSEMOVI @SSC_CDMX Buen día, se coordina la atención de tu reporte con #Tránsito y @UCS_GCDMX.","['buen', 'día', 'coordín', 'atención', 'reporte']",['Tránsito'],"['Antoine022K', 'Alc_Iztapalapa', 'ClaraBrugadaM', 'LaSEMOVI', 'SSC_CDMX', 'UCS_GCDMX']",0,0,0,166594238,OVIAL_SSCCDMX,OVIALCDMX,2010-07-14 09:00:43,1,1942061,135,2022-02-23 15:52:06,2022,02,23,15,52,7,Iztapalapa,-99.0567989642,19.3491663204
1496606326444548098,tránsito,palabras clave,"@TlalpanAl @OVIALCDMX calzada de Tlalpan es un caos desde la joya hasta el estadio más de 45 minutos para traslado y no hay personal de seguridad vial para apoyar agilicen el tráfico ,zona vial apoyen en mover los vehículos que están estacionados sobre San Fernando","['calzada', 'tlalpan', 'caos', 'joya', 'estadio', '45', 'minuto', 'traslado', 'personal', 'seguridad', 'vial', 'apoyar', 'utilizar', 'tráfico', 'zona', 'vial', 'apoyar', 'mover', 'vehículo', 'estacionado', 'san', 'fernando']",[],"['TlalpanAl', 'OVIALCDMX']",0,2,0,925153628590972929,Marcs@segvial,MarcsVial,2017-10-30 18:13:08,0,9,73,2022-02-23 16:02:08,2022,02,23,16,02,12,Tlalpan,-99.2062207957,19.1983396763
1496619581418397701,tránsito,palabras clave,"Un #accidente de #tránsito en #Meseta,  Las #Águilas,  #Álvaro #Obregón fue reportado a la #CruzRojaMexicana, te recomendamos tener cuidado al transitar en esa zona https://t.co/PQt1TJfPeV","['reportar', 'recomendar', 'tener', 'cuidado', 'transitar', 'zona']","['accidente', 'tránsito', 'Meseta', 'Águilas', 'Álvaro', 'Obregón', 'CruzRojaMexicana']",[],0,0,1,476050170,Cruz Roja CDMX,CruzRoja_CDMX,2012-01-27 12:27:33,0,43836,370,2022-02-23 16:54:48,2022,02,23,16,54,10,Álvaro Obregón,-99.246819712,19.336175562
1496626198939529225,tránsito,palabras clave,"#Cuauhtemoc | Agentes de la CES, AEI y Transito reportados al 911 por robo a ciudadanos #ARnoticias #NoticiasChihuahua #CUU https://t.co/e5zl4g3RyF https://t.co/aCR5xP7FbI","['agente', 'ces', 'aei', 'transito', 'reportados', '911', 'robo', 'ciudadano']","['Cuauhtemoc', 'ARnoticias', 'NoticiasChihuahua', 'CUU']",[],0,0,0,134234830,AR Noticias,ARnoticias_1,2010-04-17 14:59:54,0,3382,815,2022-02-23 17:21:06,2022,02,23,17,21,15,Cuauhtémoc,-99.1490557562,19.4313734294
1496630943993548801,tránsito,palabras clave,"#CruzRojaMexicana está atendiendo un #accidente de #tránsito en  #Calz #Mexico #Tacuba,  San #Diego #Ocoyoacac,  #Miguel #Hidalgo con una #ambulancia donada con tus aportaciones https://t.co/x8eKPsgMQD","['atender', 'san', 'donado', 'aportación']","['CruzRojaMexicana', 'accidente', 'tránsito', 'Calz', 'Mexico', 'Tacuba', 'Diego', 'Ocoyoacac', 'Miguel', 'Hidalgo', 'ambulancia']",[],1,0,0,476050170,Cruz Roja CDMX,CruzRoja_CDMX,2012-01-27 12:27:33,0,43836,370,2022-02-23 17:39:57,2022,02,23,17,39,16,Miguel Hidalgo,-99.2045669144,19.4280623649
1496631000096460802,tránsito,palabras clave,"Estamos atendiendo en #CruzRojaMexicana un #accidente de #tránsito en Boulevard Benito Juarez, La Antena, Guaymas, extrema precacuciones al pasar por ese lugar https://t.co/D3HPMnvm54","['atender', 'boulevard', 'benito', 'juarez', 'antena', 'guaya', 'extremo', 'precaución', 'pasar', 'lugar']","['CruzRojaMexicana', 'accidente', 'tránsito']",[],0,0,0,708088889785778177,Cruz Roja Sonora,CruzRojaSonora,2016-03-10 18:35:21,0,1117,152,2022-02-23 17:40:11,2022,02,23,17,40,14,Benito Juárez,-99.1611346584,19.3806424162
1496637964738125829,incendio,palabras clave,"#Xochimilco. Controlan bomberos de la #CdMX el incendio reportado en #Huichapan-Tierra Nueva, Prolongación División del Norte. No hubo víctimas, afortunadamente. https://t.co/vM1k0TGNgy","['controlar', 'bombero', 'incendio', 'reportado', 'nuevo', 'prolongación', 'división', 'norte', 'víctima', 'afortunadamente']","['Xochimilco', 'CdMX', 'Huichapan-Tierra']",[],2,0,0,93556472,Informativo Anáhuac 🇲🇽📝📸 🎦🎙️🖥️ 🇲🇽,Xochimilco_MX,2009-11-29 22:03:05,0,5381,1186,2022-02-23 18:07:51,2022,02,23,18,07,13,Xochimilco,-99.0903636045,19.2451450458
1496638600330584065,tránsito,palabras clave,"Una #ambulancia de #CruzRojaMexicana está atendiendo un #accidente de #tránsito en #Puebla,  #Roma #Norte, #Cuauhtémoc extrema precauciones al pasar por ese lugar https://t.co/bbZwip11rA","['atender', 'extremo', 'precaución', 'pasar', 'lugar']","['ambulancia', 'CruzRojaMexicana', 'accidente', 'tránsito', 'Puebla', 'Roma', 'Norte', 'Cuauhtémoc']",[],1,0,1,476050170,Cruz Roja CDMX,CruzRoja_CDMX,2012-01-27 12:27:33,0,43836,370,2022-02-23 18:10:23,2022,02,23,18,10,15,Cuauhtémoc,-99.1490557562,19.4313734294
1496640728742645760,tránsito,palabras clave,"Estamos atendiendo en #CruzRojaMexicana un #accidente de #tránsito en  #Insurgentes sur, #Loreto,  #Álvaro #Obregón extrema precacuciones al pasar por ese lugar https://t.co/KZdgwAqTK5","['atender', 'sur', 'extremo', 'precaución', 'pasar', 'lugar']","['CruzRojaMexicana', 'accidente', 'tránsito', 'Insurgentes', 'Loreto', 'Álvaro', 'Obregón']",[],1,0,0,476050170,Cruz Roja CDMX,CruzRoja_CDMX,2012-01-27 12:27:33,0,43836,370,2022-02-23 18:18:50,2022,02,23,18,18,10,Álvaro Obregón,-99.246819712,19.336175562
1496648845404643333,tránsito,palabras clave,"Al transitar por #Horacio,  #Polanco II #Sección,  #Miguel #Hidalgo encontrarás un #accidente de #tránsito atendido por #CruzRojaMexicana, ten cuidado y disminuye tu velocidad  https://t.co/kjPb7nQJ4z","['transitar', 'ii', 'encontrarás', 'atendido', 'ten', 'cuidado', 'disminuir', 'velocidad']","['Horacio', 'Polanco', 'Sección', 'Miguel', 'Hidalgo', 'accidente', 'tránsito', 'CruzRojaMexicana']",[],2,0,1,476050170,Cruz Roja CDMX,CruzRoja_CDMX,2012-01-27 12:27:33,0,43836,370,2022-02-23 18:51:05,2022,02,23,18,51,16,Miguel Hidalgo,-99.2045669144,19.4280623649
1496650137095094282,tránsito,coordenadas,"@pepeshark @UABC_oficial Según reportes, ya se reabrió la circulación, aunque continúa la caída de aguanieve. Tienen alertas activadas por la peligrosidad que representa.","['según', 'report', 'reabrir', 'circulación', 'aunque', 'continúar', 'caída', 'aguanieve', 'alerta', 'activada', 'peligrosidad', 'representar']",[],"['pepeshark', 'UABC_oficial']",0,0,0,41537108,Carlos Cordero ,_CarlosCordero_,2009-05-20 23:40:07,0,1021,926,2022-02-23 18:56:13,2022,02,23,18,56,16,Miguel Hidalgo,-99.1843501,19.3998346
