pubID,topicQuery,typeQuery,tweet,tokens,hashtags,mentions,likeCount,replyCount,retweetCount,authorID,authorName,authorUsername,authorCreatedAt,authorVerified,followersCount,followingCount,pubDate,pubYear,pubMonth,pubDay,pubHour,pubMinute,geoID,geoName,longitude,latitude
1493958691246252033,incendio,palabras clave,"Gran incendio en Cuauhtémoc moviliza a bomberos de varios municipios
https://t.co/WTTvYF6spF https://t.co/rXv0apmVVM","['gran', 'incendio', 'cuauhtemoc', 'moviliza', 'bombero', 'varios', 'municipio']",[],[],0,0,0,1460339985169719306,Canal 44 - El Canal de las Noticias Chihuahua,Canal44DC1,2021-11-15 14:13:39,0,308,13,2022-02-16 08:41:23,2022,02,16,08,41,15,Cuauhtémoc,-99.1490557562,19.4313734294
1493964016196145156,tránsito,palabras clave,"Al transitar por  Av #Cuitlahuac,  #Nueva #Santa #María, #Azcapotzalco encontrarás un #accidente de #tránsito atendido por #CruzRojaMexicana, ten cuidado y disminuye tu velocidad  https://t.co/r8dNVMk19V","['transitar', 'av', 'encontrarás', 'atendido', 'ten', 'cuidado', 'disminuir', 'velocidad']","['Cuitlahuac', 'Nueva', 'Santa', 'María', 'Azcapotzalco', 'accidente', 'tránsito', 'CruzRojaMexicana']",[],1,0,0,476050170,Cruz Roja CDMX,CruzRoja_CDMX,2012-01-27 12:27:33,0,43836,370,2022-02-16 09:02:32,2022,02,16,09,02,2,Azcapotzalco,-99.1821069423,19.4853286147
1493965205021339648,tránsito,palabras clave,"Una #ambulancia de #CruzRojaMexicana está atendiendo un #accidente de #tránsito en #Ahuahuehuetes, #Pasteros, #Azcapotzalco extrema precauciones al pasar por ese lugar https://t.co/x7CeXuQKfx","['atender', 'extremo', 'precaución', 'pasar', 'lugar']","['ambulancia', 'CruzRojaMexicana', 'accidente', 'tránsito', 'Ahuahuehuetes', 'Pasteros', 'Azcapotzalco']",[],2,0,0,476050170,Cruz Roja CDMX,CruzRoja_CDMX,2012-01-27 12:27:33,0,43836,370,2022-02-16 09:07:16,2022,02,16,09,07,2,Azcapotzalco,-99.1821069423,19.4853286147
1493970467144806403,tránsito,palabras clave,Circulación vial que avanza lentemente sobre carril lateral de Paseo Tollocan entre Benito Juárez Garcia norte y Heriberto Enríquez. (Pte-Ote),"['circulación', 'vial', 'avanzar', 'lentamente', 'carril', 'lateral', 'paseo', 'colocar', 'benito', 'juarez', 'garcia', 'norte', 'herbert', 'enriquez', 'pte-ote']",[],[],1,0,0,177289328,AlertasViales Toluca,VialidadToluca,2010-08-11 13:11:28,0,19782,34,2022-02-16 09:28:10,2022,02,16,09,28,14,Benito Juárez,-99.1611346584,19.3806424162
1493972384415682569,tránsito,palabras clave,"Estamos atendiendo en #CruzRojaMexicana un #accidente de #tránsito en  Av. #Camino a #Santa fe,  La #Conchita,  #Álvaro #Obregón extrema precacuciones al pasar por ese lugar https://t.co/F3q2SmlUyF","['atender', 'av', 'fe', 'extremo', 'precaución', 'pasar', 'lugar']","['CruzRojaMexicana', 'accidente', 'tránsito', 'Camino', 'Santa', 'Conchita', 'Álvaro', 'Obregón']",[],1,0,0,476050170,Cruz Roja CDMX,CruzRoja_CDMX,2012-01-27 12:27:33,0,43836,370,2022-02-16 09:35:47,2022,02,16,09,35,10,Álvaro Obregón,-99.246819712,19.336175562
1493980509831147528,incendio,palabras clave,"En Avenida General Martín Carrera, colonia Martín Carrera, en alcaldía Gustavo A. Madero, en un local se quemaron desperdicios industriales en regular cantidad; procedimos a extinguir el incendio, no se reportan lesionados.
Se informa servicio concluido. https://t.co/wYFJU3rOGd","['avenida', 'general', 'martín', 'carrera', 'colonia', 'martín', 'carrera', 'alcaldía', 'gustavo', 'madero', 'local', 'quemar', 'desperdicio', 'industrial', 'regular', 'cantidad', 'proced', 'extinguir', 'incendio', 'reportar', 'lesionado', 'informar', 'servicio', 'concluido']",[],[],0,0,0,984214679147905029,Saúl Hernández garcia,SalHernndezgar1,2018-04-11 17:40:40,0,430,1122,2022-02-16 10:08:05,2022,02,16,10,08,5,Gustavo A. Madero,-99.1158642087,19.5040652077
1493986781317906433,tránsito,palabras clave,"#EnSinaloa | Se indicó que la neblina fue el factor que motivó el accidente que dejó miles de pesos en pérdidas y la circulación colapsada a la altura del kilómetro 120 de la autopista Benito Juárez.

https://t.co/6iIeh3oyxu","['indicar', 'neblín', 'factor', 'motivar', 'accidente', 'dejar', 'mil', 'pesos', 'pérdida', 'circulación', 'colapsado', 'altura', 'kilómetro', '120', 'autopista', 'benito', 'juarez']",['EnSinaloa'],[],0,0,0,82934471,Línea Directa Portal,linea_directa,2009-10-16 11:54:39,1,29194,745,2022-02-16 10:33:00,2022,02,16,10,33,14,Benito Juárez,-99.1611346584,19.3806424162
1493988628573347846,tránsito,palabras clave,"#ReporteVial Presencia de manifestantes en Insurgentes Sur y Eje 5 Sur, lo que mantiene cerrada la circulación; se trata de damnificados del sismo de septiembre de 2017 de la zona de Xochimilco. #ExpresoDeLaMañana https://t.co/32bFQnAaHl","['presencia', 'manifestant', 'insurgente', 'sur', 'eje', 'sur', 'mantener', 'cerrado', 'circulación', 'tratar', 'damnificado', 'sismo', 'septiembre', '2017', 'zona', 'xochimilco']","['ReporteVial', 'ExpresoDeLaMañana']",[],28,3,11,109651819,Foro_TV,Foro_TV,2010-01-29 14:05:47,1,1992733,84,2022-02-16 10:40:20,2022,02,16,10,40,13,Xochimilco,-99.0903636045,19.2451450458
1494007815853117442,tránsito,coordenadas,"El respeto al reglamento de tránsito en CDMX casi nadie lo cumple:
El vehículo Seat violando el espacio para motos y la moto de @UberEats estorbando el paso de transeúntes.
Por eso el que López viole la Constitución diariamente no es algo que a personas cómo estás les preocupe. https://t.co/aJPwG4gYCn","['respeto', 'reglamento', 'tránsito', 'cdmx', 'casi', 'nadie', 'cumplir', 'vehículo', 'seat', 'violar', 'espacio', 'moto', 'moto', 'estirar', 'paso', 'transeúnte', 'lópez', 'violar', 'constitución', 'diariamente', 'persona', 'cómo', 'preocupar']",[],['UberEats'],13,1,4,229178428,Ⓛⓤⓘⓢ Ⓒⓐⓞ™️ 🇺🇦🕊,lcaorome,2010-12-21 12:47:20,0,4972,5162,2022-02-16 11:56:35,2022,02,16,11,56,10,Álvaro Obregón,-99.19015079457655,19.361077693994137
1494012573016104963,tránsito,palabras clave,"Estamos atendiendo en #CruzRojaMexicana un #accidente de #tránsito en #Florencia, #Juárez, #Cuauhtémoc extrema precacuciones al pasar por ese lugar https://t.co/rLHxMUV5E1","['atender', 'extremo', 'precaución', 'pasar', 'lugar']","['CruzRojaMexicana', 'accidente', 'tránsito', 'Florencia', 'Juárez', 'Cuauhtémoc']",[],3,0,1,476050170,Cruz Roja CDMX,CruzRoja_CDMX,2012-01-27 12:27:33,0,43836,370,2022-02-16 12:15:29,2022,02,16,12,15,15,Cuauhtémoc,-99.1490557562,19.4313734294
1494018741704835074,tránsito,palabras clave,"Calz. de Tlalpan con transito lento  de Eje 5 Sur hacia Viaducto Río Piedad.
Toma precauciones.

# ApoyoVial https://t.co/D7AfIMuWgl","['call', 'tlalpan', 'transito', 'lento', 'eje', 'sur', 'hacia', 'viaducto', 'río', 'piedad', 'tomar', 'precaución', 'apoyovial']",[],[],2,0,0,1429847377393954818,ApoyoVial,InfotrafficMX,2021-08-23 10:47:47,0,2268,4977,2022-02-16 12:40:00,2022,02,16,12,40,12,Tlalpan,-99.2062207957,19.1983396763
1494028084659376128,incendio,palabras clave,"#ReporteCiudadano | Quema de basura en terrenos de la escuela Benito Juárez en la ciudad de #Tuxtepec, provoca fuerte humareda y molestia entres los transeúntes. https://t.co/sbfTskQbPw","['quemar', 'basura', 'terrenos', 'escuela', 'benito', 'juarez', 'ciudad', 'provocar', 'fuerte', 'humareda', 'molestio', 'entr', 'transeúnte']","['ReporteCiudadano', 'Tuxtepec']",[],1,1,0,29264182,TVBUS Noticias de Oaxaca,tvbus,2009-04-06 12:46:41,0,6412,1519,2022-02-16 13:17:07,2022,02,16,13,17,14,Benito Juárez,-99.1611346584,19.3806424162
1494030188732194816,tránsito,palabras clave,"#ReporteVial Se registra un accidente en la zona del Eje 5 Sur, colonia El Triunfo, en Iztapalapa, donde un motociclista se impactó contra un vehículo. La circulación en la zona se ve afectada. #LasNoticiasDeFOROtv https://t.co/LvZqkeoEVY","['registrar', 'accidente', 'zona', 'eje', 'sur', 'colonia', 'triunfo', 'iztapalapa', 'motociclista', 'impactar', 'vehículo', 'circulación', 'zona', 'ver', 'afectado']","['ReporteVial', 'LasNoticiasDeFOROtv']",[],6,0,2,109651819,Foro_TV,Foro_TV,2010-01-29 14:05:47,1,1992693,84,2022-02-16 13:25:29,2022,02,16,13,25,7,Iztapalapa,-99.0567989642,19.3491663204
1494030220013178885,tránsito,coordenadas,"@AlcaldiaMHmx quien será el encargado de asfixiar la circulación con obras tan estupidas cómo está? Todos éramos felices y ahora no habrá forma de pasar de dos carriles a uno, son tontos o que? https://t.co/CZgUOYeBtV","['encargado', 'asfixiar', 'circulación', 'obra', 'tanto', 'estúpido', 'cómo', 'feliz', 'ahora', 'formar', 'pasar', 'dos', 'carril', 'tonto']",[],['AlcaldiaMHmx'],0,0,0,55079357,Barita,bara1968,2009-07-08 18:11:07,0,139,349,2022-02-16 13:25:36,2022,02,16,13,25,15,Cuauhtémoc,-99.259495,19.3863707
1494033438969630722,tránsito,palabras clave,"En la dirección  #Eugenio sue,  #Polanco V #Sección,  #Miguel #Hidalgo un vehículo de la #CruzRojaMexicana atiende un #accidente de #tránsito, evita esas vialidades https://t.co/ZpB2mT4AXY","['dirección', 'sue', 'vehículo', 'atender', 'evitar', 'vialidad']","['Eugenio', 'Polanco', 'Sección', 'Miguel', 'Hidalgo', 'CruzRojaMexicana', 'accidente', 'tránsito']",[],1,0,1,476050170,Cruz Roja CDMX,CruzRoja_CDMX,2012-01-27 12:27:33,0,43836,370,2022-02-16 13:38:24,2022,02,16,13,38,16,Miguel Hidalgo,-99.2045669144,19.4280623649
1494042491850571778,tránsito,palabras clave,"Bruselas y Av México, colonia del Carmen Coyoacan, estorbando muy a gusto en doble fila, entre las obras y los estacionados sobre av México a pesar del los discos de prohibido @Alcaldia_Coy @UCS_GCDMX @transito_CDMX diario es lo mismo meta trabajen https://t.co/Ndo6DnPfgq","['brusela', 'av', 'méxico', 'colonia', 'carmen', 'colocar', 'estirar', 'gusto', 'doble', 'fila', 'obra', 'estacionado', 'av', 'méxico', 'pesar', 'disco', 'prohibido', 'diario', 'mismo', 'meta', 'trabajar']",[],"['Alcaldia_Coy', 'UCS_GCDMX', 'transito_CDMX']",3,2,1,194382133,ⓋⒺⓇⓄⓃⒾⒸⒶ,Doti2376,2010-09-23 18:20:01,0,308,763,2022-02-16 14:14:22,2022,02,16,14,14,3,Coyoacán,-99.1503763525,19.3266672536
1494055517932634123,tránsito,coordenadas,"@DenunciasCDMX10 @OVIALCDMX @UCS_GCDMX Seguimos igual, el cuerpo de tránsito no se ha presentado...","['seguir', 'igual', 'cuerpo', 'tránsito', 'presentado']",[],"['DenunciasCDMX10', 'OVIALCDMX', 'UCS_GCDMX']",1,1,0,714165945783070720,Víctor Tovar García,VTovargarcia,2016-03-27 13:03:24,0,5,63,2022-02-16 15:06:08,2022,02,16,15,06,16,Miguel Hidalgo,-99.180678,19.444937
1494056922424778757,tránsito,palabras clave,"En la dirección #Kepler, #Anzures,  #Miguel #Hidalgo un vehículo de la #CruzRojaMexicana atiende un #accidente de #tránsito, evita esas vialidades https://t.co/FnqwxTy0OD","['dirección', 'vehículo', 'atender', 'evitar', 'vialidad']","['Kepler', 'Anzures', 'Miguel', 'Hidalgo', 'CruzRojaMexicana', 'accidente', 'tránsito']",[],1,0,1,476050170,Cruz Roja CDMX,CruzRoja_CDMX,2012-01-27 12:27:33,0,43836,370,2022-02-16 15:11:43,2022,02,16,15,11,16,Miguel Hidalgo,-99.2045669144,19.4280623649
1494057201392095235,incendio,palabras clave,"¡Ojo! Servicios de emergencia se aproximan a la colonia La Laguna Ticomán, alcaldía Gustavo A. Madero por un #incendio en casa habitación.","['ojo', 'servicio', 'emergencia', 'aproximar', 'colonia', 'laguna', 'ticomán', 'alcaldía', 'gustavo', 'madero', 'casa', 'habitación']",['incendio'],[],4,0,2,40098528,Radio Tráfico Total,trafico889,2009-05-14 16:06:13,1,899098,70,2022-02-16 15:12:49,2022,02,16,15,12,5,Gustavo A. Madero,-99.1158642087,19.5040652077
1494057631832498180,tránsito,palabras clave,"Transito lento en Viaducto Miguel Alemán dirección Poniente desde H Congreso de la Union a Calzada de Tlalpan.

#ApoyoVial https://t.co/4OpeXCssYr","['transito', 'lento', 'viaducto', 'miguel', 'alemán', 'dirección', 'poniente', 'congreso', 'union', 'calzado', 'tlalpan']",['ApoyoVial'],[],1,0,0,1429847377393954818,ApoyoVial,InfotrafficMX,2021-08-23 10:47:47,0,2268,4977,2022-02-16 15:14:32,2022,02,16,15,14,12,Tlalpan,-99.2062207957,19.1983396763
1494062946145742850,tránsito,coordenadas,@OVIALCDMX @OVIALCDMX  caos de franelero. En elmcruce de Fco. Javier Clavijero y calle chimalpopoca. Franelero pone conos impidiendo el tránsito y por dejar pasar pide cooperación. Favor de proceder  con forme a reglamento.por afectación de vías.  Alc. Cuauhtemoc https://t.co/g71IAwaNzX,"['cao', 'franelero', 'elmcrucir', 'fco', 'javier', 'clavijero', 'calle', 'chimalpopoca', 'franelero', 'poner', 'cono', 'impedir', 'tránsito', 'dejar', 'pasar', 'pedir', 'cooperación', 'favor', 'proceder', 'formar', 'reglamento', 'afectación', 'vía', 'alc', 'cuauhtemoc']",[],"['OVIALCDMX', 'OVIALCDMX']",0,3,0,887331528958672896,Roberto Rodriguez,Tremendo69latas,2017-07-18 09:21:37,0,22,591,2022-02-16 15:35:39,2022,02,16,15,35,16,Miguel Hidalgo,-99.1843501,19.3998346
1494074407198892039,tránsito,palabras clave,"Estamos atendiendo en #CruzRojaMexicana un #accidente de #tránsito en  #Gomez #Farias,  #Carlos A. #Madrazo,  #Álvaro #Obregón extrema precacuciones al pasar por ese lugar https://t.co/cFEDk3P5SH","['atender', 'extremo', 'precaución', 'pasar', 'lugar']","['CruzRojaMexicana', 'accidente', 'tránsito', 'Gomez', 'Farias', 'Carlos', 'Madrazo', 'Álvaro', 'Obregón']",[],0,0,0,476050170,Cruz Roja CDMX,CruzRoja_CDMX,2012-01-27 12:27:33,0,43836,370,2022-02-16 16:21:11,2022,02,16,16,21,10,Álvaro Obregón,-99.246819712,19.336175562
1494076117866659850,tránsito,palabras clave,"#CruzRojaMexicana está atendiendo un #accidente de #tránsito en  #Marina #Nacional,  #Mariano #Escobedo,  #Miguel #Hidalgo con una #ambulancia donada con tus aportaciones https://t.co/oVzIeqTlgc","['atender', 'donado', 'aportación']","['CruzRojaMexicana', 'accidente', 'tránsito', 'Marina', 'Nacional', 'Mariano', 'Escobedo', 'Miguel', 'Hidalgo', 'ambulancia']",[],0,0,0,476050170,Cruz Roja CDMX,CruzRoja_CDMX,2012-01-27 12:27:33,0,43836,370,2022-02-16 16:27:59,2022,02,16,16,27,16,Miguel Hidalgo,-99.2045669144,19.4280623649
1494076179757817858,tránsito,palabras clave,"Personal de la #CruzRojaMexicana auxilian a un paciente en  #Jaime #Torres #Bodet,  #Santa #María la #Ribera, #Cuauhtémoc debido a un #accidente de #tránsito https://t.co/uqpnZvS3G4","['personal', 'auxiliar', 'paciente', 'debido']","['CruzRojaMexicana', 'Jaime', 'Torres', 'Bodet', 'Santa', 'María', 'Ribera', 'Cuauhtémoc', 'accidente', 'tránsito']",[],0,0,0,476050170,Cruz Roja CDMX,CruzRoja_CDMX,2012-01-27 12:27:33,0,43836,370,2022-02-16 16:28:14,2022,02,16,16,28,15,Cuauhtémoc,-99.1490557562,19.4313734294
1494076205364043784,tránsito,palabras clave,"En la dirección  #Ferrocarril #Central, #Cosmopolita, #Azcapotzalco un vehículo de la #CruzRojaMexicana atiende un #accidente de #tránsito, evita esas vialidades https://t.co/SgvM629HUH","['dirección', 'vehículo', 'atender', 'evitar', 'vialidad']","['Ferrocarril', 'Central', 'Cosmopolita', 'Azcapotzalco', 'CruzRojaMexicana', 'accidente', 'tránsito']",[],0,0,0,476050170,Cruz Roja CDMX,CruzRoja_CDMX,2012-01-27 12:27:33,0,43836,370,2022-02-16 16:28:20,2022,02,16,16,28,2,Azcapotzalco,-99.1821069423,19.4853286147
1494078945213521922,tránsito,palabras clave,"Personal de la #CruzRojaMexicana auxilian a un paciente en  #Avenida #Central, #Pro-Hogar, #Azcapotzalco debido a un #accidente de #tránsito https://t.co/hiCjc0pNR0","['personal', 'auxiliar', 'paciente', 'debido']","['CruzRojaMexicana', 'Avenida', 'Central', 'Pro-Hogar', 'Azcapotzalco', 'accidente', 'tránsito']",[],1,0,1,476050170,Cruz Roja CDMX,CruzRoja_CDMX,2012-01-27 12:27:33,0,43836,370,2022-02-16 16:39:13,2022,02,16,16,39,2,Azcapotzalco,-99.1821069423,19.4853286147
1494080123922006021,tránsito,palabras clave,@Claudiashein @ecobici Por qué sobre Av del imán y aztecas esto cerca de tu parque la cantera en Coyoacán no haces una ciclovía a pero que tal dejas poner mercado desde el jueves a domingo carros en triple fila y sobre la Av principal pasan los de tránsito y les dan su lana,"['av', 'imán', 'azteca', 'cerca', 'parque', 'cantera', 'coyoacán', 'hacer', 'ciclovía', 'tal', 'dejar', 'poner', 'mercado', 'jueves', 'domingo', 'carro', 'triple', 'fila', 'av', 'principal', 'pasar', 'tránsito', 'dar', 'lana']",[],"['Claudiashein', 'ecobici']",0,0,0,3194798240,Carmona,carmonato41,2015-05-13 18:42:44,0,3,36,2022-02-16 16:43:54,2022,02,16,16,43,3,Coyoacán,-99.1503763525,19.3266672536
1494081799919587328,tránsito,palabras clave,"@Tremendo69latas @OVIALCDMX En atención a su reporte personal de tránsito realizó cortes de circulación, debido a la manifestación de habitantes de la alcaldía Xochimilco, normalizando las vialidades. https://t.co/xsj6HglJjy","['atención', 'reporte', 'personal', 'tránsito', 'realizar', 'corte', 'circulación', 'debido', 'manifestación', 'habitant', 'alcaldía', 'xochimilco', 'normalizado', 'vialidad']",[],"['Tremendo69latas', 'OVIALCDMX']",0,1,0,172346252,Unidad de Contacto del Secretario SSC CDMX,UCS_GCDMX,2010-07-29 07:52:54,1,674364,93,2022-02-16 16:50:34,2022,02,16,16,50,13,Xochimilco,-99.0903636045,19.2451450458
1494098275695267841,tránsito,palabras clave,"En la dirección  #Circuito #Interior,  San #Rafael, #Cuauhtémoc un vehículo de la #CruzRojaMexicana atiende un #accidente de #tránsito, evita esas vialidades https://t.co/HMJOcVzvAY","['dirección', 'san', 'vehículo', 'atender', 'evitar', 'vialidad']","['Circuito', 'Interior', 'Rafael', 'Cuauhtémoc', 'CruzRojaMexicana', 'accidente', 'tránsito']",[],0,0,0,476050170,Cruz Roja CDMX,CruzRoja_CDMX,2012-01-27 12:27:33,0,43836,370,2022-02-16 17:56:02,2022,02,16,17,56,15,Cuauhtémoc,-99.1490557562,19.4313734294
1494098334772084736,tránsito,palabras clave,"Estamos atendiendo en #CruzRojaMexicana un #accidente de #tránsito en  #Antigua #Calzada de #Guadalupe,  San #Marcos, #Azcapotzalco extrema precacuciones al pasar por ese lugar https://t.co/9qucUDDYZK","['atender', 'san', 'extremo', 'precaución', 'pasar', 'lugar']","['CruzRojaMexicana', 'accidente', 'tránsito', 'Antigua', 'Calzada', 'Guadalupe', 'Marcos', 'Azcapotzalco']",[],0,0,0,476050170,Cruz Roja CDMX,CruzRoja_CDMX,2012-01-27 12:27:33,0,43836,370,2022-02-16 17:56:16,2022,02,16,17,56,2,Azcapotzalco,-99.1821069423,19.4853286147
1494119991410581504,tránsito,palabras clave,"#CruzRojaMexicana está atendiendo un #accidente de #tránsito en  #Congreso de la #Union,  #Granjas #Modernas,  #Gustavo A. #Madero con una #ambulancia donada con tus aportaciones https://t.co/zbTI8tdbkM","['atender', 'donado', 'aportación']","['CruzRojaMexicana', 'accidente', 'tránsito', 'Congreso', 'Union', 'Granjas', 'Modernas', 'Gustavo', 'Madero', 'ambulancia']",[],1,0,1,476050170,Cruz Roja CDMX,CruzRoja_CDMX,2012-01-27 12:27:33,0,43841,370,2022-02-16 19:22:20,2022,02,16,19,22,5,Gustavo A. Madero,-99.1158642087,19.5040652077
1494122459011952643,tránsito,palabras clave,Se reportan largas filas de vehículos tras el aparatoso accidente de tránsito que se produjo en la ruta Interamericana esta tarde. Video: @WilderLSoy502 https://t.co/IajuybGYVL,"['reportar', 'larga', 'fila', 'vehículo', 'tras', 'aparatoso', 'accidente', 'tránsito', 'producir', 'ruta', 'interamericán', 'tarde', 'video']",[],['WilderLSoy502'],0,0,1,349838281,Verónica Gamboa,VC_gamboa,2011-08-06 13:48:05,0,1513,694,2022-02-16 19:32:08,2022,02,16,19,32,17,Venustiano Carranza,-99.0931057959,19.4304954545
1494125556635516935,tránsito,palabras clave,"Al transitar por  Av dr #Carlos #Lazo,  #Santa Fe #Tlayapaca,  #Álvaro #Obregón encontrarás un #accidente de #tránsito atendido por #CruzRojaMexicana, ten cuidado y disminuye tu velocidad  https://t.co/bKD2W3SoVz","['transitar', 'av', 'dr', 'fe', 'encontrarás', 'atendido', 'ten', 'cuidado', 'disminuir', 'velocidad']","['Carlos', 'Lazo', 'Santa', 'Tlayapaca', 'Álvaro', 'Obregón', 'accidente', 'tránsito', 'CruzRojaMexicana']",[],2,0,1,476050170,Cruz Roja CDMX,CruzRoja_CDMX,2012-01-27 12:27:33,0,43836,370,2022-02-16 19:44:26,2022,02,16,19,44,10,Álvaro Obregón,-99.246819712,19.336175562
1494158976447135745,tránsito,palabras clave,"Una #ambulancia de la #CruzRojaMexicana labora atendiendo a un paciente herido por un #accidente de #tránsito en #Polvora,  #Liberales de #1857,  #Álvaro #Obregón https://t.co/J4nZph1JWw","['laborar', 'atender', 'paciente', 'herido']","['ambulancia', 'CruzRojaMexicana', 'accidente', 'tránsito', 'Polvora', 'Liberales', '1857', 'Álvaro', 'Obregón']",[],1,0,1,476050170,Cruz Roja CDMX,CruzRoja_CDMX,2012-01-27 12:27:33,0,43836,370,2022-02-16 21:57:14,2022,02,16,21,57,10,Álvaro Obregón,-99.246819712,19.336175562
1494174575785041921,tránsito,palabras clave,"Al transitar por  Eje 2 #Norte, #Tlatilco, #Azcapotzalco encontrarás un #accidente de #tránsito atendido por #CruzRojaMexicana, ten cuidado y disminuye tu velocidad  https://t.co/RrWLGJaYR2","['transitar', 'eje', 'encontrarás', 'atendido', 'ten', 'cuidado', 'disminuir', 'velocidad']","['Norte', 'Tlatilco', 'Azcapotzalco', 'accidente', 'tránsito', 'CruzRojaMexicana']",[],3,0,0,476050170,Cruz Roja CDMX,CruzRoja_CDMX,2012-01-27 12:27:33,0,43836,370,2022-02-16 22:59:13,2022,02,16,22,59,2,Azcapotzalco,-99.1821069423,19.4853286147
1494181374361808897,tránsito,palabras clave,"Personal de la #CruzRojaMexicana auxilian a un paciente en  #Insurgentes #Norte, #Vallejo,  #Gustavo A. #Madero debido a un #accidente de #tránsito https://t.co/zLd3ugqCT5","['personal', 'auxiliar', 'paciente', 'debido']","['CruzRojaMexicana', 'Insurgentes', 'Norte', 'Vallejo', 'Gustavo', 'Madero', 'accidente', 'tránsito']",[],1,0,0,476050170,Cruz Roja CDMX,CruzRoja_CDMX,2012-01-27 12:27:33,0,43841,370,2022-02-16 23:26:14,2022,02,16,23,26,5,Gustavo A. Madero,-99.1158642087,19.5040652077
1494220216531918849,tránsito,palabras clave,"Un #accidente de #tránsito en #Nogal,  #Santa #María la #Ribera, #Cuauhtémoc fue reportado a la #CruzRojaMexicana, te recomendamos tener cuidado al transitar en esa zona https://t.co/3OFfShFdLB","['reportar', 'recomendar', 'tener', 'cuidado', 'transitar', 'zona']","['accidente', 'tránsito', 'Nogal', 'Santa', 'María', 'Ribera', 'Cuauhtémoc', 'CruzRojaMexicana']",[],0,0,0,476050170,Cruz Roja CDMX,CruzRoja_CDMX,2012-01-27 12:27:33,0,43836,370,2022-02-17 02:00:35,2022,02,17,02,00,15,Cuauhtémoc,-99.1490557562,19.4313734294
1494298157899038720,tránsito,palabras clave,"Una #ambulancia de #CruzRojaMexicana está atendiendo un #accidente de #tránsito en  #Calz #Santo #Tomas,  #Santo #Tomás, #Azcapotzalco extrema precauciones al pasar por ese lugar https://t.co/xzZgldPLHO","['atender', 'extremo', 'precaución', 'pasar', 'lugar']","['ambulancia', 'CruzRojaMexicana', 'accidente', 'tránsito', 'Calz', 'Santo', 'Tomas', 'Santo', 'Tomás', 'Azcapotzalco']",[],1,0,0,476050170,Cruz Roja CDMX,CruzRoja_CDMX,2012-01-27 12:27:33,0,43836,370,2022-02-17 07:10:18,2022,02,17,07,10,2,Azcapotzalco,-99.1821069423,19.4853286147
1494307062951682055,tránsito,coordenadas,Urge qué si manejas un automóvil leas el reglamento de tránsito!!! https://t.co/SfPC71ZDaZ,"['urgir', 'si', 'manera', 'automóvil', 'leas', 'reglamento', 'tránsito']",[],[],1,0,1,475304940,ⓜⓘⓢⓢ ⓥⓐⓛⓐ 💫,Sputniklagata,2012-01-26 16:29:02,0,795,410,2022-02-17 07:45:41,2022,02,17,07,45,10,Álvaro Obregón,-99.1919955,19.357102
1494313443557523459,tránsito,palabras clave,"Al transitar por  #Calz #Santo #Tomas,  #Santo #Tomás, #Azcapotzalco encontrarás un #accidente de #tránsito atendido por #CruzRojaMexicana, ten cuidado y disminuye tu velocidad  https://t.co/xzZgldPLHO","['transitar', 'encontrarás', 'atendido', 'ten', 'cuidado', 'disminuir', 'velocidad']","['Calz', 'Santo', 'Tomas', 'Santo', 'Tomás', 'Azcapotzalco', 'accidente', 'tránsito', 'CruzRojaMexicana']",[],0,0,0,476050170,Cruz Roja CDMX,CruzRoja_CDMX,2012-01-27 12:27:33,0,43836,370,2022-02-17 08:11:02,2022,02,17,08,11,2,Azcapotzalco,-99.1821069423,19.4853286147
1494313473215504397,tránsito,palabras clave,"Una #ambulancia de #CruzRojaMexicana está atendiendo un #accidente de #tránsito en  #Gobernador #Agustin #Vicente #Eguia,  San #Miguel #Chapultepec I #Sección,  #Miguel #Hidalgo extrema precauciones al pasar por ese lugar https://t.co/QP8ZFYSiyb","['atender', 'san', 'extremo', 'precaución', 'pasar', 'lugar']","['ambulancia', 'CruzRojaMexicana', 'accidente', 'tránsito', 'Gobernador', 'Agustin', 'Vicente', 'Eguia', 'Miguel', 'Chapultepec', 'Sección', 'Miguel', 'Hidalgo']",[],0,0,0,476050170,Cruz Roja CDMX,CruzRoja_CDMX,2012-01-27 12:27:33,0,43836,370,2022-02-17 08:11:09,2022,02,17,08,11,16,Miguel Hidalgo,-99.2045669144,19.4280623649
1494317103876386821,tránsito,palabras clave,"Una #ambulancia de #CruzRojaMexicana está atendiendo un #accidente de #tránsito en  #Lomas de #Virreyes,  #Lomas de #Chapultepec I #Sección,  #Miguel #Hidalgo extrema precauciones al pasar por ese lugar https://t.co/TthmCIXCJx","['atender', 'extremo', 'precaución', 'pasar', 'lugar']","['ambulancia', 'CruzRojaMexicana', 'accidente', 'tránsito', 'Lomas', 'Virreyes', 'Lomas', 'Chapultepec', 'Sección', 'Miguel', 'Hidalgo']",[],0,0,0,476050170,Cruz Roja CDMX,CruzRoja_CDMX,2012-01-27 12:27:33,0,43836,370,2022-02-17 08:25:35,2022,02,17,08,25,16,Miguel Hidalgo,-99.2045669144,19.4280623649
1494317603636006914,tránsito,palabras clave,"#CruzRojaMexicana está atendiendo un #accidente de #tránsito en  #Insurgentes #Norte, #Atlampa, #Cuauhtémoc con una #ambulancia donada con tus aportaciones https://t.co/zDUyB4otRC","['atender', 'donado', 'aportación']","['CruzRojaMexicana', 'accidente', 'tránsito', 'Insurgentes', 'Norte', 'Atlampa', 'Cuauhtémoc', 'ambulancia']",[],1,0,0,476050170,Cruz Roja CDMX,CruzRoja_CDMX,2012-01-27 12:27:33,0,43836,370,2022-02-17 08:27:34,2022,02,17,08,27,15,Cuauhtémoc,-99.1490557562,19.4313734294
