pubID,topicQuery,typeQuery,tweet,tokens,hashtags,mentions,likeCount,replyCount,retweetCount,authorID,authorName,authorUsername,authorCreatedAt,authorVerified,followersCount,followingCount,pubDate,pubYear,pubMonth,pubDay,pubHour,pubMinute,geoID,geoName,longitude,latitude
1231717406680211458,tránsito,palabras clave,"Al corralón fueron remitidos tres vehículos por parte de agentes de tránsito de la Secretaría de Seguridad Ciudadana
https://t.co/oO1cV5bu3b","['corazón', 'remitido', 'tres', 'vehículo', 'parte', 'agente', 'tránsito', 'secretacer', 'seguridad', 'ciudadano']",[],[],0,0,0,1011325648735031296,Diario Benito Juarez,ddmexico_bj,2018-06-25 13:09:58,0,5331,1555,2020-02-23 17:08:08,2020,02,23,17,08,14,Benito Juárez,-99.1611346584,19.3806424162
1231723793414004737,incendio,palabras clave,"#AlMomento Se atiende reporte de incendio de motocicleta en Av. 5 de Febrero, a la altura del Acceso 4 en la zona industrial Benito Juárez (Tremec), con dirección a la #CDMX #PCEnElLugar #TomePrecauciones Se registra cierre de carriles centrales en la zona @BomberosQro @poesqro https://t.co/PFJkSKsrAV","['atender', 'reporte', 'incendio', 'motocicleta', 'av', 'febrero', 'altura', 'acceso', 'zona', 'industrial', 'benito', 'juarez', 'treme', 'dirección', 'registrar', 'cerrar', 'carril', 'central', 'zona']","['AlMomento', 'CDMX', 'PCEnElLugar', 'TomePrecauciones']","['BomberosQro', 'poesqro']",4,0,5,326307838,Coordinación de Protección Civil del Estado de Qro,PCIVILQRO,2011-06-29 12:16:34,0,41857,165,2020-02-23 17:33:31,2020,02,23,17,33,14,Benito Juárez,-99.1611346584,19.3806424162
1231727394584698882,incendio,palabras clave,"#Ahora
Bomberos de Querétaro y elementos de Protección Civil atienden el incendio de una motocicleta que se accidentó en la avenida 5 de Febrero, a la altura del Acceso 4 de la zona industrial Benito Juárez. Los carriles centrales están cerrados por el percance.

📸 @BomberosQro https://t.co/SaVs8TGzCy","['bombero', 'queretaro', 'elementos', 'protección', 'civil', 'atender', 'incendio', 'motocicleta', 'accidentó', 'avenido', 'febrero', 'altura', 'acceso', 'zona', 'industrial', 'benito', 'juarez', 'carril', 'central', 'cerrado', 'percance']",['Ahora'],['BomberosQro'],0,0,0,531792549,Tiempo Santa Rosa,tiemposrj,2012-03-20 16:44:41,0,1407,734,2020-02-23 17:47:49,2020,02,23,17,47,14,Benito Juárez,-100.5963431,20.5031701
1231730898955096064,incendio,palabras clave,"#Precaución Servicios de emergencia se dirigen a atender 🔥 incendio de pastizal en la colonia Buenavista, @Alc_Iztapalapa. Ante cualquier emergencia 📞 llama al #911CDMX. #C5 https://t.co/ZXciKmccDS","['servicio', 'emergencio', 'dirigir', 'atender', 'incendio', 'pastizal', 'colonio', 'buenavista', 'cualquiera', 'emergencia', 'llamar']","['Precaución', '911CDMX', 'C5']",['Alc_Iztapalapa'],7,0,2,195951901,C5 CDMX,C5_CDMX,2010-09-27 17:51:04,1,947207,760,2020-02-23 18:01:45,2020,02,23,18,01,7,Iztapalapa,-99.0567989642,19.3491663204
1231732170852458498,incendio,palabras clave,"¡Toma en cuenta! Por el incendio de pastizal en la colonia Buenavista de la alcaldía Iztapalapa, servicios de emergencia se dirigen al lugar.","['tomar', 'contar', 'incendio', 'pastizal', 'colonia', 'buenavista', 'alcaldía', 'iztapalapa', 'servicio', 'emergencio', 'dirigir', 'lugar']",[],[],3,0,1,40098528,Radio Tráfico Total,trafico889,2009-05-14 16:06:13,1,899098,70,2020-02-23 18:06:48,2020,02,23,18,06,7,Iztapalapa,-99.0567989642,19.3491663204
1231737094873190400,incendio,palabras clave,"#CedeElPaso 🚒 Servicios de emergencia se aproximan para trabajar por incendio de pastizal, colonia Ampliación Santa Catarina, @Alc_Tlahuac.  #C5  #911CDMX","['servicio', 'emergencia', 'aproximar', 'trabajar', 'incendio', 'pastizal', 'colonio', 'ampliación', 'santa', 'catarina']","['CedeElPaso', 'C5', '911CDMX']",['Alc_Tlahuac'],6,0,1,195951901,C5 CDMX,C5_CDMX,2010-09-27 17:51:04,1,947207,760,2020-02-23 18:26:22,2020,02,23,18,26,11,Tláhuac,-99.0028216137,19.2769983772
1231739221091569664,incendio,palabras clave,"¡Ojo! Se registra un #incendio de pastizal en la colonia Ampliación Santa Catarina de la alcaldía Tláhuac, al lugar ya acuden los servicios de emergencia.","['ojo', 'registrar', 'pastizal', 'colonio', 'ampliación', 'santa', 'catarina', 'alcaldío', 'tláhuac', 'lugar', 'acudir', 'servicio', 'emergencio']",['incendio'],[],6,0,1,40098528,Radio Tráfico Total,trafico889,2009-05-14 16:06:13,1,899098,70,2020-02-23 18:34:49,2020,02,23,18,34,11,Tláhuac,-99.0028216137,19.2769983772
1231748699438682112,tránsito,palabras clave,"@Claudiashein @ClaraBrugadaM @Alc_Iztapalapa En centro de Iztapalapa un cochinero sin orden disminución del tránsito de autos por estacionados en triple fila,  como si estuviera en un país de Asia allá en Afganistán o el Salvador, H O R R O R O S O!","['centro', 'iztapalapa', 'cocinero', 'orden', 'disminución', 'tránsito', 'auto', 'estacionado', 'triple', 'fila', 'si', 'país', 'asia', 'allá', 'afganistan', 'salvador']",[],"['Claudiashein', 'ClaraBrugadaM', 'Alc_Iztapalapa']",0,0,0,1235670410,"Galeno forever,",moon_doc,2013-03-02 12:02:41,0,99,349,2020-02-23 19:12:29,2020,02,23,19,12,7,Iztapalapa,-99.0567989642,19.3491663204
1231754410247610368,incendio,palabras clave,"¡Cuidado! Se registra un #incendio de pastizal en la colonia Centro Santa Fe de la alcaldía Álvaro Obregón, al lugar ya acuden los servicios de emergencia.","['cuidado', 'registrar', 'pastizal', 'colonia', 'centro', 'santo', 'fe', 'alcaldía', 'alvaro', 'obregon', 'lugar', 'acudir', 'servicio', 'emergencio']",['incendio'],[],4,0,0,40098528,Radio Tráfico Total,trafico889,2009-05-14 16:06:13,1,899098,70,2020-02-23 19:35:10,2020,02,23,19,35,10,Álvaro Obregón,-99.246819712,19.336175562
1231755730274775041,pirotecnia,palabras clave,"¿Qué pasa con la pirotecnia en #Cuajimalpa? Hasta se cimbran las ventanas. ¿No basta con la explosión que sucedió hoy mismo? Tenemos que ser más conscientes todos. Contaminación auditiva, visual, del aire, y las tragedias que su mal manejo conlleva.","['pasar', 'pirotecnia', 'cambiir', 'ventana', 'bastar', 'explosión', 'suceder', 'hoy', 'mismo', 'ser', 'consciente', 'contaminación', 'auditivo', 'visual', 'aire', 'tragedia', 'mal', 'manejo', 'conllevar']",['Cuajimalpa'],[],60,7,18,304060350,Mar Ártico,mgao71,2011-05-23 15:26:51,0,11470,8650,2020-02-23 19:40:25,2020,02,23,19,40,4,Cuajimalpa de Morelos,-99.3107285253,19.3246343001
1231795562019786752,incendio,palabras clave,San Clemente San Agustín Álvaro Obregón @Bomberos_CDMX incendio en pastizales ayuda por favor @HCB__CDMX @BomberosDFNoOf,"['san', 'clemente', 'san', 'agustin', 'alvaro', 'obregon', 'incendio', 'pastizales', 'ayudar', 'favor']",[],"['Bomberos_CDMX', 'HCB__CDMX', 'BomberosDFNoOf']",1,1,0,1099494600069255169,edmundoolivares,edmundoolivare6,2019-02-23 20:21:55,0,1116,4999,2020-02-23 22:18:42,2020,02,23,22,18,10,Álvaro Obregón,-99.246819712,19.336175562
1231809704151486466,incendio,coordenadas,"@SEDEMA_CDMX 
@SeGobCDMX 
@SEGOB_mx 

Buena noche disculpe quisiera hacer un reporte respecto a unos hoyos en el suelo con profubdidades de 10cm de alto y 30 cm de largo. 

Delegación: COYOACÁN
CIUDAD DE MEXICO.
MEXICO
Colonia:LA OTRA BANDA
Calle:AV. SAN JERÓNIMO con calle:FUEGO https://t.co/wFlRfIIMQL","['buen', 'noche', 'disculpar', 'querer', 'hacer', 'reporte', 'respecto', 'hoyo', 'suelo', 'profundidad', '10', 'cm', 'alto', '30', 'cm', 'largo', 'delegación', 'coyoacánciudad', 'mexico', 'mexicocolonia', 'bandacalle', 'av', 'san', 'jerónimo', 'calle', 'fuego']",[],"['SEDEMA_CDMX', 'SeGobCDMX', 'SEGOB_mx']",0,0,0,3171435475,Juan Daniel Alejandre Peláez - Y'HAX.,Nitewing9410,2015-04-24 17:23:05,0,155,525,2020-02-23 23:14:54,2020,02,23,23,14,10,Álvaro Obregón,-99.1982448,19.3334006
1231834911167795200,tránsito,coordenadas,"00:54 #PrecauciónVial | Choque en Calz. Ignacio Zaragoza circulación Poniente a la altura de Circuito Interior, colonia Ignacio Zaragoza, alcaldía Venustiano Carranza, servicios de emergencia laboran en el lugar. #AlternativaVial carriles laterales de Calz. Ignacio Zaragoza. https://t.co/BpHktDrh8d","['00', '54', 'choque', 'call', 'ignacio', 'zaragoza', 'circulación', 'poniente', 'altura', 'circuito', 'interior', 'colonia', 'ignacio', 'zaragoza', 'alcaldía', 'venustiano', 'carranza', 'servicios', 'emergencio', 'laborar', 'lugar', 'carril', 'lateral', 'call', 'ignacio', 'zaragoza']","['PrecauciónVial', 'AlternativaVial']",[],3,0,2,166594238,OVIAL_SSCCDMX,OVIALCDMX,2010-07-14 09:00:43,1,1942069,135,2020-02-24 00:55:03,2020,02,24,00,55,16,Miguel Hidalgo,-99.1843501,19.3998346
1231866282829582336,tránsito,palabras clave,@UCS_GCDMX @C5_CDMX @OVIALCDMX @SSP_CDMX @Alcaldia_BJ @denuncias99cdmx @BJAlcaldia @_Narvarte para pedir el apoyo de una patrulla por accidente de tránsito en Eje Central Lázaro Cárdenas y Av Universidad Col Narvarte,"['pedir', 'apoyo', 'patrulla', 'accidente', 'tránsito', 'eje', 'central', 'lazaro', 'cardenas', 'av', 'universidad', 'col', 'narvarte']",[],"['UCS_GCDMX', 'C5_CDMX', 'OVIALCDMX', 'SSP_CDMX', 'Alcaldia_BJ', 'denuncias99cdmx', 'BJAlcaldia', '_Narvarte']",1,3,0,870983563981737984,Ruben Garcia,RubenGa69065552,2017-06-03 06:40:38,0,368,1330,2020-02-24 02:59:43,2020,02,24,02,59,14,Benito Juárez,-99.1611346584,19.3806424162
1231929475690061824,tránsito,palabras clave,"#Entérate | Se aprueba el primer Reglamento de Tránsito de Puerto Morelos, que dejará sin validez al de Benito Juárez que se aplicaba de manera supletoria.

https://t.co/0JEWC5x2ds","['aprobar', 'primero', 'reglamento', 'tránsito', 'puerto', 'morelos', 'dejar', 'validez', 'benito', 'juarez', 'aplicar', 'manera', 'supletorio']",['Entérate'],[],0,0,1,78941660,Turquesa News,infoturquesa,2009-10-01 10:18:17,0,13637,453,2020-02-24 07:10:49,2020,02,24,07,10,14,Benito Juárez,-99.1611346584,19.3806424162
1231933098033442820,incendio,palabras clave,"07:25 #PrecauciónVial | Servicios de emergencia por incendio en Av. Arcos del Belén y Luis Moya, col. Centro, alcaldía Cuauhtémoc. #AlternativaVial Calle Dr Liceaga y Av. Balderas.","['07', '25', 'servicio', 'emergencio', 'incendio', 'av', 'arco', 'belén', 'luis', 'moya', 'col', 'centro', 'alcaldía', 'cuauhtemoc', 'calle', 'dr', 'lineata', 'av', 'bandera']","['PrecauciónVial', 'AlternativaVial']",[],1,0,3,166594238,OVIAL_SSCCDMX,OVIALCDMX,2010-07-14 09:00:43,1,1942069,135,2020-02-24 07:25:13,2020,02,24,07,25,15,Cuauhtémoc,-99.1490557562,19.4313734294
1231933760821747717,incendio,palabras clave,"#CedeElPaso ⚠️🚒 Servicios de emergencia se aproximan para trabajar por incendio de casa habitación en la colonia Ampliación Miguel Hidalgo, @TlalpanAl. #911CDMX #C5 https://t.co/Jr0wE6xdjR","['servicio', 'emergencia', 'aproximar', 'trabajar', 'incendio', 'casa', 'habitación', 'colonia', 'ampliación', 'miguel', 'hidalgo']","['CedeElPaso', '911CDMX', 'C5']",['TlalpanAl'],4,0,6,195951901,C5 CDMX,C5_CDMX,2010-09-27 17:51:04,1,947207,760,2020-02-24 07:27:51,2020,02,24,07,27,16,Miguel Hidalgo,-99.2045669144,19.4280623649
1231939010106404864,incendio,palabras clave,"#EvitaLaZona ⚠️🚒 Servicios de emergencia se encuentran trabajando por incendio de casa habitación en la colonia Ampliación Miguel Hidalgo, @TlalpanAl. Ante cualquier emergencia comunícate 📱 al #911CDMX.  #C5","['servicio', 'emergencio', 'encontrar', 'trabajar', 'incendio', 'casa', 'habitación', 'colonia', 'ampliación', 'miguel', 'hidalgo', 'cualquiera', 'emergencia', 'comunicante']","['EvitaLaZona', '911CDMX', 'C5']",['TlalpanAl'],18,1,7,195951901,C5 CDMX,C5_CDMX,2010-09-27 17:51:04,1,947207,760,2020-02-24 07:48:42,2020,02,24,07,48,16,Miguel Hidalgo,-99.2045669144,19.4280623649
1231941311655112704,tránsito,palabras clave,"Tráfico pesado sobre ambos sentidos de #PaseoTollocan desde #CU debido a un accidente a la altura de cervecería Cuauhtémoc Moctezuma con dirección de #México a #Toluca. Extreme precauciones y respete los límites de velocidad.

Fotografía: Karen Colín. https://t.co/sa2YqS696O","['tráfico', 'pesado', 'ambos', 'deber', 'accidente', 'altura', 'cervecería', 'cuauhtemoc', 'moctezuma', 'dirección', 'extreme', 'precaución', 'respetar', 'límite', 'velocidad', 'fotografío', 'karen', 'colon']","['PaseoTollocan', 'CU', 'México', 'Toluca']",[],0,0,1,1037713743788920834,【𝚅𝚒𝚌𝚎𝚟𝚎𝚛𝚜𝚊 𝙽𝚘𝚝𝚒𝚌𝚒𝚊𝚜】®,ViceversaNews,2018-09-06 08:46:51,0,993,624,2020-02-24 07:57:51,2020,02,24,07,57,15,Cuauhtémoc,-99.1490557562,19.4313734294
1231950780367855616,tránsito,palabras clave,"Sra  Claudia dice q  felicita a Clara Brugada por  su informe anual en Iztapalapa , que le felicita? El no control de la delincuencia, el robo de autos, transitó irregular  estacionado en tercera fila , la extorcion a comerciantes por derecho de suelo , es mucha la impunidad","['sra', 'claudia', 'decir', 'felicita', 'claro', 'brigado', 'informe', 'anual', 'iztapalapa', 'felicita', 'control', 'delincuencio', 'robo', 'auto', 'transitar', 'irregular', 'estacionado', 'tercero', 'fila', 'extorsión', 'comerciant', 'derecho', 'suelo', 'mucho', 'impunidad']",[],[],0,0,0,1192445476186009602,Marce,Marce71837655,2019-11-07 08:15:52,0,10,11,2020-02-24 08:35:29,2020,02,24,08,35,7,Iztapalapa,-99.0567989642,19.3491663204
1231951883004194818,incendio,palabras clave,"⭕️🗞️ Se reporta fuerte #incendio frente a #ParkPlaza en #Cuajimalpa
Servicios de emergencia en el lugar https://t.co/7NkyrEjF0A","['reportar', 'fuerte', 'frente', 'servicio', 'emergencio', 'lugar']","['incendio', 'ParkPlaza', 'Cuajimalpa']",[],2,0,1,1127291284404744193,Elizah G.,Elixzh1,2019-05-11 13:16:01,0,246,52,2020-02-24 08:39:52,2020,02,24,08,39,4,Cuajimalpa de Morelos,-99.3107285253,19.3246343001
1231954333962342400,tránsito,coordenadas,"08:50 Oficiales de #Tránsito en dispositivo para inhibir acceso de vehículos sobre carril exclusivo de @Metrobus y agilizar la circulación sobre Av. Hidalgo y Valerio Trujano, col. Centro, alcaldía Cuauhtémoc. #MovilidadCDMX https://t.co/2qWB49e6KB","['08', '50', 'oficial', 'dispositivo', 'inhibir', 'acceso', 'vehículo', 'carril', 'exclusivo', 'agilizar', 'circulación', 'av', 'hidalgo', 'valerio', 'rumano', 'col', 'centro', 'alcaldía', 'cuauhtemoc']","['Tránsito', 'MovilidadCDMX']",['Metrobus'],2,0,0,166594238,OVIAL_SSCCDMX,OVIALCDMX,2010-07-14 09:00:43,1,1942069,135,2020-02-24 08:49:36,2020,02,24,08,49,16,Miguel Hidalgo,-99.1843501,19.3998346
1231955648876691456,tránsito,coordenadas,@C5_CDMX @UCS_GCDMX @SSP_CDMX vehículo en carril de metrobús... en el monumento a la revolución ahí siempre pasa se necesitan unidades de tránsito... ahí están las placas. https://t.co/PMZgY4xsKI,"['vehículo', 'carril', 'metrobús', 'monumento', 'revolución', 'ahí', 'siempre', 'pasar', 'necesitar', 'unidad', 'tránsito', 'ahí', 'placa']",[],"['C5_CDMX', 'UCS_GCDMX', 'SSP_CDMX']",3,1,1,108203556,LUIS VELA,LUISVELA87,2010-01-24 23:21:12,0,90,398,2020-02-24 08:54:49,2020,02,24,08,54,16,Miguel Hidalgo,-99.1843501,19.3998346
1231960922761125888,tránsito,coordenadas,"@A_VCarranza ,@locatel_mx ,@Claudiashein ,es justo son las 09:00 horas y el vehículo placas de circulación H32-AAC,estacionado en la Calle Central de Talabarteros y ahí va la fotografía para que vea el estado deplorable del Parque Infantil el Triangulito basura y otros. https://t.co/8lTGnHjc2t","['justo', '09', '00', 'horas', 'vehículo', 'placa', 'circulación', 'h32-aac', 'estacionado', 'calle', 'central', 'talabartería', 'ahí', 'ir', 'fotografía', 'ver', 'deplorable', 'parque', 'infantil', 'triangulo', 'basura']",[],"['A_VCarranza', 'locatel_mx', 'Claudiashein']",2,1,4,1108489467134992385,Macruz,Macruz76701932,2019-03-20 16:04:18,0,3372,3073,2020-02-24 09:15:47,2020,02,24,09,15,15,Cuauhtémoc,-99.128294,19.4043522
1231968040851427328,tránsito,palabras clave,Tránsito lento sobre Calzada de Tlalpan en dirección al Sur a la altura del metro Portales ⚠️🚗 #MovilidadCDMX,"['tránsito', 'lento', 'calzada', 'tlalpan', 'dirección', 'sur', 'altura', 'metro', 'portal']",['MovilidadCDMX'],[],0,0,0,1944969650,Área Común CDMX,AreaComunCDMX,2013-10-07 13:07:45,0,500,993,2020-02-24 09:44:04,2020,02,24,09,44,12,Tlalpan,-99.2062207957,19.1983396763
1231969054774190080,tránsito,coordenadas,"Sobre la calle Miguel Barragán y Martín Carrera en @TuAlcaldiaGAM se realizan trabajos  de cuidado, sin embargo, obstruyen el paso a los peatones, dificultando el tránsito seguro.

#SeguridadVial
#MovilidadSegura https://t.co/CoanucJ8WJ","['calle', 'miguel', 'barragan', 'martín', 'carrera', 'realizar', 'trabajo', 'cuidado', 'embargo', 'obstruir', 'paso', 'peatón', 'dificultar', 'tránsito', 'seguro']","['SeguridadVial', 'MovilidadSegura']",['TuAlcaldiaGAM'],0,1,0,98934957,Monse Ayala,monseayala_,2009-12-23 12:33:33,0,412,1829,2020-02-24 09:48:06,2020,02,24,09,48,16,Miguel Hidalgo,-99.180678,19.444937
1232009024536637440,incendio,palabras clave,"@maxrick222 Rubén el incendio ocurrió en territorio de la Alcaldía Álvaro Obregón, los servicios de emergencia actuaron rápidamente y gracias a ello no pasó a mayores. Abrazo.","['ruben', 'incendio', 'ocurrir', 'territorio', 'alcaldía', 'alvaro', 'obregon', 'servicio', 'emergencio', 'actuar', 'rápidamente', 'gracias', 'él', 'pasar', 'mayor', 'abrazo']",[],['maxrick222'],1,0,0,103150136,Adrián Rubalcava,AdrianRubalcava,2010-01-08 20:12:31,1,63392,1467,2020-02-24 12:26:55,2020,02,24,12,26,10,Álvaro Obregón,-99.246819712,19.336175562
1232030044454883329,tránsito,palabras clave,"#CruzRojaMexicana está ayudando en un #accidente de #tránsito en Av Vasco de Quiroga, Santa Fe, Álvaro Obregón ten cuidado al pasar por el lugar https://t.co/8cuU4Z74qZ","['ayudar', 'av', 'vasco', 'quiroga', 'santo', 'fe', 'alvaro', 'obregon', 'ten', 'cuidado', 'pasar', 'lugar']","['CruzRojaMexicana', 'accidente', 'tránsito']",[],1,0,0,476050170,Cruz Roja CDMX,CruzRoja_CDMX,2012-01-27 12:27:33,0,43841,370,2020-02-24 13:50:27,2020,02,24,13,50,10,Álvaro Obregón,-99.246819712,19.336175562
1232032450328612864,tránsito,palabras clave,El cabildo de Puerto Morelos en Quintana Roo aprobó el primer Reglamento de Tránsito que de manera automática dejará sin validez al de Benito Juárez. https://t.co/svJcySXKC4,"['cabildo', 'puerto', 'morelos', 'quintana', 'roo', 'aprobar', 'primero', 'reglamento', 'tránsito', 'manera', 'automático', 'dejar', 'validez', 'benito', 'juarez']",[],[],0,0,0,771779820,Central Municipal,Central_CM,2012-08-21 10:10:16,0,34889,24826,2020-02-24 14:00:00,2020,02,24,14,00,14,Benito Juárez,-99.1611346584,19.3806424162
1232049303666995201,incendio,palabras clave,"#CedeElPaso⚠️Servicios de emergencia se dirigen a trabajar en atención a incendio de casa habitación, colonia Barrio La Guadalupe, @Alc_Tlahuac. En caso de emergencia llama de inmediato al #911CDMX #C5 https://t.co/Sw5x3T4yQA","['emergencia', 'dirigir', 'trabajar', 'atención', 'incendio', 'casa', 'habitación', 'colonia', 'barrio', 'guadalupe', 'caso', 'emergencia', 'llamar', 'inmediato']","['CedeElPaso', '911CDMX', 'C5']",['Alc_Tlahuac'],8,0,4,195951901,C5 CDMX,C5_CDMX,2010-09-27 17:51:04,1,947207,760,2020-02-24 15:06:59,2020,02,24,15,06,11,Tláhuac,-99.0028216137,19.2769983772
1232050231983955974,tránsito,palabras clave,"#CruzRojaMexicana está ayudando en un #accidente de #tránsito en Independencia, San Felipe de Jesús, Gustavo A. Madero ten cuidado al pasar por el lugar https://t.co/2gj36LzAdS","['ayudar', 'independencia', 'san', 'felipe', 'jesus', 'gustavo', 'madero', 'ten', 'cuidado', 'pasar', 'lugar']","['CruzRojaMexicana', 'accidente', 'tránsito']",[],3,0,1,476050170,Cruz Roja CDMX,CruzRoja_CDMX,2012-01-27 12:27:33,0,43836,370,2020-02-24 15:10:40,2020,02,24,15,10,5,Gustavo A. Madero,-99.1158642087,19.5040652077
1232055164372242434,incendio,palabras clave,"🚨Servicios de emergencia trabajan por incendio de casa habitación, colonia Barrio La Guadalupe, @Alc_Tlahuac. #911CDMX #C5","['servicio', 'emergencia', 'trabajar', 'incendio', 'casa', 'habitación', 'colonia', 'barrio', 'guadalupe']","['911CDMX', 'C5']",['Alc_Tlahuac'],7,0,4,195951901,C5 CDMX,C5_CDMX,2010-09-27 17:51:04,1,947207,760,2020-02-24 15:30:16,2020,02,24,15,30,11,Tláhuac,-99.0028216137,19.2769983772
1232061706957983744,tránsito,palabras clave,"#CruzRojaMexicana está ayudando en un #accidente de #tránsito en Pueblo Nuevo, Margarita Maza de Juárez, Álvaro Obregón ten cuidado al pasar por el lugar https://t.co/d3MplgyY2g","['ayudar', 'pueblo', 'nuevo', 'margarita', 'maza', 'juarez', 'alvaro', 'obregon', 'ten', 'cuidado', 'pasar', 'lugar']","['CruzRojaMexicana', 'accidente', 'tránsito']",[],2,0,0,476050170,Cruz Roja CDMX,CruzRoja_CDMX,2012-01-27 12:27:33,0,43841,370,2020-02-24 15:56:16,2020,02,24,15,56,10,Álvaro Obregón,-99.246819712,19.336175562
1232063098900688902,tránsito,palabras clave,"Esta tarde, en la explanada principal del edificio Titán de la Secretaría Municipal de Seguridad Pública y Tránsito de Benito Juárez, el gobernador Carlos Joaquín,  junto con la presidenta municipal Mara Lezama, entregará 28 motocicletas y una camioneta PickUp doble cabina con https://t.co/JSP7Y5rXHY","['tarde', 'explanada', 'principal', 'edificio', 'titán', 'secretaría', 'municipal', 'seguridad', 'público', 'tránsito', 'benito', 'juarez', 'gobernador', 'carlos', 'joaquin', 'junto', 'presidenta', 'municipal', 'mara', 'lezama', 'entregar', '28', 'motocicleta', 'camioneto', 'pickup', 'doble', 'cabina']",[],[],0,0,0,1045782446300639234,esergio490,esergio4901,2018-09-28 15:08:59,0,33,195,2020-02-24 16:01:48,2020,02,24,16,01,14,Benito Juárez,-99.1611346584,19.3806424162
1232068904677044224,tránsito,coordenadas,"16:24 Manifestantes cierran la circulación en carriles centrales de Paseo de la  Reforma a la altura de Río Danubio al Poniente, como #AlternativaVial Av. Chapultepec. https://t.co/bXJf77ZbE7","['16', '24', 'manifestante', 'cerrar', 'circulación', 'carril', 'central', 'paseo', 'reforma', 'altura', 'río', 'danubio', 'poniente', 'av', 'chapultepec']",['AlternativaVial'],[],1,0,0,166594238,OVIAL_SSCCDMX,OVIALCDMX,2010-07-14 09:00:43,1,1942069,135,2020-02-24 16:24:52,2020,02,24,16,24,16,Miguel Hidalgo,-99.1843501,19.3998346
1232069981614964738,tránsito,coordenadas,"16:28 #PrecauciónVial | Manifestantes cierran la circulación en ambos sentidos de Av. Tláhuac entre Luis Delgado y el Paso del Conejo. #AlternativaVial Camino Real, Independencia y San Rafael Atlixco. https://t.co/K46N4T9Wcp","['16', '28', 'manifestante', 'cerrar', 'circulación', 'ambos', 'av', 'tláhuac', 'luis', 'delgado', 'paso', 'conejo', 'camino', 'real', 'independencia', 'san', 'rafael', 'aplico']","['PrecauciónVial', 'AlternativaVial']",[],6,1,3,166594238,OVIAL_SSCCDMX,OVIALCDMX,2010-07-14 09:00:43,1,1942061,135,2020-02-24 16:29:09,2020,02,24,16,29,16,Miguel Hidalgo,-99.1843501,19.3998346
1232077200838418433,tránsito,palabras clave,"A última hora da mañá o equipo de garda foi solicitado polo 112 para intervir en un accidente con feridos na N550 ao seu paso polo concello de valga. Intervén policía local de Valga, garda civil de tráfico e… https://t.co/Jctjy23gNh","['último', 'hora', 'dar', 'mamá', 'equipo', 'guardar', 'foi', 'solicitado', 'polo', '112', 'interviu', 'accidente', 'herido', 'na', 'n550', 'ao', 'seu', 'paso', 'polo', 'concello', 'valer', 'interés', 'policía', 'local', 'valgo', 'guardar', 'civil', 'tráfico']",[],[],0,0,1,1170344024353456130,Emerxencias Terras De Iria,terras_de,2019-09-07 08:32:24,0,50,41,2020-02-24 16:57:50,2020,02,24,16,57,10,Álvaro Obregón,-99.246819712,19.336175562
1232086704254836737,tránsito,palabras clave,"Un #accidente de #tránsito en Manuel m Ponce, Guadalupe Inn, Álvaro Obregón fue reportado a la #CruzRojaMexicana, te recomendamos tener cuidado al transitar en esa zona https://t.co/9hx1aybi0w","['manuel', 'ponce', 'guadalupe', 'inn', 'alvaro', 'obregon', 'reportado', 'recomendar', 'tener', 'cuidado', 'transitar', 'zona']","['accidente', 'tránsito', 'CruzRojaMexicana']",[],1,0,0,476050170,Cruz Roja CDMX,CruzRoja_CDMX,2012-01-27 12:27:33,0,43841,370,2020-02-24 17:35:36,2020,02,24,17,35,10,Álvaro Obregón,-99.246819712,19.336175562
1232092320402694145,tránsito,palabras clave,"Estamos atendiendo en #CruzRojaMexicana un #accidente de #tránsito en Av Insurgentes Norte, Santa María Insurgentes, Cuauhtémoc extrema precacuciones al pasar por ese lugar https://t.co/0PA202369k","['atender', 'av', 'insurgente', 'norte', 'santa', 'maría', 'insurgente', 'cuauhtemoc', 'extremo', 'precaución', 'pasar', 'lugar']","['CruzRojaMexicana', 'accidente', 'tránsito']",[],2,0,0,476050170,Cruz Roja CDMX,CruzRoja_CDMX,2012-01-27 12:27:33,0,43836,370,2020-02-24 17:57:55,2020,02,24,17,57,15,Cuauhtémoc,-99.1490557562,19.4313734294
1232101301653311489,tránsito,coordenadas,"Doña @Claudiashein así el trafico en la ampliación del MB L5, cerca del metro escuadrón 201, pues los ineptos además de confinar el carril izquierdo, permiten que los peceros hagan base en la esquina y solo queda 1 carril, en verdad son unos ineptos de 4ta. https://t.co/YPLZxGuxpy","['doña', 'así', 'trafico', 'ampliación', 'mb', 'l5', 'cerca', 'metro', 'escuadrón', '201', 'pues', 'inepto', 'además', 'confinar', 'carril', 'izquierdo', 'permitir', 'pechero', 'hacer', 'base', 'esquina', 'solo', 'quedar', 'carril', 'verdad', 'inepto', '4to']",[],['Claudiashein'],0,0,0,1049721466445488129,Luis D.,LuisDua21365473,2018-10-09 12:01:15,0,152,283,2020-02-24 18:33:36,2020,02,24,18,33,7,Iztapalapa,-99.1088124,19.3681686
