pubID,topicQuery,typeQuery,tweet,tokens,hashtags,mentions,likeCount,replyCount,retweetCount,authorID,authorName,authorUsername,authorCreatedAt,authorVerified,followersCount,followingCount,pubDate,pubYear,pubMonth,pubDay,pubHour,pubMinute,geoID,geoName,longitude,latitude,validacion
1554534358928834560,tr치nsito,palabras clave,"Autopista #Cuernavaca #Cdmx precauci칩n 丘멆잺 varios autos se est치n regresando en sentido contrario, algo paso a la altura de Colegio militar, la caseta de #Tlalpan no est치 cerrada pero en tr치nsito est치 totalmente detenido.! 
13:30 https://t.co/sh35GArdms","['autopista', 'precauci칩n', 'varios', 'auto', 'regresar', 'contrario', 'paso', 'altura', 'colegio', 'militar', 'caseta', 'cerrado', 'tr치nsito', 'totalmente', 'detenido', '13', '30']","['Cuernavaca', 'Cdmx', 'Tlalpan']",[],29,4,13,315451237,YO LO VI.,Gato_Samm,2011-06-11 16:06:46,0,14946,13,2022-08-02 13:27:27,2022,8,2,13,27,12,Tlalpan,-99.2062207957,19.1983396763,True
1554678446311108608,incendio,palabras clave,"#DenunciaCiudadana 游뚿

Hola, buenas noches. Quiero reportar que hoy hubo un incendio a la altura de Benito Ju치rez en la colonia Universidad alrededor de las siete de la noche en #Toluca, #Edomex. https://t.co/CvQT6pABPV","['hola', 'buenas', 'noches', 'querer', 'reportar', 'hoy', 'incendio', 'altura', 'benito', 'juarez', 'colonia', 'universidad', 'alrededor', 'siete', 'noche']","['DenunciaCiudadana', 'Toluca', 'Edomex']",[],35,1,4,1213235659202125825,Qu칠 Poca Madre 游쓇릖,QuePocaMadreMex,2020-01-03 17:08:24,0,66325,1494,2022-08-02 23:00:00,2022,8,2,23,0,14,Benito Ju치rez,-99.1611346584,19.3806424162,True
1556109342960672769,tr치nsito,palabras clave,"@Claudiashein, @secinfrasljo, lic. Shenbaum es importante poner orden en la av..muyuguarda en Xochimilco, se supone se construy칩 el metrobus con la intenci칩n de no permir los microbuses, que solo causan m치s tr치fico, se pasan el alto, van altas velocidades, haber que hacen https://t.co/WtPVYD1muv","['lic', 'shenbaum', 'importante', 'poner', 'orden', 'av', 'muyuguardo', 'xochimilco', 'suponer', 'construir', 'metrobus', 'intenci칩n', 'permit', 'microb칰s', 'solo', 'causar', 'tr치fico', 'pasar', 'alto', 'ir', 'alto', 'velocidad', 'haber', 'hacen']",[],"['Claudiashein', 'secinfrasljo']",3,0,1,1506810652177977346,Carlos Reyna,CarlosR35340162,2022-03-23 19:51:12,0,0,0,2022-08-06 21:45:53,2022,8,6,21,45,13,Xochimilco,-99.0903636045,19.2451450458,True
1556131985340305408,pirotecnia,palabras clave,"@UCS_GCDMX buenas noches
Si pudieran apoyar con una patrulla o alguien porque andan tronando cohetes y fuegos artificiales. Empezaron desde las 11pm. Aqu칤 en iztapalapa por Rio churubusco y alfonso toro.","['buena', 'noche', 'poder', 'apoyar', 'patrulla', 'alguien', 'andar', 'tornar', 'cohete', 'fuego', 'artificial', 'empezar', '11', 'pm', 'aqu칤', 'iztapalapa', 'rio', 'churubusco', 'alfonso', 'toro']",[],['UCS_GCDMX'],0,0,0,1305557738815025154,YinYan25,yin_yan25,2020-09-14 11:23:23,0,0,8,2022-08-06 23:15:51,2022,8,6,23,15,7,Iztapalapa,-99.0567989642,19.3491663204,True
1556444586796630017,tr치nsito,coordenadas,Alto total debido al evento deportivo de b칠isbol en el Foro Sol. A la altura del metro puebla #trafico #venustianocarranxa #CDMX @NoticiasImagen @RTP_CiudadDeMex https://t.co/CvcVsFhble,"['alto', 'total', 'debido', 'evento', 'deportivo', 'b칠isbol', 'foro', 'sol', 'altura', 'metro', 'puebla']","['trafico', 'venustianocarranxa', 'CDMX']","['NoticiasImagen', 'RTP_CiudadDeMex']",0,0,0,1552889758468153345,Notimex del Valle,NotimexV,2022-07-28 23:32:35,0,17,52,2022-08-07 19:58:01,2022,8,7,19,58,15,Cuauht칠moc,-99.128294,19.4043522,True
1556729819643236359,incendio,palabras clave,"14:50 #Precauci칩nVial | Servicios de emergencia acuden a calle de Francisco D칤az Covarrubias y Circuito Interior Melchor Ocampo, alcald칤a Cuauht칠moc por reporte de incendio. Conduce con precauci칩n y cede el paso. https://t.co/BUaONAhQIL","['14', '50', 'servicio', 'emergencia', 'acudir', 'calle', 'francisco', 'd칤a', 'covarrubias', 'circuito', 'interior', 'melchor', 'ocampo', 'alcald칤a', 'cuauhtemoc', 'reporte', 'incendio', 'conducir', 'precauci칩n', 'ceder', 'paso']",['Precauci칩nVial'],[],1,0,0,166594238,OVIAL_SSCCDMX,OVIALCDMX,2010-07-14 09:00:43,1,1935871,133,2022-08-08 14:51:26,2022,8,8,14,51,15,Cuauht칠moc,-99.1490557562,19.4313734294,True
1557384209416814595,tr치nsito,coordenadas,"@EnlaceTAguilas @LomaAguilassur @PORLASAGUILAS @En_LasAguilas @veclauac Hoy no hubo movimiento para f치cil acceso en periferico enfrente de Televisa y hab칤a demasiado trafico, adem치s hay un bache justo para tomar la lateral de peri bajando de Av Toluca , precauci칩n","['hoy', 'movimiento', 'f치cil', 'acceso', 'perif칠rico', 'enfrente', 'televisar', 'demasiado', 'trafico', 'adem치s', 'bache', 'justo', 'tomar', 'lateral', 'peri', 'bajar', 'av', 'toluca', 'precauci칩n']",[],"['EnlaceTAguilas', 'LomaAguilassur', 'PORLASAGUILAS', 'En_LasAguilas', 'veclauac']",1,1,0,186676248,Alex Garc칤a,AlegrandoGarcia,2010-09-03 20:39:50,0,293,474,2022-08-10 10:11:44,2022,8,10,10,11,15,Cuauht칠moc,-99.259495,19.3863707,True
1557589874202615808,pirotecnia,palabras clave,"@SSC_CDMX Quiero levantar una denuncia por quema de fuegos artificiales en la alcald칤a GAM. He solicitado apoyo de autoridades a trav칠s de la llamada al 911 y jam치s env칤an a las antes mencionadas.
Espero atiendan pronto mi petici칩n, gracias","['querer', 'levantar', 'denuncia', 'quemar', 'fuego', 'artificial', 'alcald칤a', 'gam', 'solicitar', 'apoyo', 'autoridad', 'trav칠s', 'llamado', '911', 'jam치s', 'env칤ar', 'mencionado', 'esperar', 'atender', 'pronto', 'petici칩n', 'gracia']",[],['SSC_CDMX'],0,0,0,581386582,游꼣游붔,GowLopez,2012-05-15 18:42:33,0,46,43,2022-08-10 23:48:59,2022,8,10,23,48,5,Gustavo A. Madero,-99.1158642087,19.5040652077,True
1557838082904309760,incendio,palabras clave,"PRECAUCI칍N: Av. Loma de la Palma hacia la glorieta de pabell칩n Bosques por 游댠 incendio de veh칤culo, Cuajimalpa. 丘멆잺 游뚿","['precauci칩n', 'av', 'loma', 'palma', 'hacia', 'glorieta', 'pabell칩n', 'bosques', 'incendio', 'veh칤culo', 'cuajimalpa']",[],[],16,0,3,87350793,SUUMA Voluntarios 游뚬,SUUMA_CDMX,2009-11-03 21:07:26,0,43180,86,2022-08-11 16:15:16,2022,8,11,16,15,4,Cuajimalpa de Morelos,-99.3107285253,19.3246343001,True
1557983021176856577,tr치nsito,coordenadas,@UCS_GCDMX @LaSEMOVI Su apoyo por favor para que puedan mandar unidad de tr치nsito a Viaducto esquina con Calz. San Antonio Abad. Los autos se meten en reversa para incorporarse a carriles centrales de Viaducto y hacen mucho ruido debido al cuello de botella que se genera. Gracias https://t.co/Iy6cmAhbev,"['apoyo', 'favor', 'poder', 'mandar', 'unidad', 'tr치nsito', 'viaducto', 'esquina', 'call', 'san', 'antonio', 'abad', 'autos', 'meter', 'reversa', 'incorporar 칠l', 'carril', 'central', 'viaducto', 'hacer', 'ruido', 'debido', 'cuello', 'botella', 'generar', 'gracias']",[],"['UCS_GCDMX', 'LaSEMOVI']",0,1,0,276631740,Jos칠 L. M칠ndez L.,LuisJoseloM,2011-04-03 13:18:08,0,169,988,2022-08-12 01:51:12,2022,8,12,1,51,16,Miguel Hidalgo,-99.1843501,19.3998346,True
1558622608857481217,incendio,palabras clave,"@AlcCuauhtemocMx En Tlalpan o avenida San Antonio Abad mero enfrente del hotel Encanto, hay un paso desnivel peatonal sale mucho humo, donde se puede reportar o pueden checar eso @AlcCuauhtemocMx","['tlalpan', 'avenida', 'san', 'antonio', 'abad', 'mero', 'enfrente', 'hotel', 'encanto', 'paso', 'desnivel', 'peatonal', 'salir', 'humo', 'poder', 'reportar', 'poder', 'checar']",[],"['AlcCuauhtemocMx', 'AlcCuauhtemocMx']",0,0,0,1318586201788583936,Sombra Rebelde,rebelde_sombra,2020-10-20 10:13:55,0,2,73,2022-08-13 20:12:42,2022,8,13,20,12,12,Tlalpan,-99.2062207957,19.1983396763,True
1558649455523631105,tr치nsito,palabras clave,"@C5_CDMX Buenas noches.Reporto demasiado tr치fico inusual entre Av Universidad y Gabriel Mancera en la Colonia Acacias. Por lo mismo, hay mucho ruido c/los claxons.

Para + referencia, el conflicto est치 en Metro Coyoac치n, Radio F칩rmula y Plaza Coyoac치n, por favor.춰Muchas gracias!","['buena', 'noche', 'reportar', 'demasiado', 'tr치fico', 'inusual', 'av', 'universidad', 'gabriel', 'mancera', 'colonia', 'acacias', 'mismo', 'ruido', 'claro', 'referencia', 'conflicto', 'metro', 'coyoac치n', 'radio', 'f칩rmula', 'plaza', 'coyoac치n', 'favor', 'mucho', 'gracia']",[],['C5_CDMX'],1,1,0,1281220188952768512,Familia Campos,FamiliaCampos2,2020-07-09 07:35:16,0,18,798,2022-08-13 21:59:23,2022,8,13,21,59,3,Coyoac치n,-99.1503763525,19.3266672536,True
1559342586761986051,pirotecnia,palabras clave,"#AlMomento bloqueo en Tlalpan a la altura del metro General Anaya direcci칩n al Sur, vecinos de la colonia Campestre Churubusco, piden los dejen quemar fuegos artificiales por la festividad de la colonia @SergioyLupita @LupitaJuarezH @heraldo_tv https://t.co/TRe27G7nwo","['bloqueo', 'tlalpan', 'altura', 'metro', 'general', 'anaya', 'direcci칩n', 'sur', 'vecino', 'colonia', 'campestre', 'churubusco', 'pedir', 'dejen', 'quemar', 'fuego', 'artificial', 'festividad', 'colonia']",['AlMomento'],"['SergioyLupita', 'LupitaJuarezH', 'heraldo_tv']",0,3,3,340692103,Javier Ruiz,JAVIERR_RUIZ,2011-07-22 21:23:28,0,6688,191,2022-08-15 19:53:38,2022,8,15,19,53,12,Tlalpan,-99.2062207957,19.1983396763,True
1559350653113221120,tr치nsito,palabras clave,@C5_CDMX hola buenas noches no podr치n quitar a los polic칤as de tr치nsito que est치n moviendo el sem치foro de perif칠rico y calzada Benito Ju치rez alcald칤a Iztapalapa dejan 4 minutos el alto y 30 segundos el siga y hacen m치s tr치fico,"['hola', 'buenas', 'noches', 'poder', 'quitar', 'polic칤a', 'tr치nsito', 'mover', 'sem치foro', 'perif칠rico', 'calzado', 'benito', 'juarez', 'alcald칤a', 'iztapalapa', 'dejar', 'minuto', 'alto', '30', 'segundo', 'siga', 'hacer', 'tr치fico']",[],['C5_CDMX'],0,1,0,119077737,Daniel Moreno,docto9,2010-03-02 10:11:02,0,366,2108,2022-08-15 20:25:41,2022,8,15,20,25,7,Iztapalapa,-99.0567989642,19.3491663204,True
1559369768498565122,incendio,palabras clave,"Alcalde @A_QuinteroMX 쯖u치ndo va tomar cartas en el asunto con tanta explotadera de cuetes en @IztacalcoAl? Es da침ino, tanto contaminaci칩n ambiental como contaminaci칩n auditiva, mi perrita esta sumamente asustada y me arden los ojos de tanto humo. @Claudiashein #Iztacalco #CDMX https://t.co/9V6AkIYfpE","['alcalde', 'cu치ndo', 'ir', 'tomar', 'carta', 'asunto', 'tanto', 'explotadoro', 'contar', 'da침ino', 'contaminaci칩n', 'ambiental', 'contaminaci칩n', 'auditivo', 'perrita', 'sumamente', 'asustado', 'arder', 'ojo', 'humo']","['Iztacalco', 'CDMX']","['A_QuinteroMX', 'IztacalcoAl', 'Claudiashein']",1,0,0,1244157408081072128,Alheli Monz칩n,AlheliMonzon,2020-03-29 01:00:39,0,23,100,2022-08-15 21:41:39,2022,8,15,21,41,6,Iztacalco,-99.094329797,19.396911897,True
1559705066004791300,tr치nsito,palabras clave,@OVIALCDMX Respetuosamente les solicito que no cierren las calles de las colonias Obrera y Algarin que llevan a Tlalpan. El tr치fico que se forma en 5 de febrero genera m치s contaminaci칩n y retraso en una zona llena de baches y sem치foros.,"['respetuosamente', 'solicitar', 'cerrar', 'calle', 'colonia', 'obrero', 'again', 'llevar', 'tlalpan', 'tr치fico', 'forma', 'febrero', 'generar', 'contaminaci칩n', 'retraso', 'zona', 'lleno', 'bache', 'sem치foro']",[],['OVIALCDMX'],1,0,0,38066057,Rebeca Aguilar,RebecaAguilar,2009-05-05 18:33:31,0,207,492,2022-08-16 19:54:00,2022,8,16,19,54,12,Tlalpan,-99.2062207957,19.1983396763,True
1560082731249418241,tr치nsito,coordenadas,"La banqueta llena de 游뚲 justo a lado del letrero de PROHIBIDO estacionarse.

Pero #TransitoGCDMX no llega por culpa de la ciclov칤a que le roba espacio a los 游뚲 y genera tr치fico 游뱌 https://t.co/0nO2P4vaV6","['banqueta', 'lleno', 'justo', 'lado', 'letrero', 'prohibido', 'estacionar 칠l', 'llegar', 'culpa', 'ciclov칤a', 'roba', 'espacio', 'generar', 'tr치fico']",['TransitoGCDMX'],[],1,0,2,87779695,洧냦洧늬 洧쮫롑洧洧눞洧눯洧늭洧눴洧눵洧늬洧 游꾼,elmaugarcia,2009-11-05 14:50:49,0,3157,747,2022-08-17 20:54:42,2022,8,17,20,54,16,Miguel Hidalgo,-99.180678,19.444937,True
1560111948313894913,tr치nsito,palabras clave,"@ClaraBrugadaM @Alc_Iztapalapa Hola Clara 游녧游낕, que bien por esos vecinos. Oye Atiende por favor el tema del tianguis que se pone todos los d칤as en Av. Rev. Social en la colonia Vicente Guerrero. Incluidas chelerias 游꽅 y ruido hasta altas horas de la noche. Basura, ruido, tr치fico impacto terrible. Gracias","['hola', 'clara', 'bien', 'vecinos', 'oye', 'atiende', 'favor', 'tema', 'tianguis', 'poner', 'd칤a', 'av', 'rev', 'social', 'colonia', 'vicente', 'guerrero', 'incluir', 'cheleria', 'ruido', 'alto', 'hora', 'noche', 'basura', 'ruido', 'tr치fico', 'impacto', 'terrible', 'gracia']",[],"['ClaraBrugadaM', 'Alc_Iztapalapa']",1,1,0,192763969,Miguel L G,Miquellpz,2010-09-19 20:32:44,0,54,133,2022-08-17 22:50:48,2022,8,17,22,50,7,Iztapalapa,-99.0567989642,19.3491663204,True
1560267991232655365,tr치nsito,coordenadas,"Polic칤as de ""tr치nsito"" y veh칤culos oficiales y del ej칠rcito, creando caos enfrente de palacio municipal de @GobNeza poniendo el ""ejemplo"" de c칩mo estacionarse en lugar prohibido, atenci칩n @Adolfo_Cerqueda https://t.co/0Fk5fNHYrH","['polic칤a', 'tr치nsito', 'veh칤culo', 'oficial', 'ej칠rcito', 'crear', 'cao', 'enfrente', 'palacio', 'municipal', 'poner', 'ejemplo', 'c칩mo', 'estacionar 칠l', 'lugar', 'prohibido', 'atenci칩n']",[],"['GobNeza', 'Adolfo_Cerqueda']",0,0,0,1497801791131500548,Fernando Alcal치,Fernand29702334,2022-02-26 23:12:51,0,4,116,2022-08-18 09:10:52,2022,8,18,9,10,7,Iztapalapa,-99.067766,19.3668621,True
1560336344655839233,tr치nsito,coordenadas,@Luis_GQM Luis le suplicamos de la manera m치s atenta nos apoye para evitar se estacionen frente a la Secund #91. Es un lugar prohibido seg칰n el reglamento de transito y no dejan  espacio para poder entrar a nuestra cochera @ALaMagdalenaC @CesacContreras @UCS_GCDMX @SanJeronimodf https://t.co/9Yl95CCEnk,"['luis', 'duplicado', 'manera', 'atento', 'apoye', 'evitar', 'estaci칩n', 'frente', 'second', 'lugar', 'prohibido', 'seg칰n', 'reglamento', 'transito', 'dejar', 'espacio', 'poder', 'entrar', 'cochera']",['91'],"['Luis_GQM', 'ALaMagdalenaC', 'CesacContreras', 'UCS_GCDMX', 'SanJeronimodf']",1,3,1,1047863728895643653,Art칬rius,Artoriusgg,2018-10-04 08:59:16,0,20,84,2022-08-18 13:42:28,2022,8,18,13,42,3,Coyoac치n,-99.2229172041428,19.320425965567896,True
1560786527122325504,tr치nsito,coordenadas,"@GobNau unidad de tr치nsito sobre la banqueta, autos estacionados en lugar prohibido, veh칤culos sin placas y motociclistas sin casco pasando frente al agente. Ingenieros militares esq. San Joaqu칤n. Unidad 3244 https://t.co/Jf3aJn8BY6","['unidad', 'tr치nsito', 'banqueta', 'auto', 'estacionado', 'lugar', 'prohibido', 'veh칤culo', 'placa', 'motociclista', 'casco', 'pasar', 'frente', 'agente', 'ingeniero', 'militar', 'esq', 'san', 'joaquin', 'unidad', '3244']",[],['GobNau'],2,0,2,1448047270599999489,El Poche,pochelas,2021-10-12 16:06:07,0,3,10,2022-08-19 19:31:20,2022,8,19,19,31,15,Cuauht칠moc,-99.259495,19.3863707,True
1560804928825823232,tr치nsito,palabras clave,Disputa por pante칩n de San Gregorio Atlapulco provoca protesta y desquicia tr치fico en Xochimilco. Integrantes de @CPByCXochimilco acusan intervenci칩n ilegal de @JoseCarlosXoch https://t.co/RrpWFEOm6p,"['disputa', 'pante칩n', 'san', 'gregorio', 'acapulco', 'provocar', 'protesta', 'desquiciado', 'tr치fico', 'xochimilco', 'integrante', 'acusar', 'intervenci칩n', 'ilegal']",[],"['CPByCXochimilco', 'JoseCarlosXoch']",1,0,0,1546536676369043457,Capital CDMX,Capital_CDMX,2022-07-11 10:48:28,0,95,82,2022-08-19 20:44:28,2022,8,19,20,44,13,Xochimilco,-99.0903636045,19.2451450458,True
1561452858226139136,tr치nsito,palabras clave,"@UCS_GCDMX @OVIALCDMX Se solicita gr칰a, multa y corral칩n conforme al reglamento de tr치nsito en vigencia actual para el veh칤culo blanco que est치 estacionado en lugar prohibido NUEVAMENTE en la esquina de calle Niza 22 con Trujillo en col sn 츼lvaro alcald칤a Azcapotzalco. Gracias","['solicitar', 'gr칰a', 'multa', 'coraz칩n', 'conforme', 'reglamento', 'tr치nsito', 'vigencia', 'actual', 'veh칤culo', 'blanco', 'estacionado', 'lugar', 'prohibido', 'nuevamente', 'esquina', 'calle', 'niza', '22', 'trujillo', 'col', 'sn', 'alvaro', 'alcald칤a', 'azcapotzalco', 'gracias']",[],"['UCS_GCDMX', 'OVIALCDMX']",3,3,1,1400891934474899460,Xavier Nava,XavierNava13,2021-06-04 13:07:51,0,47,102,2022-08-21 15:39:06,2022,8,21,15,39,2,Azcapotzalco,-99.1821069423,19.4853286147,True
1561538631831019520,incendio,palabras clave,"@giogutierrezag hay mucho humo en la colonia Xotepingo alcald칤a Coyoac치n un olor a p칩lvora muy fuerte o a pl치stico quemado, el grupo de vecinos de esta colonia no responde, sabe si tienen fiesta en la Candelaria qu칠 puedan ser lo responsables de esta gran contaminaci칩n nocturna?","['humo', 'colonia', 'xotepingo', 'alcald칤a', 'coyoac치n', 'olor', 'p칩lvora', 'fuerte', 'pl치stico', 'quemado', 'grupo', 'vecino', 'colonia', 'responder', 'saber', 'si', 'fiesta', 'candelaria', 'poder', 'ser', 'responsable', 'gran', 'contaminaci칩n', 'nocturno']",[],['giogutierrezag'],0,0,0,781585369,bnice,bjmv791,2012-08-25 21:19:04,0,43,292,2022-08-21 21:19:56,2022,8,21,21,19,3,Coyoac치n,-99.1503763525,19.3266672536,True
1562048924143304704,tr치nsito,palabras clave,"@LizHernandezE @TlalpanSoy @SacmexCDMX @TlalpanAl @SOBSECDMX @GobCDMX @alfagonzalezm @TlalpanVecinos En la calle de Clavijero esquina con Fray Servando colonia Esperanza alcald칤a Cuauht칠moc casi todo el d칤a es un caos por el tr치nsito, parece que no pueden cerrar Clavijero y utilizar v칤as alternas. Provoca contaminaci칩n!!","['calle', 'clavijero', 'esquina', 'fray', 'servando', 'colonia', 'esperanza', 'alcald칤a', 'cuauhtemoc', 'casi', 'd칤a', 'cao', 'tr치nsito', 'parecer', 'poder', 'cerrar', 'clavijero', 'utilizar', 'v칤a', 'alterno', 'provocar', 'contaminaci칩n']",[],"['LizHernandezE', 'TlalpanSoy', 'SacmexCDMX', 'TlalpanAl', 'SOBSECDMX', 'GobCDMX', 'alfagonzalezm', 'TlalpanVecinos']",0,0,0,1466105830206541831,Diego16춽,DiegoDi82474805,2021-12-01 12:04:24,0,4,119,2022-08-23 07:07:39,2022,8,23,7,7,15,Cuauht칠moc,-99.1490557562,19.4313734294,True
1562932322781073408,incendio,palabras clave,"17:37 #Precauci칩nVial | Servicios de emergencia acuden a San Francisco y San Gabriel,  col. Santa 칔rsula Coapa, alcald칤a Coyoac치n, por reporte de incendio. Conduce con precauci칩n y cede el paso. https://t.co/SYwMezvIGg","['17', '37', 'servicio', 'emergencia', 'acudir', 'san', 'francisco', 'san', 'gabriel', 'col', 'santa', 'ursula', 'copa', 'alcald칤a', 'coyoac치n', 'reporte', 'incendio', 'conducir', 'precauci칩n', 'ceder', 'paso']",['Precauci칩nVial'],[],6,0,1,166594238,OVIAL_SSCCDMX,OVIALCDMX,2010-07-14 09:00:43,1,1935869,133,2022-08-25 17:37:58,2022,8,25,17,37,3,Coyoac치n,-99.1503763525,19.3266672536,True
1563989359879127050,tr치nsito,palabras clave,"@OVIALCDMX @UCS_GCDMX @SSC_CDMX solicito que oficiales de transito muevan este vehiculo de mi zaguan no pude salir...capulines 22, pueblo nuevo alto, magdalena contreras, 10630, ya es repetitivo no respetan el lugar https://t.co/KdhsfU9i3U","['solicitar', 'oficial', 'transito', 'muevan', 'vehiculo', 'zaguan', 'poder', 'salir', 'capucinus', '22', 'pueblo', 'nuevo', 'alto', 'magdalena', 'contreras', '10630', 'repetitivo', 'respetar', 'lugar']",[],"['OVIALCDMX', 'UCS_GCDMX', 'SSC_CDMX']",0,2,0,85440890,Dragoncito 游낼,iserrano59,2009-10-26 16:57:20,0,83,719,2022-08-28 15:38:15,2022,8,28,15,38,8,La Magdalena Contreras,-99.2684129061,19.2689765031,True
1564304733493501952,tr치nsito,palabras clave,@UCS_GCDMX @Charlyrv13 @UnVasoDeLALA @Alc_Iztapalapa @ClaraBrugadaM Los de tr치nsito y los de Los sem치foros no est치n trabajando yo reporte dos sem치foros que los vengan a componer y tres carros infringiendo la ley estacionados en lugar prohibido y asta ahorita los sigo esperando me imagino que vienen de rodillas @OVIALCDMX,"['tr치nsito', 'sem치foro', 'trabajar', 'reporte', 'dos', 'sem치foro', 'vengan', 'componer', 'tres', 'carro', 'infringir', 'ley', 'estacionado', 'lugar', 'prohibido', 'asta', 'ahorita', 'seguir', 'esperar', 'imaginar', 'venir', 'rodilla']",[],"['UCS_GCDMX', 'Charlyrv13', 'UnVasoDeLALA', 'Alc_Iztapalapa', 'ClaraBrugadaM', 'OVIALCDMX']",0,1,0,1088717623171469312,Artemio,Artemio97939139,2019-01-25 02:38:03,0,73,514,2022-08-29 12:31:26,2022,8,29,12,31,7,Iztapalapa,-99.0567989642,19.3491663204,True
1564686460963495938,tr치nsito,palabras clave,@AdrianRubalcava @Cuajimalpa_DPC @Cuajimalpa_SuVe Por que permiten que estos se estacionen aqu칤 cuando claramente est치 prohibido? a parte hacen mucho tr치fico @OVIALCDMX @UCS_GCDMX https://t.co/5C4SWCwHpi,"['permitir', 'estaci칩n', 'aqu칤', 'claramente', 'prohibido', 'parte', 'hacer', 'tr치fico']",[],"['AdrianRubalcava', 'Cuajimalpa_DPC', 'Cuajimalpa_SuVe', 'OVIALCDMX', 'UCS_GCDMX']",0,1,0,1243614880776605696,elde,56_Numa,2020-03-27 13:04:35,0,63,488,2022-08-30 13:48:17,2022,8,30,13,48,4,Cuajimalpa de Morelos,-99.3107285253,19.3246343001,True
1564782505861021696,tr치nsito,coordenadas,@RedVialRC mucho tr치fico en Cervantes Saavedra esta en alto total todos los coches de moliere direcci칩n perif칠rico,"['tr치fico', 'cervant', 'saavedra', 'alto', 'total', 'coche', 'moler', 'direcci칩n', 'perif칠rico']",[],['RedVialRC'],0,1,0,1283230215590871040,Carlos Rodolfo,carlosrodolfo31,2020-07-14 20:42:08,0,134,1113,2022-08-30 20:09:56,2022,8,30,20,9,15,Cuauht칠moc,-99.259495,19.3863707,True
1565052657965858819,tr치nsito,coordenadas,Coches estacionados en lugar prohibido ! La calle es dos sentidos y no se puede pasar ! Y todav칤a no salen los de las escuelas al rededor !!@OVIALCDMX @SSPCMexico @OVIALCDMX @transito_CDMX https://t.co/gySSmp2ZZF,"['coche', 'estacionado', 'lugar', 'prohibido', 'calle', 'dos', 'poder', 'pasar', 'todav칤a', 'salir', 'escuela', 'rededor']",[],"['OVIALCDMX', 'SSPCMexico', 'OVIALCDMX', 'transito_CDMX']",0,0,0,126148619,ramirez,mlmaramirez,2010-03-24 18:11:40,0,17,107,2022-08-31 14:03:25,2022,8,31,14,3,12,Tlalpan,-99.13207590534051,19.28946896101617,True
